Movie_id,Title,Director,Actor1,Actor2,Actor3,Genre,Overview,Ratings,Votes,Year
326285,American Pastoral,Ewan McGregor,Ewan McGregor,Jennifer Connelly,Dakota Fanning,Crime Drama,"Set in postwar America, a man watches his seemingly perfect life fall apart as his daughter's new political affiliation threatens to destroy their family.",6.1,17823,2016
207932,Inferno,Ron Howard,Tom Hanks,Felicity Jones,Irrfan Khan,Mystery Thriller Action,"After waking up in a hospital with amnesia, professor Robert Langdon and a doctor must race against time to foil a deadly global plot.",6.2,186396,2016
284052,Doctor Strange,Scott Derrickson,Benedict Cumberbatch,Chiwetel Ejiofor,Rachel McAdams,Action Adventure Fantasy,"After his career is destroyed, a brilliant but arrogant surgeon gets a new lease on life when a sorcerer takes him under her wing and trains him to defend the world against evil.",7.5,788459,2016
136799,Trolls,Mike Mitchell,Zooey Deschanel,Anna Kendrick,Justin Timberlake,Family Animation Fantasy Adventure Comedy Music,"From the creators of Shrek comes the most smart, funny, irreverent animated comedy of the year, DreamWorks' Trolls. This holiday season, enter a colorful, wondrous world populated by hilariously unforgettable characters and discover the story of the overly optimistic Trolls, with a constant song on their lips, and the comically pessimistic Bergens, who are only happy when they have trolls in their stomach. Featuring original music from Justin Timberlake, and soon-to-be classic mash-ups of songs from other popular artists, the film stars the voice talents of Anna Kendrick, Justin Timberlake, Russell Brand, James Corden, Kunal Nayyar, Ron Funches, Icona Pop, Gwen Stefani, and many more. DreamWorks' TROLLS is a fresh, broad comedy filled with music, heart and hair-raising adventures. In November of 2016, nothing can prepare you for our new Troll world.",6.4,89374,2016
324786,Hacksaw Ridge,Mel Gibson,Andrew Garfield,Sam Worthington,Luke Bracey,Drama History War,"WWII American Army Medic Desmond T. Doss, who served during the Battle of Okinawa, refuses to kill people and becomes the first Conscientious Objector in American history to receive the Congressional Medal of Honor.",8.1,574007,2016
339419,Loving,Jeff Nichols,Joel Edgerton,Ruth Negga,Marton Csokas,Drama Romance,"The story of Richard and Mildred Loving, an interracial couple, whose challenge of their anti-miscegenation arrest for their marriage in Virginia led to a legal battle that would end at the US Supreme Court.",7,36005,2016
374052,The Love Witch,Anna Biller,Samantha Robinson,Gian Keys,Laura Waddell,Comedy Horror Romance,"A modern-day witch uses spells and magic to get men to fall in love with her, with deadly consequences.",6.2,19111,2016
329865,Arrival,Denis Villeneuve,Amy Adams,Jeremy Renner,Forest Whitaker,Drama Sci-Fi Mystery,"Taking place after alien crafts land around the world, an expert linguist is recruited by the military to determine whether they come in peace or are a threat.",7.9,745997,2016
293767,Billy Lynn's Long Halftime Walk,Ang Lee,Joe Alwyn,Kristen Stewart,Chris Tucker,Drama War,19-year-old Billy Lynn is brought home for a victory tour after a harrowing Iraq battle. Through flashbacks the film shows what really happened to his squad √É¬¢√Ç¬Ä√Ç¬ì contrasting the realities of war with America's perceptions.,6.2,23765,2016
340402,Almost Christmas,David E. Talbert,Kimberly Elise,Danny Glover,John Michael Higgins,Comedy Drama,"Walter Meyer is a retired mechanic who lost the love of his life one year earlier. Now that the holiday season is here, he invites daughters Rachel and Cheryl and sons Christian and Evan to his house for a traditional celebration. Poor Walter soon realizes that if his bickering children and the rest of the family can spend five days together under the same roof, it will truly be a Christmas miracle.",6.1,7509,2016
629015,Shut In,Farren Blackburn,Naomi Watts,Oliver Platt,Charlie Heaton,Thriller Horror Drama,A young single mother is held captive along with her two children by a violent ex and must plot their escape before it√É¬¢√Ç¬Ä√Ç¬ôs too late.,4.8,14555,2016
259316,Fantastic Beasts and Where to Find Them,David Yates,Colin Farrell,Eddie Redmayne,Katherine Waterston,Fantasy Adventure Family,"In 1926, Newt Scamander arrives at the Magical Congress of the United States of America with a magically expanded briefcase, which houses a number of dangerous creatures and their habitats. When the creatures escape from the briefcase, it sends the American wizarding authorities after Newt, and threatens to strain even further the state of magical and non-magical relations.",7.2,498889,2016
376660,The Edge of Seventeen,Kelly Fremon Craig,Hailee Steinfeld,Woody Harrelson,Kyra Sedgwick,Comedy Drama,"Two high school girls are best friends until one dates the other's older brother, who is totally his sister's nemesis.",7.3,137195,2016
332979,Bleed for This,Ben Younger,Miles Teller,Aaron Eckhart,Katey Sagal,Drama,"The inspirational story of World Champion Boxer Vinny Pazienza, who after a near fatal car crash, which left him not knowing if he'd ever walk again, made one of sports most incredible comebacks.",6.8,29196,2016
334541,Manchester by the Sea,Kenneth Lonergan,Lucas Hedges,Casey Affleck,Michelle Williams,Drama,"After his older brother passes away, Lee Chandler is forced to return home to care for his 16-year-old nephew. There he is compelled to deal with a tragic past that separated him from his family and the community where he was born and raised.",7.8,302600,2016
1108427,Moana,John Musker,Auli'i Cravalho,Dwayne Johnson,Rachel House,Adventure Comedy Family Fantasy,"In Ancient Polynesia, when a terrible curse incurred by Maui reaches the island of an impetuous Chieftain, his willful daughter answers the Ocean's call to seek out the demigod to set things right.",7.6,365505,2016
369885,Allied,Robert Zemeckis,Brad Pitt,Marion Cotillard,Jared Harris,Action Drama War Romance Thriller,"In 1942, an intelligence officer in North Africa encounters a female French Resistance fighter on a deadly mission behind enemy lines. When they reunite in London, their relationship is tested by the pressures of war.",7.1,165410,2016
338964,Bad Santa 2,Mark Waters,Billy Bob Thornton,Kathy Bates,Tony Cox,Comedy Crime Drama Mystery,"Fueled by cheap whiskey, greed and hatred, Willie Soke teams up with his angry little sidekick, Marcus, to knock off a Chicago charity on Christmas Eve. Along for the ride is chubby and cheery Thurman Merman, a 250-pound ray of sunshine who brings out Willie's sliver of humanity. Issues arise when the pair are joined by Willie's horror story of a mother, who raises the bar for the gang's ambitions, while somehow lowering the standards of criminal behavior.",5.6,27366,2016
291328,Rules Don't Apply,Warren Beatty,Warren Beatty,Annette Bening,Matthew Broderick,Romance Comedy Drama,"It's Hollywood, 1958. Small town beauty queen and devout Baptist virgin Marla Mabrey, under contract to the infamous Howard Hughes, arrives in Los Angeles. At the airport, she meets her driver Frank Forbes, who is engaged to be married to his seventh grade sweetheart and is a deeply religious Methodist. Their instant attraction not only puts their religious convictions to the test, but also defies Hughes' number one rule: No employee is allowed to have any relationship whatsoever with a contract actress. Hughes' behavior intersects with Marla and Frank in very separate and unexpected ways, and as they are drawn deeper into his bizarre world, their values are challenged and their lives are changed.",5.7,11542,2016
241258,Incarnate,Brad Peyton,Aaron Eckhart,Carice van Houten,Catalina Sandino Moreno,Horror Thriller,An exorcist comes up against an evil from his past when he uses his skills to enter the mind of a nine year old boy.,5.3,14008,2016
313369,La La Land,Damien Chazelle,Ryan Gosling,Emma Stone,John Legend,Comedy Drama Romance Music,"Mia, an aspiring actress, serves lattes to movie stars in between auditions and Sebastian, a jazz musician, scrapes by playing cocktail party gigs in dingy bars, but as success mounts they are faced with decisions that begin to fray the fragile fabric of their love affair, and the dreams they worked so hard to maintain in each other threaten to rip them apart.",8,643669,2016
384682,Office Christmas Party,Will Speck,Jason Bateman,Olivia Munn,T. J. Miller,Comedy,"When Carol Vanstone, CEO of the technology company Zenotek, expresses her intention to close the Chicago branch, run by her brother Clay, he and his co-workers organize a Christmas party in an effort to impress a potential client and save their jobs. But the party gets out of control√É¬¢√Ç¬Ä√Ç¬¶",5.9,84713,2016
345920,Collateral Beauty,David Frankel,Will Smith,Edward Norton,Keira Knightley,Drama Romance,"Retreating from life after a tragedy, a man questions the universe by writing to Love, Time and Death. Receiving unexpected answers, he begins to see how these things interlock and how even loss can reveal moments of meaning and beauty.",6.8,103808,2016
393457,Fences,Denzel Washington,Denzel Washington,Viola Davis,Mykelti Williamson,Drama,"In 1950s Pittsburgh, a frustrated African-American father struggles with the constraints of poverty, racism, and his own inner demons as he tries to raise a family.",7.2,115667,2016
330459,Rogue One: A Star Wars Story,Gareth Edwards,Felicity Jones,Diego Luna,Ben Mendelsohn,Action Adventure Sci-Fi,A rogue band of resistance fighters unite for a mission to steal the Death Star plans and bring a new hope to the galaxy.,7.8,674052,2016
310307,The Founder,John Lee Hancock,Michael Keaton,Nick Offerman,John Carroll Lynch,Drama History,"The true story of how Ray Kroc, a salesman from Illinois, met Mac and Dick McDonald, who were running a burger operation in 1950s Southern California. Kroc was impressed by the brothers√É¬¢√Ç¬Ä√Ç¬ô speedy system of making the food and saw franchise potential. He maneuvered himself into a position to be able to pull the company from the brothers and create a billion-dollar empire.",7.2,169828,2016
121856,Assassin's Creed,Justin Kurzel,Michael Fassbender,Marion Cotillard,Jeremy Irons,Action Adventure Sci-Fi,"Through unlocked genetic memories that allow him to relive the adventures of his ancestor in 15th century Spain, Callum Lynch discovers he's a descendant of the secret 'Assassins' society. After gaining incredible knowledge and skills, he is now poised to take on the oppressive Knights Templar in the present day.",5.6,206630,2016
274870,Passengers,Morten Tyldum,Jennifer Lawrence,Chris Pratt,Michael Sheen,Drama Romance Sci-Fi,"A spacecraft traveling to a distant colony planet and transporting thousands of people has a malfunction in its sleep chambers. As a result, two passengers are awakened 90 years early.",7,435243,2016
335797,Sing,Garth Jennings,Matthew McConaughey,Reese Witherspoon,Seth MacFarlane,Animation Comedy Family Music,A koala named Buster recruits his best friend to help him drum up business for his theater by hosting a singing competition.,7.1,185916,2016
388399,Patriots Day,Peter Berg,Mark Wahlberg,Kevin Bacon,John Goodman,Action Crime Drama History Thriller,"In the aftermath of an unspeakable act of terror, Police Sergeant Tommy Saunders joins courageous survivors, first responders and investigators in a race against the clock to hunt down the Boston Marathon bombers before they strike again.",7.3,110476,2016
258230,A Monster Calls,J. A. Bayona,Sigourney Weaver,Felicity Jones,Toby Kebbell,Drama Fantasy,A boy imagines a monster that helps him deal with his difficult life and see the world in a different way.,7.4,92085,2016
68730,Silence,Martin Scorsese,Liam Neeson,Andrew Garfield,Adam Driver,Drama History,"Two Jesuit priests travel to seventeenth century Japan which has, under the Tokugawa shogunate, banned Catholicism and almost all foreign contact.",7.2,120418,2016
356305,Why Him?,John Hamburg,James Franco,Bryan Cranston,Zoey Deutch,Comedy,A dad forms a bitter rivalry with his daughter's young rich boyfriend.,6.2,121445,2016
381284,Hidden Figures,Theodore Melfi,Taraji P. Henson,Octavia Spencer,Kevin Costner,Drama History,"The untold story of Katherine G. Johnson, Dorothy Vaughan and Mary Jackson √É¬¢√Ç¬Ä√Ç¬ì brilliant African-American women working at NASA and serving as the brains behind one of the greatest operations in history √É¬¢√Ç¬Ä√Ç¬ì the launch of astronaut John Glenn into orbit. The visionary trio crossed all gender and race lines to inspire generations to dream big.",7.8,247660,2016
259695,Live by Night,Ben Affleck,Ben Affleck,Sienna Miller,Chris Messina,Crime Drama Thriller,"A group of Boston-bred gangsters set up shop in balmy Florida during the Prohibition era, facing off against the competition and the Ku Klux Klan.",6.4,59213,2016
370755,Paterson,Jim Jarmusch,Adam Driver,Golshifteh Farahani,Barry Shabaka Henley,Drama Romance Comedy,"A week in the life of Paterson, a poet bus driver, and his wife Laura, a very creative artist, who live in Paterson, New Jersey, hometown of many famous poets and artists.",7.3,87268,2016
