Movie_id,Title,Director,Actor1,Actor2,Actor3,Genre,Overview,Ratings,Votes,Year
406563,Insidious: The Last Key,Adam Robitel,Lin Shaye,Angus Sampson,Leigh Whannell,Horror Mystery Thriller,"Parapsychologist Elise Rainier and her team travel to Five Keys, NM, to investigate a man√É¬¢√Ç¬Ä√Ç¬ôs claim of a haunting. Terror soon strikes when Rainier realizes that the house he lives in was her family√É¬¢√Ç¬Ä√Ç¬ôs old home.",5.7,69807,2018
426258,The Strange Ones,Lauren Wolkstein,Alex Pettyfer,James Freedson-Jackson,Emily Althaus,Thriller Drama,"Mysterious events surround the travels of two brothers as they make their way across a remote American landscape. On the surface all seems normal, but what appears to be a simple vacation soon gives way to a dark and complex web of secrets. This is the feature film version of the 2011 short film going by the same name.",5.1,2794,2018
348389,Stratton,Simon West,Dominic Cooper,Austin Stowell,Gemma Chan,Action Thriller,A British Special Boat Service commando tracks down an international terrorist cell.,4.8,5535,2018
468210,Sweet Country,Warwick Thornton,Bryan Brown,Sam Neill,Hamilton Morris,Western Crime Thriller Drama,"In 1929, an Australian Aboriginal stockman kills a white station owner in self-defense and goes on the lam, pursued by a posse.",7.3,26,2018
399035,The Commuter,Jaume Collet-Serra,Liam Neeson,Vera Farmiga,Patrick Wilson,Action Thriller Mystery,"A businessman, on his daily commute home, gets unwittingly caught up in a criminal conspiracy that threatens not only his life but the lives of those around him.",6.3,122771,2018
442064,Proud Mary,Babak Najafi,Taraji P. Henson,Billy Brown,Danny Glover,Thriller Action Crime,"Mary is a hit woman working for an organized crime family in Boston, whose life is completely turned around when she meets a young boy whose path she crosses when a professional hit goes bad.",5,10451,2018
479040,Acts of Violence,Brett Donowho,Bruce Willis,Cole Hauser,Shawn Ashmore,Action Crime Thriller,"When his fiancee is kidnapped by human traffickers, Roman and his ex-military brothers set out to track her down and save her before it is too late. Along the way, Roman teams up with Avery, a cop investigating human trafficking and fighting the corrupt bureaucracy that has harmful intentions.",5.3,13185,2018
440424,Freak Show,Trudie Styler,Alex Lawther,Abigail Breslin,Bette Midler,Comedy Drama,"The story of teenager Billy Bloom who, despite attending an ultra conservative high school, makes the decision to run for homecoming queen.",6.5,4518,2018
460216,Humor Me,Sam Hoffman,Jemaine Clement,Elliott Gould,Ingrid Michaelson,Comedy,"With an interminable case of writer's block and a personal family crisis, playwright Nate is forced to move into his father's retirement community.",6.1,1370,2018
436355,Vazante,Daniela Thomas,Adriano Carvalho,Luana Nastas,Sandra Corveloni,Drama,"Brazil 1821. Upon his return to the imposing farmhouse, Antonio, a rich cattle herder, finds out that his wife dies in labor. Forced to live in the property with numerous African slaves, he marries his wife's niece. A restless soul, he returns to droving, leaving his young wife behind alone with the slaves.",6.4,663,2018
430447,Mary and the Witch's Flower,Hiromasa Yonebayashi,Ruby Barnhill,Louis Ashbourne Serkis,Kate Winslet,Fantasy Adventure Animation Family,"Mary Smith, a young girl who lives with her great-aunt in the countryside, follows a mysterious cat into the nearby forest where she finds a strange flower and an old broom, none of which is as ordinary as it seems.",6.8,15655,2018
429351,12 Strong,Nicolai Fuglsig,Chris Hemsworth,Michael Shannon,Michael Pe√É¬±a,War Drama Action History,A team of special forces head into Afghanistan in the aftermath of the September 11th attacks in an attempt to dismantle the Taliban.,6.5,89527,2018
449443,Den of Thieves,Christian Gudegast,Gerard Butler,Meadow Williams,Pablo Schreiber,Action Thriller Crime,A gritty crime saga which follows the lives of an elite unit of the LA County Sheriff's Dept. and the state's most successful bank robbery crew as the outlaws plan a seemingly impossible heist on the Federal Reserve Bank.,7,120859,2018
417261,Forever My Girl,Bethany Ashton Wolf,Alex Roe,Jessica Rothe,Abby Ryder Fortson,Romance Drama Music,"After being gone for a decade, a country star returns home to the love he left behind.",6.6,20561,2018
435663,Thane of East County,Jesse Keller,Carr Cavender,Molly Beucher,Connor Sullivan,Drama Thriller,"A backstage romance leads a pair of actors down a dark path, as they discover their lives beginning to mirror the story of Shakespeare's bloodiest play.",6.6,27,2018
336843,Maze Runner: The Death Cure,Wes Ball,Dylan O'Brien,Kaya Scodelario,Thomas Brodie-Sangster,Sci-Fi Action Adventure Thriller,"Thomas leads his group of escaped Gladers on their final and most dangerous mission yet. To save their friends, they must break into the legendary Last City, a WCKD-controlled labyrinth that may turn out to be the deadliest maze of all. Anyone who makes it out alive will get answers to the questions the Gladers have been asking since they first arrived in the maze.",6.2,156924,2018
36593,The Insult,Ziad Doueiri,Adel Karam,Camille Salameh,Kamel El Basha,Comedy Crime,"Frank Drebin is persuaded out of retirement to go undercover in a state prison. There he has to find out what top terrorist, Rocco, has planned for when he escapes. Adding to his problems, Frank's wife, Jane, is desperate for a baby.",5.3,411,2018
338768,Please Stand By,Ben Lewin,Dakota Fanning,Toni Collette,Alice Eve,Comedy Drama,"A young autistic woman runs away from her caregiver in order to boldly go and deliver her 500-page Star Trek script to a writing competition in Hollywood. On an adventure full of laughter and tears, Wendy follows the guiding spirit of Mr. Spock on her journey into the unknown.",6.7,14923,2018
416234,Winchester,The Spierig Brothers,Helen Mirren,Jason Clarke,Sarah Snook,Horror Thriller,"San Jose, California, 1906. Isolated in her labyrinthine mansion, eccentric firearm heiress Sarah Winchester believes that she is being haunted by the souls of those killed by the guns manufactured by her company.",5.4,36167,2018
429191,A Fantastic Woman,Sebasti√°n Lelio,Daniela Vega,Francisco Reyes,Luis Gnecco,Drama,"Marina's life is thrown into turmoil following the death of her partner. Mourning the loss of the man she loved, she finds herself under intense scrutiny from those with no regard for her privacy.",7.2,27003,2018
483315,Armed,Mario Van Peebles,Mario Van Peebles,William Fichtner,Ryan Guzman,Action Thriller,A former U.S. marshal discovers that all of the survivors of his old unit are experiencing the same symptoms simultaneously and there may be a larger conspiracy at hand.,3.5,493,2018
384521,The Cloverfield Paradox,Julius Onah,Daniel Br¸hl,Elizabeth Debicki,Aksel Hennie,Horror Sci-Fi Action Thriller,"Orbiting above a planet on the brink of war, scientists test a device to solve an energy crisis and end up face-to-face with a dark alternate reality.",5.5,111266,2018
497269,Bad Apples,Bryan Coyne,Brea Grant,Graham Skipper,Aly Fitzgerald,Horror,"It's Halloween night, and two bad apples decide to play some wicked tricks on the one house in a suburban cul-de-sac that is not celebrating Halloween. They terrorize a young couple in their home and these tricks become increasingly more sinister as the night progresses, finally ending in a Halloween the entire neighborhood will never forget.",3.2,1801,2018
381719,Peter Rabbit,Will Gluck,James Corden,Domhnall Gleeson,Rose Byrne,Animation Adventure Family,Peter Rabbit's feud with Mr. McGregor escalates to greater heights than ever before as they rival for the affections of the warm-hearted animal lover who lives next door.,6.6,46758,2018
337167,Fifty Shades Freed,James Foley,Dakota Johnson,Jamie Dornan,Kim Basinger,Drama Romance,"Believing they have left behind shadowy figures from their past, newlyweds Christian and Ana fully embrace an inextricable connection and shared life of luxury. But just as she steps into her role as Mrs. Grey and he relaxes into an unfamiliar stability, new threats could jeopardize their happy ending before it even begins.",4.5,71926,2018
453201,The 15:17 to Paris,Clint Eastwood,Anthony Sadler,Alek Skarlatos,Spencer Stone,Drama Thriller,"On Aug. 21, 2015, the world watches in stunned silence as the media reports a thwarted terrorist attack on a train that's bound for Paris -- an attempt prevented by three young Americans traveling together through Europe. The heroic and courageous actions of Anthony Sadler, Alek Skarlatos and Spencer Stone help to save the lives of more than 500 passengers on board.",5.3,35153,2018
498919,La Boda de Valentina,Marco Polo Constandse,Omar Chaparro,Marimar Vega,Ryan Carnes,Comedy,Valentina's seemingly idyllic life in the US is interrupted when planning a wedding means introducing her fianc√É¬É√Ç¬© to her scandalous family in Mexico.,4.7,735,2018
390059,Permission,Brian Crano,Rebecca Hall,Dan Stevens,Morgan Spector,Comedy Romance Drama,A woman on the brink of a marriage proposal is told by a friend that she should date other men before spending the rest of her life with her boyfriend.,5.3,4845,2018
454699,Monster Family,Holger Tappe,Emily Watson,Jason Isaacs,Nick Frost,Animation Family Fantasy Comedy,"The Wishbone family are far from happy. In an attempt to reconnect as a family, they plan a fun night out. However, the plan backfires when they are cursed and all turned into Monsters.",4.8,5331,2018
407719,Golden Exits,Alex Ross Perry,Emily Browning,Adam Horowitz,Mary-Louise Parker,Drama,An intersectional narrative of two families in Brooklyn and the unraveling of unspoken unhappiness that occurs when a young foreign girl spending time abroad upsets the balance on both sides.,5.7,2306,2018
284054,Black Panther,Ryan Coogler,Chadwick Boseman,Michael B. Jordan,Lupita Nyong'o,Action Adventure Sci-Fi,"King T'Challa returns home to the reclusive, technologically advanced African nation of Wakanda to serve as his country's new leader. However, T'Challa soon finds that he is challenged for the throne by factions within his own country as well as without. Using powers reserved to Wakandan kings, T'Challa assumes the Black Panther mantle to join with ex-girlfriend Nakia, the queen-mother, his princess-kid sister, members of the Dora Milaje (the Wakandan 'special forces') and an American secret agent, to prevent Wakanda from being dragged into a world war.",7.3,822555,2018
387592,Early Man,Nick Park,Eddie Redmayne,Tom Hiddleston,Maisie Williams,Family Comedy Animation Adventure,"Dug, along with his sidekick Hognob, unite a cavemen tribe to save their hidden valley from being spoiled and, all together as a team, to face the menace of a mysterious and mighty enemy, on the turf of an ancient and sacred sport.",6.1,23354,2018
83725,Loveless,Andrey Zvyagintsev,Maryana Spivak,Alexei Rozin,Matvey Novikov,Comedy Drama,About a commitment-phobic New York City bachelor in crisis.,7.6,35046,2018
10794,The Party,Sally Potter,Timothy Spall,Kristin Scott Thomas,Patricia Clarkson,Comedy,"Hrundi V. Bakshi, an accident-prone actor from India, is accidentally put on the guest list for an upcoming party at the home of a Hollywood film producer. Unfortunately, from the moment he arrives, one thing after another goes wrong with compounding effect.",7.4,42980,2018
541724,Nostalgia,Mark Pellington,Jon Hamm,Nick Offerman,Amber Tamblyn,Drama Crime,"Felice returns to his native Rione Sanit√É¬É√Ç¬† in Naples to look after his dying mother, having lived abroad for the last forty years. Here he discovers that his old friend Oreste has become a notorious crimeboss.",5.6,1373,2018
438145,Black '47,Lance Daly,Hugo Weaving,Jim Broadbent,Stephen Rea,Drama Western,"In 1847, when Ireland is in the grip of the Great Famine that has ravaged the country for two long years, Feeney, a hardened Irish Ranger who has been fighting for the British Army abroad, returns home to reunite with his estranged family, only to discover the cruelest reality, a black land where death reigns.",6.8,12776,2018
474392,Samson,Bruce Macdonald,Taylor James,Jackson Rathbone,Billy Zane,Action Drama Adventure,"After losing the love of his life to a cruel Philistine prince, a young Hebrew with Supernatural strength defends his people, sacrificing everything to avenge his love, his people, and his God.",4.5,4887,2018
445571,Game Night,Jonathan Goldstein,Jason Bateman,Rachel McAdams,Kyle Chandler,Mystery Comedy Crime,"Max and Annie's weekly game night gets kicked up a notch when Max's brother Brooks arranges a murder mystery party -- complete with fake thugs and federal agents. So when Brooks gets kidnapped, it's all supposed to be part of the game. As the competitors set out to solve the case, they start to learn that neither the game nor Brooks are what they seem to be. The friends soon find themselves in over their heads as each twist leads to another unexpected turn over the course of one chaotic night.",6.9,251036,2018
300668,Annihilation,Alex Garland,Natalie Portman,Jennifer Jason Leigh,Gina Rodriguez,Sci-Fi Horror,"A biologist signs up for a dangerous, secret expedition into a mysterious zone where the laws of nature don't apply.",6.8,352338,2018
465136,Every Day,Michael Sucsy,Angourie Rice,Maria Bello,Debby Ryan,Fantasy Romance,"16-year old Rhiannon falls in love with a mysterious spirit named √É¬¢√Ç¬Ä√Ç¬úA√É¬¢√Ç¬Ä√Ç¬ù that inhabits a different body every day. Feeling an unmatched connection, Rhiannon and √É¬¢√Ç¬Ä√Ç¬úA√É¬¢√Ç¬Ä√Ç¬ù work each day to find each other, not knowing what the next day will bring.",6.4,23117,2018
469721,The Cured,David Freyne,Ellen Page,Sam Keeley,Tom Vaughan-Lawlor,Horror Drama Sci-Fi,"What happens when the undead return to life? In a world ravaged for years by a virus that turns the infected into zombie-like cannibals, a cure is at last found and the wrenching process of reintegrating the survivors back into society begins.",5.6,9171,2018
429467,The Lodgers,Brian O'Malley,Charlotte Vega,Bill Milner,Eugene Simon,Horror Thriller Mystery,"1920, rural Ireland. Anglo-Irish twins Rachel and Edward share a strange existence in their crumbling family estate. Each night, the property becomes the domain of a sinister presence (The Lodgers) which enforces three rules upon the twins: they must be in bed by midnight; they may not permit an outsider past the threshold; and if one attempts to escape, the life of the other is placed in jeopardy. When troubled war veteran Sean returns to the nearby village, he is immediately drawn to the mysterious Rachel, who in turn begins to break the rules set out by The Lodgers. The consequences pull Rachel into a deadly confrontation with her brother - and with the curse that haunts them.",6,54717,2018
401981,Red Sparrow,Francis Lawrence,Jennifer Lawrence,Joel Edgerton,Matthias Schoenaerts,Thriller Mystery,"Prima ballerina Dominika Egorova faces a bleak and uncertain future after she suffers an injury that ends her career. She soon turns to Sparrow School, a secret intelligence service that trains exceptional young people to use their minds and bodies as weapons. Dominika emerges as the most dangerous Sparrow after completing the sadistic training process. As she comes to terms with her new abilities, she meets a CIA agent who tries to convince her that he is the only person she can trust.",6.6,198084,2018
395990,Death Wish,Eli Roth,Bruce Willis,Vincent D'Onofrio,Dean Norris,Action Crime Drama Thriller,A mild-mannered father is transformed into a killing machine after his family is torn apart by a violent act.,6.3,75287,2018
353066,The Vanishing of Sidney Hall,Shawn Christensen,Logan Lerman,Elle Fanning,Michelle Monaghan,Drama Mystery Romance,"Over the course of 12 years, and three stages of life, Sidney Hall falls in love, writes the book of a generation and then disappears without a trace.",6.8,11601,2018
116439,Foxtrot,Samuel Maoz,Lior Ashkenazi,Sarah Adler,Yonaton Shiray,Drama,A Romanian aristocrat retreats to a desert isle with his wife and servants on the eve of World War II.,7.2,7975,2018
457312,Pickings,Usher Morgan,Elyse Price,Joel Bernard,Katie Vincent,Thriller Action Crime Drama Mystery,"When a short-tempered mobster and his gang of thugs try to shake down a neighborhood bar, they're soon confronted with the wrath of its owner - a mysterious southern mother with a dangerous past.",4.9,1089,2018
407451,A Wrinkle in Time,Ava DuVernay,Storm Reid,Oprah Winfrey,Reese Witherspoon,Adventure Sci-Fi Family Fantasy,"After the disappearance of her scientist father, three peculiar beings send Meg, her brother, and her friend to space in order to find him.",4.3,47216,2018
340022,Gringo,Nash Edgerton,David Oyelowo,Charlize Theron,Joel Edgerton,Comedy Action Crime,An American businessman with a stake in a pharmaceutical company that's about to go public finds his life is thrown into turmoil by an incident in Mexico.,6.1,31675,2018
397722,Thoroughbreds,Cory Finley,Olivia Cooke,Anya Taylor-Joy,Anton Yelchin,Drama Thriller,"Two teenage girls in suburban Connecticut rekindle their unlikely friendship after years of growing apart. In the process, they learn that neither is what she seems to be, and that a murder might solve both of their problems.",6.6,45780,2018
402897,The Death of Stalin,Armando Iannucci,Steve Buscemi,Simon Russell Beale,Paddy Considine,Comedy Drama History,"When dictator Joseph Stalin dies, his parasitic cronies square off in a frantic power struggle to become the next Soviet leader. As they bumble, brawl and back-stab their way to the top, the question remains √É¬¢√Ç¬Ä√Ç¬î just who is running the government?",7,9,2018
449749,The Leisure Seeker,Paolo Virz√É¬É√Ç¬¨,Donald Sutherland,Helen Mirren,Chiristian McKay,Drama Romance Adventure,"A runaway couple go on an unforgettable journey from Boston to Key West, recapturing their passion for life and their love for each other on a road trip that provides revelation and surprise right up to the very end.",6.7,9508,2018
371608,The Strangers: Prey at Night,Johannes Roberts,Christina Hendricks,Martin Henderson,Bailee Madison,Horror Thriller,"A family√É¬¢√Ç¬Ä√Ç¬ôs road trip takes a dangerous turn when they arrive at a secluded mobile home park to stay with some relatives and find it mysteriously deserted. Under the cover of darkness, three masked killers pay them a visit to test the family√É¬¢√Ç¬Ä√Ç¬ôs every limit as they struggle to survive.",5.2,33621,2018
430040,The Hurricane Heist,Rob Cohen,Toby Kebbell,Maggie Grace,Ryan Kwanten,Action Crime Thriller,Thieves attempt a massive heist against the U.S. Treasury as a Category 5 hurricane approaches one of its Mint facilities.,5.1,21954,2018
338970,Tomb Raider,Roar Uthaug,Alicia Vikander,Dominic West,Walton Goggins,Action Adventure Fantasy,"Lara Croft, the fiercely independent daughter of a missing adventurer, must push herself beyond her limits when she finds herself on the island where her father disappeared.",6.3,223853,2018
449176,"Love, Simon",Greg Berlanti,Nick Robinson,Katherine Langford,Alexandra Shipp,Comedy Drama Romance,Everyone deserves a great love story. But for seventeen-year old Simon Spier it's a little more complicated: he's yet to tell his family or friends he's gay and he doesn't know the identity of the anonymous classmate he's fallen for online.,7.5,122679,2018
470878,I Can Only Imagine,Jon Erwin,Cloris Leachman,Dennis Quaid,Priscilla Shirer,Music Drama,"10-year-old Bart Millard lives with his mother and abusive father Arthur in Texas. One day his mother drops him off at a Christian camp where he meets Shannon. Upon his return from camp, Bart finds his mother has left and movers are removing her belongings. He angrily confronts his father, who denies that his abusiveness was the reason she left. Years later, in high school, Bart and Shannon are dating. Bart plays football to please his father but is injured, breaking both ankles and ending his career. The only elective with openings is music class, so he reluctantly signs up.",7.3,17508,2018
433627,7 Days in Entebbe,JosÈ Padilha,Rosamund Pike,Daniel Br¸hl,Vincent Cassel,Thriller Drama Crime,"In 1976, four hijackers take over an Air France airplane en route from Tel Aviv to Paris and force it to land in Entebbe, Uganda. With 248 passengers on board, one of the most daring rescue missions ever is set in motion.",5.9,17034,2018
502426,Furlough,Laurie Collyer,Melissa Leo,Tessa Thompson,La La Anthony,Comedy,"In between caring for her mother, a young woman works part time at a prison. The rookie guard gets a chance to prove her mettle when she's tasked with accompanying a hell-raising inmate on an emergency furlough to visit her dying mother. But things soon spiral out of control, sending the pair on a hilarious, surprising, and ultimately touching road trip.",5.5,2040,2018
414187,Josie,Eric England,Sophie Turner,Dylan McDermott,Jack Kilmer,Thriller Drama,"Everyone knows everyone in the southern town of Baymont. So when tattooed, sweet-talking Josie struts into town, heads turn. Striking up relationships with young punk Gator and loner Hank, she quickly becomes a hot topic of local gossip.",5.2,3455,2018
421471,Flower,Max Winkler,Zoey Deutch,Kathryn Hahn,Tim Heidecker,Comedy Drama,"Rebellious, quick-witted Erica Vandross is a 17-year-old firecracker living with her single mom, Laurie, and her mom's new boyfriend, Bob, in L.A.'s San Fernando Valley. When Bob's mentally unbalanced son, Luke, arrives from rehab to live with the family, Erica finds her domestic and personal life overwhelmed. With Luke and her sidekicks Kala and Claudine in tow, Erica acts out by exposing a high school teacher's dark secret.",6,10232,2018
268896,Pacific Rim: Uprising,Steven S. DeKnight,John Boyega,Scott Eastwood,Cailee Spaeny,Action Fantasy Sci-Fi Adventure,"It has been ten years since The Battle of the Breach and the oceans are still, but restless. Vindicated by the victory at the Breach, the Jaeger program has evolved into the most powerful global defense force in human history. The PPDC now calls upon the best and brightest to rise up and become the next generation of heroes when the Kaiju threat returns.",5.6,124773,2018
399174,Isle of Dogs,Wes Anderson,Bryan Cranston,Edward Norton,Bill Murray,Adventure Comedy Animation,"In the future, an outbreak of canine flu leads the mayor of a Japanese city to banish all dogs to an island used as a garbage dump. The outcasts must soon embark on an epic journey when a 12-year-old boy arrives on the island to find his beloved pet.",7.8,186158,2018
370567,Sherlock Gnomes,John Stevenson,James McAvoy,Emily Blunt,Johnny Depp,Animation Family Fantasy Comedy Adventure Mystery,"Garden gnomes, Gnomeo & Juliet, recruit renown detective, Sherlock Gnomes, to investigate the mysterious disappearance of other garden ornaments.",5.2,13715,2018
467660,Unsane,Steven Soderbergh,Claire Foy,Joshua Leonard,Jay Pharoah,Horror Thriller,A woman is involuntarily committed to a mental institution where she is confronted by her greatest fear.,6.4,49193,2018
476968,"Paul, Apostle of Christ",Andrew Hyatt,James Faulkner,Jim Caviezel,Olivier Martinez,Drama Fantasy,"Risking his life, Luke ventures to Rome to visit Paul -- the apostle who's bound in chains and held captive in Nero's darkest and bleakest prison cell. Haunted by the shadows of his past misdeeds, Paul wonders if he's been forgotten as he awaits his grisly execution. Before Paul's death, Luke resolves to write another book that details the birth of what will come to be known as the church.",6.6,9530,2018
345317,Final Portrait,Stanley Tucci,Geoffrey Rush,Armie Hammer,Clemence Poesy,History Drama,"Paris, 1964. The Swiss sculptor and painter Alberto Giacometti, one of the most accomplished and respected artists of his generation, asks his friend, the American writer James Lord, to sit for a portrait, assuring him that it will take no longer than two or three hours, an afternoon at the most.",6.2,5977,2018
419478,Midnight Sun,Scott Speer,Bella Thorne,Patrick Schwarzenegger,Rob Riggle,Romance Drama,"Katie, a 17-year-old, has been sheltered since childhood and confined to her house during the day by a rare disease that makes even the smallest amount of sunlight deadly. Fate intervenes when she meets Charlie and they embark on a summer romance.",6.6,34961,2018
805678,Followers,Ryan Justice,Amanda Delaney,Justin Maina,Sean Michael Gloria,Comedy Horror,"A struggling social media influencer discovers the house he shares is haunted. The ghost brings him and his friends fame and fortune, but with deadly consequences.",7,17,2018
333339,Ready Player One,Steven Spielberg,Tye Sheridan,Olivia Cooke,Ben Mendelsohn,Adventure Action Sci-Fi,"When the creator of a popular video game system dies, a virtual contest is created to compete for his fortune.",7.4,468640,2018
464502,Acrimony,Tyler Perry,Taraji P. Henson,Lyriq Bent,Crystle Stewart,Thriller,A faithful wife takes action when it becomes clear to her that her devious husband has betrayed her.,5.9,9816,2018
454286,God's Not Dead: A Light in Darkness,Michael Mason,David A. R. White,John Corbett,Shane Harper,Drama Fantasy,"Pastor Dave responds to the unimaginable tragedy of having his church, located on the grounds of the local university, burned down.",4.4,4387,2018
