Movie_id,Title,Director,Actor1,Actor2,Actor3,Genre,Overview,Ratings,Votes,Year
329440,The Forest,Jason Zada,Natalie Dormer,Taylor Kinney,Yukiyoshi Ozawa,Horror Thriller Mystery,"Set in the Aokigahara Forest, a real-life place in Japan where people go to end their lives. Against this backdrop, a young American woman comes in search of her twin sister, who has mysteriously disappeared.",4.8,45245,2016
277710,Anesthesia,Tim Blake Nelson,Glenn Close,K. Todd Freeman,Jessica Hecht,Drama Thriller,Multiple lives intersect in the aftermath of the violent mugging of a Columbia University philosophy professor.,6.1,4966,2016
324284,The Lamb,Ross Partridge,Ross Partridge,Oona Laurence,Jess Weixler,Drama,"Lamb, based on the novel by Bonnie Nadzam, traces the self-discovery of David Lamb in the weeks following the disintegration of his marriage and the death of his father. Hoping to regain some faith in his own goodness, he turns his attention to Tommie, an awkward and unpopular eleven-year-old girl. Lamb is convinced that he can help her avoid a destiny of apathy and emptiness, and takes Tommie for a road trip from Chicago to the Rockies, planning to initiate her into the beauty of the mountain wilderness. The journey shakes them in ways neither expects.",7.4,12,2016
323675,Ride Along 2,Tim Story,Ice Cube,Kevin Hart,Ken Jeong,Action Comedy,"As his wedding day approaches, Ben heads to Miami with his soon-to-be brother-in-law James to bring down a drug dealer who's supplying the dealers of Atlanta with product.",5.9,62093,2016
300671,13 Hours: The Secret Soldiers of Benghazi,Michael Bay,James Badge Dale,John Krasinski,Max Martini,War Action History Drama,An American Ambassador is killed during an attack at a U.S. compound in Libya as a security team struggles to make sense out of the chaos.,7.3,156676,2016
276905,Norm of the North,Trevor Wall,Rob Schneider,Heather Graham,Ken Jeong,Adventure Animation Comedy Family,"Polar bear Norm and his three Arctic lemming buddies are forced out into the world once their icy home begins melting and breaking apart. Landing in New York, Norm begins life anew as a performing corporate mascot, only to discover that his new employers are directly responsible for the destruction of his polar home.",3.4,10003,2016
328901,The Benefactor,Andrew Renzi,Richard Gere,Dakota Fanning,Theo James,Drama,"A newly married couple are forced to navigate the all-consuming interest of a powerful, mysterious, and possessive philanthropist.",5.2,5173,2016
291870,Dirty Grandpa,Dan Mazer,Robert De Niro,Zac Efron,Aubrey Plaza,Comedy,"Jason Kelly is one week away from marrying his boss's uber-controlling daughter, putting him on the fast track for a partnership at the law firm. However, when the straight-laced Jason is tricked into driving his foul-mouthed grandfather, Dick, to Daytona for spring break, his pending nuptials are suddenly in jeopardy. Between riotous frat parties, bar fights, and an epic night of karaoke, Dick is on a quest to live his life to the fullest and bring Jason along for the ride.",5.9,131038,2016
299687,The 5th Wave,J Blakeson,Chloe Grace Moretz,Nick Robinson,Ron Livingston,Sci-Fi Adventure Action,16-year-old Cassie Sullivan tries to survive in a world devastated by the waves of an alien invasion that has already decimated the population and knocked mankind back to the Stone Age.,5.2,115223,2016
321258,The Boy,William Brent Bell,James Russell,Lauren Cohan,Rupert Evans,Horror Thriller Mystery,"An American nanny is shocked that her new English family's boy is actually a life-sized doll. After she violates a list of strict rules, disturbing events make her believe that the doll is really alive.",6,100293,2016
347945,Synchronicity,Jacob Gentry,Chad McKnight,A. J. Bowen,Brianne Davis,Thriller Mystery Sci-Fi,"A daring physicist travels into the past to stop a mysterious woman from stealing his invention. But once there, he uncovers a surprising truth about the machine, the woman, and his own fractured reality.",5.4,11237,2016
140300,Kung Fu Panda 3,Alessandro Carloni,Jack Black,Bryan Cranston,Dustin Hoffman,Action Adventure Animation Comedy Family,"Continuing his ""legendary adventures of awesomeness"", Po must face two hugely epic, but different threats: one supernatural and the other a little closer to his home.",7.1,178059,2016
300673,The Finest Hours,Craig Gillespie,Chris Pine,Casey Affleck,Ben Foster,Action Drama History Thriller,The Coast Guard makes a daring rescue attempt off the coast of Cape Cod after a pair of oil tankers are destroyed during a blizzard in 1952.,6.7,69715,2016
351819,Fifty Shades of Black,Michael Tiddes,Marlon Wayans,Kali Hawk,Affion Crockett,Romance Comedy,An inexperienced college student meets a wealthy businessman whose sexual practices put a strain on their relationship.,3.5,22929,2016
174751,Jane Got a Gun,Gavin O'Connor,Natalie Portman,Joel Edgerton,Noah Emmerich,Western Action Drama,"After her outlaw husband returns home shot with eight bullets and barely alive, Jane reluctantly reaches out to an ex-lover who she hasn't seen in over ten years to help her defend her farm when the time comes that her husband's gang eventually tracks him down to finish the job.",5.9,23434,2016
270487,"Hail, Caesar!",Joel Coen and Ethan Coen,Josh Brolin,George Clooney,Alden Ehrenreich,Comedy Crime Mystery,"When a Hollywood star mysteriously disappears in the middle of filming, the studio sends their fixer to get him back.",6.3,141264,2016
58431,Pride and Prejudice and Zombies,Burr Steers,Lily James,Sam Riley,Jack Huston,Romance Horror Comedy Thriller,"A zombie outbreak has fallen upon the land in this reimagining of Jane Austen's classic tale of the tangled relationships between lovers from different social classes in 19th century England. Feisty heroine Elizabeth Bennet is a master of martial arts and weaponry and the handsome Mr. Darcy is a fierce zombie killer, yet the epitome of upper class prejudice. As the zombie outbreak intensifies, they must swallow their pride and join forces on the blood-soaked battlefield in order to conquer the undead once and for all.",5.8,59463,2016
330483,The Choice,Ross Katz,Benjamin Walker,Teresa Palmer,Maggie Grace,Drama Romance,Travis and Gabby first meet as neighbors in a small coastal town and wind up in a relationship that is tested by life's most defining events.,6.5,44801,2016
293660,Deadpool,Tim Miller,Ryan Reynolds,Morena Baccarin,Ed Skrein,Action Adventure Comedy,"The origin story of former Special Forces operative turned mercenary Wade Wilson, who, after being subjected to a rogue experiment that leaves him with accelerated healing powers, adopts the alter ego Deadpool. Armed with his new abilities and a dark, twisted sense of humor, Deadpool hunts down the man who nearly destroyed his life.",8,1098675,2016
329833,Zoolander 2,Ben Stiller,Ben Stiller,Owen Wilson,Will Ferrell,Comedy Adventure Action,Derek and Hansel are modelling again when an opposing company attempts to take them out from the business.,4.7,74450,2016
259694,How to Be Single,Christian Ditter,Dakota Johnson,Rebel Wilson,Damon Wayans Jr.,Comedy Romance,"New York City is full of lonely hearts seeking the right match, and what Alice, Robin, Lucy, Meg, Tom and David all have in common is the need to learn how to be single in a world filled with ever-evolving definitions of love.",6.1,92662,2016
335778,Risen,Kevin Reynolds,Joseph Fiennes,Tom Felton,Peter Firth,Action Adventure Drama Fantasy,"Clavius, a powerful Roman military tribune, and his aide, Lucius, are tasked with solving the mystery of what happened to Jesus in the weeks following the crucifixion, in order to disprove the rumors of a risen Messiah and prevent an uprising in Jerusalem.",6.3,30064,2016
310131,The Witch,Robert Eggers,Anya Taylor-Joy,Ralph Ineson,Kate Dickie,Horror Mystery Drama,"In 1630, a farmer relocates his family to a remote plot of land on the edge of a forest where strange, unsettling things happen. With suspicion and paranoia mounting, each family member's faith, loyalty and love are tested in shocking ways.",5.3,7,2016
263341,"Crouching Tiger, Hidden Dragon: Sword of Destiny",Yuen Woo-ping,Donnie Yen,Michelle Yeoh,Harry Shum Jr.,Action Adventure Drama,"A story of lost love, young love, a legendary sword and one last opportunity at redemption.",6.1,20622,2016
205584,Gods of Egypt,Alex Proyas,Nikolaj Coster-Waldau,Gerard Butler,Brenton Thwaites,Action Adventure Fantasy,A common thief joins a mythical god on a quest through Egypt.,5.4,123673,2016
146198,Triple 9,John Hillcoat,Casey Affleck,Chiwetel Ejiofor,Anthony Mackie,Action Crime Adventure Thriller,A gang of criminals and corrupt cops plan the murder of a police officer in order to pull off their biggest heist yet across town.,6.3,75875,2016
319888,Eddie the Eagle,Dexter Fletcher,Taron Egerton,Hugh Jackman,Christopher Walken,Comedy Drama History Adventure,"The feel-good story of Michael 'Eddie' Edwards, an unlikely but courageous British ski-jumper who never stopped believing in himself√É¬¢√Ç¬Ä√Ç¬îeven as an entire nation was counting him out. With the help of a rebellious and charismatic coach, Eddie takes on the establishment and wins the hearts of sports fans around the world by making an improbable and historic showing at the 1988 Calgary Winter Olympics.",7.3,98794,2016
269149,Zootopia,Rich Moore,Ginnifer Goodwin,Jason Bateman,Idris Elba,Animation Adventure Family Comedy,"Determined to prove herself, Officer Judy Hopps, the first bunny on Zootopia's police force, jumps at the chance to crack her first case - even if it means partnering with scam-artist fox Nick Wilde to solve the mystery.",8,532833,2016
267860,London Has Fallen,Babak Najafi,Gerard Butler,Aaron Eckhart,Morgan Freeman,Action Thriller,"In London for the Prime Minister's funeral, Mike Banning discovers a plot to assassinate all the attending world leaders.",5.9,167041,2016
279641,Whiskey Tango Foxtrot,Glenn Ficarra,Tina Fey,Margot Robbie,Martin Freeman,Comedy Drama War,"In 2002, cable news producer Kim Barker decides to shake up her routine by taking a daring new assignment in Kabul, Afghanistan. Dislodged from her comfortable American lifestyle, Barker finds herself in the middle of an out-of-control war zone. Luckily, she meets Tanya Vanderpoel, a fellow journalist who takes the shell-shocked reporter under her wing. Amid the militants, warlords and nighttime partying, Barker discovers the key to becoming a successful correspondent.",6.6,54884,2016
364116,The Other Side of the Door,Johannes Roberts,Sarah Wayne Callies,Jeremy Sisto,Sofia Rosinsky,Thriller Horror,"Grieving over the loss of her son, a mother struggles with her feelings for her daughter and her husband. She seeks out a ritual that allows her say goodbye to her dead child, opening the veil between the world of the dead and the living. Her daughter becomes the focus of terror. She must now protect against the evil that was once her beloved son.",5.3,19014,2016
382517,Open Season: Scared Silly,David Feiss,Will Townsend,Donny Lucas,Melissa Sturm,Animation Comedy Family Adventure,"The humans and animals believe a werewolf is on the loose, and former hunter Shaw uses the opportunity to re-open the season. Boog, Elliot, and Mr. Weenie have to face their fears and find the werewolf to get the season closed permanently.",5,3648,2016
333371,10 Cloverfield Lane,Dan Trachtenberg,Mary Elizabeth Winstead,John Goodman,John Gallagher Jr.,Thriller Sci-Fi Drama Horror,"After getting in a car accident, a woman is held in a shelter with two men, who claim the outside world is affected by a widespread chemical attack.",7.2,348004,2016
267193,The Brothers Grimsby,Louis Leterrier,Sacha Baron Cohen,Mark Strong,Isla Fisher,Action Comedy,"Wrongfully accused and on the run, a top MI6 assassin joins forces with his long-lost, football hooligan brother to save the world from a sinister plot.",6.2,109145,2016
318850,The Young Messiah,Cyrus Nowrasteh,Adam Greaves-Neal,Sean Bean,David Bradley,Drama Fantasy,"Tells the story of Jesus Christ at age seven as he and his family depart Egypt to return home to Nazareth. Told from his childhood perspective, it follows young Jesus as he grows into his religious identity.",5.7,3819,2016
378200,The Perfect Match,Bille Woodruff,Terrence J,Cassie Ventura,Donald Faison,Romance Comedy,"Charlie is a charming playboy who doesn't believe in serious relationships. His best friends bet him that if he sticks to one woman for one month, he's bound to get attached. Charlie denies this yet accepts the seemingly easy challenge, until he cross paths with the beautiful and mysterious Eva. They may agree to a casual affair, but eventually Charlie is questioning whether he may actually want more.",4.9,4315,2016
320588,"Hello, My Name Is Doris",Michael Showalter,Sally Field,Max Greenfield,Beth Behrs,Comedy Drama Romance,A self-help seminar inspires a sixty-something woman to romantically pursue her younger co-worker.,6.6,22342,2016
339984,Miracles from Heaven,Patricia Riggen,Jennifer Garner,Kylie Rogers,Martin Henderson,Family Drama Fantasy,"When Christy discovers her 10-year-old daughter Anna has a rare, incurable disease, she becomes a ferocious advocate for her daughter√É¬¢√Ç¬Ä√Ç¬ôs healing as she searches for a solution. After Anna has a freak accident and falls three stories, a miracle unfolds in the wake of her dramatic rescue that leaves medical specialists mystified, her family restored and their community inspired.",7.1,27681,2016
262504,The Divergent Series: Allegiant,Robert Schwentke,Shailene Woodley,Theo James,Jeff Daniels,Adventure Sci-Fi Action Mystery,Beatrice Prior and Tobias Eaton venture into the world outside of the fence and are taken into protective custody by a mysterious agency known as the Bureau of Genetic Welfare.,5.7,131254,2016
308453,The Bronze,Bryan Buckley,Melissa Rauch,Gary Cole,Thomas Middleditch,Drama Comedy,"In 2004, Hope Ann Greggory became an American hero after winning the bronze medal for the women's gymnastics team. Today, she's still living in her small hometown, washed-up and embittered. Stuck in the past, Hope must reassess her life when a promising young gymnast threatens her local celebrity status.",6.1,13328,2016
245703,Midnight Special,Jeff Nichols,Michael Shannon,Joel Edgerton,Kirsten Dunst,Adventure Drama Sci-Fi,A father and son go on the run after the dad learns his child possesses special powers.,6.6,83322,2016
209112,Batman v Superman: Dawn of Justice,Zack Snyder,Ben Affleck,Henry Cavill,Amy Adams,Action Adventure Fantasy,"Fearing the actions of a god-like Super Hero left unchecked, Gotham City√É¬¢√Ç¬Ä√Ç¬ôs own formidable, forceful vigilante takes on Metropolis√É¬¢√Ç¬Ä√Ç¬ôs most revered, modern-day savior, while the world wrestles with what sort of hero it really needs. And with Batman and Superman at war with one another, a new threat quickly arises, putting mankind in greater danger than it√É¬¢√Ç¬Ä√Ç¬ôs ever known before.",6.5,743708,2016
302688,My Big Fat Greek Wedding 2,Kirk Jones,Nia Vardalos,John Corbett,Lainie Kazan,Romance Comedy,"The continuing adventures of the Portokalos family. A follow-up to the 2002 comedy, ""My Big Fat Greek Wedding.""",6,34701,2016
297806,I Saw the Light,Marc Abraham,Tom Hiddleston,Elizabeth Olsen,Cherry Jones,Music Drama,"Singer and songwriter Hank Williams rises to fame in the 1940s, but alcohol abuse and infidelity take a toll on his career and marriage to fellow musician Audrey Mae Williams.",5.8,8085,2016
295699,Everybody Wants Some!!,Richard Linklater,Will Brittain,Zoey Deutch,Ryan Guzman,Comedy,A comedy that follows a group of friends as they navigate their way through the freedoms and responsibilities of unsupervised adulthood.,6.9,57713,2016
347126,God's Not Dead 2,Harold Cronk,Melissa Joan Hart,Jesse Metcalfe,David A. R. White,Drama Fantasy,"When a high school teacher is asked a question in class about Jesus, her reasoned response lands her in deep trouble and could expel God from the public square once and for all.",4.3,13264,2016
377587,Meet the Blacks,Deon Taylor,Mike Epps,Gary Owen,Zulay Henao,Comedy Horror,"As Carl Black gets the opportunity to move his family out of Chicago in hope of a better life, their arrival in Beverly Hills is timed with that city's annual purge, where all crime is legal for twelve hours.",4.8,37562,2016
316000,Miles Ahead,Don Cheadle,Don Cheadle,Ewan McGregor,Emayatzy Corinealdi,Drama Music History,An exploration of the life and music of Miles Davis.,6.4,10456,2016
346651,Pandemic,John Suits,Rachel Nichols,Alfie Allen,Paul Guilfoyle,Action Sci-Fi Horror,"After a virus of epic proportions overwhelms the planet√É¬¢√Ç¬Ä√Ç¬îwith more infected than uninfected√É¬¢√Ç¬Ä√Ç¬îhumanity is losing its grip on survival and its only hope is finding a cure and keeping the infected contained. Lauren, a doctor, arrives in Los Angeles with her crack team to lead the hunt for uncontaminated civilian survivors, but nothing can prepare them for the blood-soaked mayhem they witness as they head into the Californian streets where everything is considered a trap.",4.4,8402,2016
323676,The Boss,Ben Falcone,Melissa McCarthy,Kristen Bell,Kathy Bates,Comedy,"A titan of industry is sent to prison after she's caught for insider trading. When she emerges ready to rebrand herself as America's latest sweetheart, not everyone she screwed over is so quick to forgive and forget.",5.4,48196,2016
325348,Hardcore Henry,Ilya Naishuller,Sharlto Copley,Danila Kozlovsky,Haley Bennett,Action Adventure Sci-Fi,"Henry, a newly resurrected cyborg who must save his wife/creator from the clutches of a psychotic tyrant with telekinetic powers, AKAN, and his army of mercenaries. Fighting alongside Henry is Jimmy, who is Henry's only hope to make it through the day. Hardcore Henry takes place over the course of one day, in Moscow, Russia.",6.7,100544,2016
303991,Demolition,Jean-Marc Vall√É¬©e,Jake Gyllenhaal,Naomi Watts,Chris Cooper,Comedy Drama,An emotionally desperate investment banker finds hope through a woman he meets.,5.9,47,2016
830788,The Invitation,Karyn Kusama,Logan Marshall-Green,Tammy Blanchard,Michiel Huisman,Horror Thriller,"After the death of her mother, Evie is approached by an unknown cousin who invites her to a lavish wedding in the English countryside. Soon, she realizes a gothic conspiracy is afoot and must fight for survival as she uncovers twisted secrets in her family√É¬¢√Ç¬Ä√Ç¬ôs history.",5.4,130,2016
376570,Hush,Mike Flanagan,John Gallagher Jr.,Michael Trucco,Kate Siegel,Horror Thriller,A deaf woman is stalked by a psychotic killer in her secluded home.,6.6,149950,2016
9325,The Jungle Book,Jon Favreau,Neel Sethi,Bill Murray,Ben Kingsley,Family Animation Adventure,"The boy Mowgli makes his way to the man-village with Bagheera, the wise panther. Along the way he meets jazzy King Louie, the hypnotic snake Kaa and the lovable, happy-go-lucky bear Baloo, who teaches Mowgli ""The Bare Necessities"" of life and the true meaning of friendship.",7.4,288294,2016
326423,Barbershop: The Next Cut,Malcolm D. Lee,Ice Cube,Cedric the Entertainer,Regina Hall,Comedy Drama,"To survive harsh economic times, Calvin and Angie have merged the barbershop and beauty salon into one business. The days of male bonding are gone as Eddie and the crew must now contend with sassy female co-workers and spirited clientele. As the battle of the sexes rages on, a different kind of conflict has taken over Chicago. Crime and gangs are on the rise, leaving Calvin worried about the fate of his son. Together, the friends come up with a bold plan to take back their beloved neighborhood.",5.9,15899,2016
302156,Criminal,Ariel Vromen,Kevin Costner,Gary Oldman,Tommy Lee Jones,Action Crime Sci-Fi,"CIA Agent Bill Pope is on a mission to track down a shadowy hacker named 'The Dutchman'. When he gets mysteriously killed, an experimental procedure transfers his memories into a dangerous ex-convict. When he wakes up Pope's memories, his mission is to eliminate The Dutchman before the hacker launches ICBMs and starts World War III.",6.3,69302,2016
313922,Green Room,Jeremy Saulnier,Anton Yelchin,Imogen Poots,Alia Shawkat,Horror Crime Thriller,"A punk rock band becomes trapped in a secluded venue after finding a scene of violence. For what they saw, the band themselves become targets of violence from a gang of white power skinheads, who want to eliminate all evidence of the crime.",7.3,101,2016
290595,The Huntsman: Winter's War,Cedric Nicolas-Troyan,Chris Hemsworth,Charlize Theron,Emily Blunt,Action Adventure Drama,"As two evil sisters prepare to conquer the land, two renegades√É¬¢√Ç¬Ä√Ç¬îEric the Huntsman, who aided Snow White in defeating Ravenna in Snowwhite and the Huntsman, and his forbidden lover, Sara√É¬¢√Ç¬Ä√Ç¬îset out to stop them.",6.1,117393,2016
270010,A Hologram for the King,Tom Tykwer,Tom Hanks,Omar Elba,Sarita Choudhury,Comedy Drama,"Alan Clay, a struggling American businessman, travels to Saudi Arabia to sell a new technology to the King, only to be challenged by endless Middle Eastern bureaucracy, a perpetually absent monarch, and a suspicious growth on his back.",6.1,46971,2016
1053017,Elvis & Nixon,Liza Johnson,Michael Shannon,Kevin Spacey,Alex Pettyfer,Family Drama,"A young girl learns she may have to sell her beloved pet pig, Elvis, to a local farmer to save the family farm. Unbeknownst to her, the pig is in real danger, the farmer is planning a pig roast and not a forever home. After getting wind of the plan, the whole family bands together to save Elvis, uniting to reclaim their farm and prove that love is worth more than money.",6.4,14911,2016
384737,Precious Cargo,Max Adams,Mark-Paul Gosselaar,Bruce Willis,Claire Forlani,Action Crime Thriller,"After a botched heist, Eddie  a murderous crime boss, hunts down the seductive thief Karen who failed him. In order to win back Eddie√É¬¢√Ç¬Ä√Ç¬ôs trust, Karen recruits her ex-lover and premier thief Jack to steal a cargo of rare precious gems. But when the job goes down, allegiances are betrayed and lines are crossed as Jack, Karen, and Eddie face off in a fateful showdown.",4.6,9826,2016
342521,Keanu,Peter Atencio,Jordan Peele,Keegan-Michael Key,Tiffany Haddish,Action Comedy Crime,Friends hatch a plot to retrieve a stolen cat by posing as drug dealers for a street gang.,6.2,51397,2016
1107872,Mother's Day,Garry Marshall,Jennifer Aniston,Kate Hudson,Shay Mitchell,Action Thriller Drama,"Nina, a former NATO special operations agent living in hiding, has to use all her deadly skills to rescue her son who has been kidnapped by ruthless gangsters. Finding Max is a double opportunity for her. A chance to feel the adrenaline rush again, and an opportunity to get back into the life of the son she had to abandon years ago.",5.6,39117,2016
234004,Ratchet & Clank,Kevin Munroe,Paul Giamatti,John Goodman,Bella Thorne,Action Adventure Animation Family,"When the galaxy comes under the threat of a nefarious space captain, a mechanic and his newfound robot ally join an elite squad of combatants to save the universe.",5.5,11666,2016
271110,Captain America: Civil War,Anthony Russo and Joe Russo,Chris Evans,Robert Downey Jr.,Scarlett Johansson,Adventure Action Sci-Fi,"Following the events of Age of Ultron, the collective governments of the world pass an act designed to regulate all superhuman activity. This polarizes opinion amongst the Avengers, causing two factions to side with Iron Man or Captain America, which causes an epic battle between former allies.",7.8,834035,2016
303858,Money Monster,Jodie Foster,George Clooney,Julia Roberts,Jack O'Connell,Thriller Drama,Financial TV host Lee Gates and his producer Patty are put in an extreme situation when an irate investor takes over their studio.,6.5,103361,2016
267800,Sundown,Fernando Lebrija,Devon Werkheiser,Sean Marquette,Silverio Palacios,Romance Comedy,"High school seniors Logan and Blake prepare for an epic Spring Break as they travel to the beautiful and exotic Mexican beach resort of Puerto Vallarta hoping to hook up with their high school crushes. Surrounded by hot girls in teeny bikinis, the guys are truly in heaven. After meeting at a club, Logan falls for a mysterious local beauty named Gaby but then realizes the next morning, when his grandfather√É¬¢√Ç¬Ä√Ç¬ôs Rolex watch is missing, that she was after more than just his heart.",5.4,2441,2016
257345,The Darkness,Greg McLean,Kevin Bacon,Radha Mitchell,Jennifer Morrison,Horror Thriller,A family returns from a Grand Canyon vacation with a supernatural presence in tow.,4.5,16944,2016
1081676,Love & Friendship,Whit Stillman,Kate Beckinsale,Xavier Samuel,Emma Greenwell,Drama Romance,A once-respected surgeon who's lost his family and his memory gets a chance at redemption when he reconnects with someone from his forgotten past.,7.6,45185,2016
153518,The Angry Birds Movie,Clay Kaytis,Jason Sudeikis,Josh Gad,Danny McBride,Animation Adventure Comedy,"An island populated entirely by happy, flightless birds or almost entirely. In this paradise, Red, a bird with a temper problem, speedy Chuck, and the volatile Bomb have always been outsiders. But when the island is visited by mysterious green piggies, it√É¬¢√Ç¬Ä√Ç¬ôs up to these unlikely outcasts to figure out what the pigs are up to.",6.3,101164,2016
325133,Neighbors 2: Sorority Rising,Nicholas Stoller,Seth Rogen,Zac Efron,Rose Byrne,Comedy,A sorority moves in next door to the home of Mac and Kelly Radner who have a young child. The Radner's enlist their former nemeses from the fraternity to help battle the raucous sisters.,5.7,128645,2016
