Movie_id,Title,Director,Actor1,Actor2,Actor3,Genre,Overview,Ratings,Votes,Year
569094,Spider-Man,Sam Raimi,Tobey Maguire, Willem Dafoe, Kirsten Dunst,Animation Action Adventure,"After reuniting with Gwen Stacy, Brooklyn√É¬¢√Ç¬Ä√Ç¬ôs full-time, friendly neighborhood Spider-Man is catapulted across the Multiverse, where he encounters the Spider Society, a team of Spider-People charged with protecting the Multiverse√É¬¢√Ç¬Ä√Ç¬ôs very existence. But when the heroes clash on how to handle a new threat, Miles finds himself pitted against the other Spiders and must set out on his own to save those he loves most.",7.4,861622,2002
9023,Spirit: Stallion of the Cimarron,"Kelly Asbury, Lorna Cook",Matt Damon, James Cromwell, Daniel Studi,Animation Adventure Comedy Family Drama,"As a wild stallion travels across the frontiers of the Old West, he befriends a young human and finds true love with a mare.",7.2,83277,2002
12079,Spun,Jonas √Ökerlund,Jason Schwartzman, Brittany Murphy, Mickey Rourke,Comedy Crime Drama,"Over the course of three days Ross, a college dropout addicted to crystal-meth, encounters a variety of oddball folks - including a stripper named Nikki and her boyfriend, the local meth producer, The Cook - but all he really wants to do is hook up with his old girlfriend, Amy.",6.7,40335,2002
9488,Spy Kids 2: The Island of Lost Dreams,Robert Rodriguez,Alexa Vega, Emily Osment, Daryl Sabara,Action Adventure Family Comedy Sci-Fi,"Exploring the further adventures of Carmen and Juni Cortez, who have now joined the family spy business as Level 2 OSS agents. Their new mission is to save the world from a mad scientist living on a volcanic island populated by an imaginative menagerie of creatures. On this bizarre island, none of the Cortez's gadgets work and they must rely on their wits--and each other--to survive and save the day.",5.3,72506,2002
1894,Star Wars: Episode II - Attack of the Clones,George Lucas,Ewan McGregor, Natalie Portman, Hayden Christensen,Adventure Action Sci-Fi,"Following an assassination attempt on Senator Padm√É¬É√Ç¬© Amidala, Jedi Knights Anakin Skywalker and Obi-Wan Kenobi investigate a mysterious plot that could change the galaxy forever.",6.6,745461,2002
201,Star Trek Nemesis,Stuart Baird,Patrick Stewart, Jonathan Frakes, Brent Spiner,Sci-Fi Action Adventure Thriller,"En route to the honeymoon of William Riker to Deanna Troi on her home planet of Betazed, Captain Jean-Luc Picard and the crew of the U.S.S. Enterprise receives word from Starfleet that a coup has resulted in the installation of a new Romulan political leader, Shinzon, who claims to seek peace with the human-backed United Federation of Planets. Once in enemy territory, the captain and his crew make a startling discovery: Shinzon is human, a slave from the Romulan sister planet of Remus, and has a secret, shocking relationship to Picard himself.",6.4,82810,2002
25006,State Property,Abdul Malik Abbott,Beanie Sigel, Jay-Z, Damon Dash,Crime Action Drama,"Frustrated with being broke, Beans decides that the only way to grasp the American Dream is to take it.",4.3,2208,2002
12770,Stealing Harvard,Bruce McCulloch,Jason Lee, Tom Green, Leslie Mann,Action Comedy Drama Crime,"John and his girlfriend have vowed to marry once they save $30,000 for their dream house. But the minute they achieve their financial goal, John finds out his niece has been accepted at Harvard, and he's reminded of his promise to pay for her tuition (nearly $30,000). John's friend Duff convinces him to turn to petty crime to make the payment √É¬¢√Ç¬Ä√Ç¬¶ but Duff's hare-brained schemes spin quickly out of control.",5.1,13612,2002
115241,Stevie,Steve James,Steve James,Stephen Fielding,Tonya Gregory,Drama Horror Thriller,"A couple unable to conceive adopt a girl with a troubled past, who has an imaginary friend called Stevie. After a series of disturbing incidents, they realize that Stevie is all too real.",7.8,2719,2002
39541,Stolen Summer,Pete Jones,Adiel Stein, Aidan Quinn, Bonnie Hunt,Drama Family Comedy,"Pete, an eight-year-old Catholic boy growing up in the suburbs of Chicago in the mid-1970s, attends Catholic school, where as classes let out for the summer, he's admonished by a nun to follow the path of the Lord, and not that of the Devil. Perhaps taking this message a bit too seriously, Pete decides it's his goal for the summer to help someone get into heaven - by  trying to convert a Jew to Catholicism.",6.5,2875,2002
10996,Stuart Little 2,Rob Minkoff,Geena Davis, Hugh Laurie, Jonathan Lipnicki,Family Adventure Animation Comedy,"Stuart, an adorable white mouse, still lives happily with his adoptive family, the Littles, on the east side of Manhattan's Central Park. More crazy mouse adventures are in store as Stuart, his human brother, George, and their mischievous cat, Snowbell, set out to rescue a friend.",5.5,57594,2002
4614,The Sum of All Fears,Phil Alden Robinson,Ben Affleck, Morgan Freeman, James Cromwell,Thriller Action Drama,"When the president of Russia suddenly dies, a man whose politics are virtually unknown succeeds him. The change in political leaders sparks paranoia among American CIA officials, so CIA director Bill Cabot recruits a young analyst to supply insight and advice on the situation. Then the unthinkable happens: a nuclear bomb explodes in a U.S. city, and America is quick to blame the Russians.",6.4,122967,2002
57022,Sunshine State,John Sayles,Angela Bassett, Edie Falco,Alex Lewis,Drama,"A woman and her new husband returns to her hometown roots in coastal northern Florida, and must deal with family, business, and encroaching real estate development.",6.8,4183,2002
11812,The Sweetest Thing,Roger Kumble,Cameron Diaz, Christina Applegate, Selma Blair,Romance Comedy,"Christina's love life is stuck in neutral. After years of avoiding the hazards of a meaningful relationship, one night while club-hopping with her girlfriends, she meets Peter, her perfect match. Fed up with playing games, she finally gets the courage to let her guard down and follow her heart, only to discover that Peter has suddenly left town. Accompanied by Courtney, she sets out to capture the one that got away.",5.2,61508,2002
11529,Sweet Home Alabama,Andy Tennant,Reese Witherspoon, Josh Lucas, Patrick Dempsey,Comedy Romance,"New York fashion designer, Melanie Carmichael suddenly finds herself engaged to the city's most eligible bachelor. But her past holds many secrets√É¬¢√Ç¬Ä√Ç¬îincluding Jake, the redneck husband she married in high school, who refuses to divorce her. Bound and determined to end their contentious relationship once and for all, Melanie sneaks back home to Alabama to confront her past.",6.2,121330,2002
12779,Swept Away,Guy Ritchie,Madonna, Adriano Giannini, Bruce Greenwood,Comedy Romance,"Stranded and alone on a desert island during a cruise, a spoiled rich woman and a deckhand fall in love and make a date to reunite after their rescue.",3.6,17587,2002
20616,Swimfan,John Polson,Jesse Bradford, Erika Christensen, Shiri Appleby,Thriller Mystery,"Ben Cronin has it all: the admiration of his many friends, a terrific girlfriend, and he's on the fast-track to an athletic scholarship. Ben's rock-solid, promising future and romance are turned upside-down with the arrival of Madison Bell. Madison, the new girl in town, quickly sets her sights on the impressionable Ben. While their first few meetings are innocent enough, the obsessive and seductive Madison wants more ... much more.",5.1,20967,2002
39141,Tadpole,Gary Winick,Aaron Stanford, Bebe Neuwirth, Sigourney Weaver,Drama Comedy Romance,"Beautiful, sophisticated women are all over Oscar Grubman. He is sensitive and compassionate, speaks French fluently, is passionate about Voltaire, and thinks the feature that tells the most about a woman is her hands. On the train home from Chauncey Academy for the Thanksgiving weekend, Oscar confides in his best friend that he has plans for this vacation--he will win the heart of his true love. But there is one major problem--Oscar's true love is his stepmother Eve.",6.2,6218,2002
16028,They,Robert Harmon,Laura Regan, Marc Blucas, Ethan Embry,Horror Thriller,"After witnessing a horrific and traumatic event, Julia Lund, a graduate student in psychology, gradually comes to the realization that everything which scared her as a child could be real. And what's worse, it might be coming back to get her..",4.8,13526,2002
45767,Time Changer,Rich Christiano,D. David Morin, Gavin MacLeod, Hal Linden,Drama Family Sci-Fi Fantasy,"The year is 1890 and Bible professor Russell Carlisle has written a new manuscript entitled ""The Changing Times"". His colleague, Dr. Norris Anderson, believes that what Carlisle has written could greatly affect the future of coming generations and, using his secret time machine, Anderson sends Carlisle over 100 years into the future, offering him a glimpse of where his beliefs will lead.",5.2,2761,2002
2135,The Time Machine,Simon Wells,Guy Pearce, Samantha Mumba, Jeremy Irons,Sci-Fi Adventure Action,"Hoping to alter the events of the past, a 19th century inventor instead travels 800,000 years into the future, where he finds mankind divided into two warring races.",6,128856,2002
57486,Timequest,Robert Dyke,Victor Slezak, Caprice Benedetti, Bruce Campbell,Sci-Fi,"A story about a man who travels back in time to Fort Worth, Texas on Novemeber 22, 1963 and prevents the assassination of President John F. Kennedy.",5.3,714,2002
4108,The Transporter,Corey Yuen,Jason Statham, Shu Qi, Matt Schulze,Action Crime Thriller,"Former Special Forces officer, Frank Martin will deliver anything to anyone for the right price, and his no-questions-asked policy puts him in high demand. But when he realizes his latest cargo is alive, it sets in motion a dangerous chain of events. The bound and gagged Lai is being smuggled to France by a shady American businessman, and Frank works to save her as his own illegal activities are uncovered by a French detective.",6.8,316768,2002
9039,Trapped,Luis Mandoki,Charlize Theron, Courtney Love, Stuart Townsend,Action Crime Thriller,"When their daughter is kidnapped by experienced nappers, the Jennings turn the tables on this seemingly foolproof plan.",6.1,25023,2002
9016,Treasure Planet,"Ron Clements, John Musker",Joseph Gordon-Levitt, Brian Murray, David Hyde Pierce,Adventure Animation Family Fantasy Sci-Fi,"When space galleon cabin boy Jim Hawkins discovers a map to an intergalactic ""loot of a thousand worlds,"" a cyborg cook named John Silver teaches him to battle supernovas and space storms on their journey to find treasure.",7.2,129463,2002
54714,The Trials of Henry Kissinger,Eugene Jarecki,Brian Cox,Henry Kissinger,Anna Chennault,Documentary,"This riveting documentary depicts former Secretary of State Henry Kissinger as a warmonger responsible for military cover-ups in Vietnam, Cambodia and East Timor, as well as the assassination of a Chilean leader in 1970. Based on a book by journalist Christopher Hitchens, the film includes interviews with historians, political analysts and such journalists as New York Times writer William Safire, a former Nixon speechwriter.",7.6,2063,2002
13440,The Truth About Charlie,Jonathan Demme,Mark Wahlberg, Thandie Newton, Tim Robbins,Thriller Mystery,"Regina meets charming Joshua while vacationing in Martinique, as she contemplates ending her whirlwind marriage to enigmatic Charlie. Upon her return to Paris, she finds that both her apartment and her bank account have been emptied, and her husband has been murdered. The more Reggie learns, the more she realizes the scope of the puzzle which she must solve to protect herself from ever-increasing danger.",4.7,10917,2002
13768,Tuck Everlasting,Jay Russell,Alexis Bledel, Jonathan Jackson, William Hurt,Drama Family Fantasy Romance,"Teenager Winnie Foster is growing up in a small rural town in 1914 with her loving but overprotective parents, but Winnie longs for a life of greater freedom and adventure.",6.6,25035,2002
10771,The Tuxedo,Kevin Donovan,Jackie Chan, Jennifer Love Hewitt, Jason Isaacs,Thriller Action Comedy Sci-Fi,"Cabbie-turned-chauffeur Jimmy Tong learns there is really only one rule when you work for playboy millionaire Clark Devlin : Never touch Devlin's prized tuxedo. But when Devlin is temporarily put out of commission in an explosive accident, Jimmy puts on the tux and soon discovers that this extraordinary suit may be more black belt than black tie. Paired with a partner as inexperienced as he is, Jimmy becomes an unwitting secret agent.",5.4,87530,2002
2642,Two Weeks Notice,Marc Lawrence,Sandra Bullock, Hugh Grant,Alicia Witt,Comedy Romance,"Dedicated environmental lawyer Lucy Kelson goes to work for billionaire George Wade as part of a deal to preserve a community center. Indecisive and weak-willed George grows dependent on Lucy's guidance on everything from legal matters to clothing. Exasperated, Lucy gives notice and picks Harvard graduate June Carter as her replacement. As Lucy's time at the firm nears an end, she grows jealous of June and has second thoughts about leaving George.",6.1,123961,2002
12277,Undercover Brother,Malcolm D. Lee,Eddie Griffin, Chris Kattan, Dave Chappelle,Action Comedy,"An Afro-American organization, the B.R.O.T.H.E.R.H.O.O.D., is in permanent fight against a white organization ""The Man"" defending the values of the black people in North America. When the Afro-American candidate Gen. Warren Boutwell behaves strangely in his presidential campaign, Undercover Brother is hired to work undercover for ""The Man"" and find what happened with the potential candidate.",5.9,35932,2002
15070,Undisputed,Walter Hill,Wesley Snipes, Ving Rhames, Peter Falk,Drama Crime,"Monroe Hutchens is the heavyweight champion of Sweetwater, a maximum security prison. He was convicted to a life sentence due to a passionate crime. Iceman Chambers is the heavyweight champion, who lost his title due to a rape conviction to ten years in Sweetwater. WHen these two giants collide in the same prison, they fight against each other disputing who is the real champion.",6.1,33882,2002
2251,Unfaithful,Adrian Lyne,Diane Lane, Richard Gere, Olivier Martinez,Thriller Drama,"Connie is a wife and mother whose 11-year marriage to Edward has lost its sexual spark. When Connie literally runs into handsome book collector Paul, he sweeps her into an all-consuming affair. But Edward soon becomes suspicious and decides to confront the other man.",6.7,95609,2002
21118,Waking Up in Reno,Jordan Brady,Natasha Richardson, Billy Bob Thornton, Charlize Theron,Comedy Romance,"Candy and Lonnie Earl are just crazy about each other. The problem: she's married to Roy and he's married to Darlene. So far it's been a secret affair. But that's about to change, because this foursome is driving cross-country and headed for some big surprises.",5.4,6194,2002
10229,A Walk to Remember,Adam Shankman,Shane West, Mandy Moore, Peter Coyote,Drama Romance,"When the popular, restless Landon Carter is forced to participate in the school drama production he falls in love with Jamie Sullivan, the daughter of the town's minister. Jamie has a ""to-do"" list for her life and also a very big secret she must keep from Landon.",7.3,218500,2002
10590,We Were Soldiers,Randall Wallace,Mel Gibson, Sam Elliott, Madeleine Stowe,Action History War,The story of the first major battle of the American phase of the Vietnam War and the soldiers on both sides that fought it.,7.1,149178,2002
9260,Welcome to Collinwood,"Anthony Russo, Joe Russo",William H. Macy, Isaiah Washington, Michael Jeter,Comedy Crime,"Five hapless inner-city low-lifes attempt to burgle a pawnbroker's safe, but end up being plagued by bad luck.",6.3,15491,2002
10994,White Oleander,Peter Kosminsky,Alison Lohman, Michelle Pfeiffer, Robin Wright,Drama,A teenager journeys through a series of foster homes after her mother goes to prison for committing a crime of passion.,7.1,33703,2002
14317,The Wild Thornberrys,Cathy Malkasian and Jeff McGrath,Lacey Chabert, Tom Kane, Tim Curry,Animation Adventure Family,"Eliza and Debbie are two sisters who don't always get along. But their relationship is put to the test when Debbie's life is in danger, and Eliza might have to give up her power to talk to animals....",5.6,15148,2002
12100,Windtalkers,John Woo,Nicolas Cage, Christian Slater, Adam Beach,War Drama Action History,"Joe Enders is a gung-ho Marine assigned to protect a ""windtalker"" - one of several Navajo Indians who were used to relay messages during World War II because their spoken language was indecipherable to Japanese code breakers.",6.1,72659,2002
7451,xXx,Rob Cohen,Vin Diesel, Asia Argento, Marton Csokas,Action Adventure Thriller,"Xander Cage is your standard adrenaline junkie with no fear and a lousy attitude. When the US Government ""recruits"" him to go on a mission, he's not exactly thrilled. His mission: to gather information on an organization that may just be planning the destruction of the world, led by the nihilistic Yorgi.",5.8,184718,2002
13442,Zig Zag,David S. Goyer,John Leguizamo, Wesley Snipes, Oliver Platt,Drama,"An autistic 15-year-old boy steals money from his boss to provide rent for his abusive father, who uses the money to repay a loan shark.",5.9,1557,2002
