Movie_id,Title,Director,Actor1,Actor2,Actor3,Genre,Overview,Ratings,Votes,Year
67232,Daughter from Danang,"Gail Dolgin, Vicente Franco",Mai Thi Kim,Heidi Neville-Bub,Gerald Ford,Documentary,"In 1975, as the Vietnam War was ending, thousands of orphans and Amerasian children were brought to the United States as part of ""Operation Babylift."" Daughter from Danang tells the dramatic story of one of these children, Heidi Bub (a.k.a. Mai Thi Hiep), and her Vietnamese mother, Mai Thi Kim, separated at the war's end and reunited 22 years later. Heidi, now living in Tennessee - a married woman with kids - had always dreamt of a joyful reunion. When she ventures to Vietnam to meet her mother, she unknowingly embarks on an emotional pilgrimage that spans decades and distance. Unlike most reunion stories that climax with a clich√É¬É√Ç¬© happy ending, Daughter from Danang is a real-life drama. Journeying from the Vietnam War to Pulaski, Tennessee and back to Vietnam, Daughter from Danang tensely unfolds as cultural differences and the years of separation take their toll in a riveting film about longing and the personal legacy of war.",7.5,614,2002
9275,Death to Smoochy,Danny DeVito,Robin Williams, Edward Norton, Danny DeVito,Comedy Crime Drama Thriller,"Tells the story of Rainbow Randolph, the corrupt, costumed star of a popular children's TV show, who is fired over a bribery scandal and replaced by squeaky-clean Smoochy, a puffy fuscia rhinoceros. As Smoochy catapults to fame - scoring hit ratings and the affections of a network executive - Randolph makes the unsuspecting rhino the target of his numerous outrageous attempts to exact revenge and reclaim his status as America's sweetheart.",6.3,42132,2002
11669,Demon Island,David and Scott Hillenbrand,Nicholas Brendon, Jaime Pressly, Eugene Byrd,Horror,"An epidemic of appliance madness unrelated to discount sales strikes an island off the coast of France: the islanders are being murderously attacked by ovens and refrigerators acquired in the same department store. Enter the young Dr. Gabrielle Martin (Anny Duperey), who arrives here to escape her own personal tragedy and instead lands in the middle of the kitchen mania. She tracks down the cause of the rapidly spreading epidemic to another doctor on the island √É¬¢√Ç¬Ä√Ç¬î quite as insane as any of the kitchen appliances (if the comparison could be made) √É¬¢√Ç¬Ä√Ç¬î and finds that the villainous doctor and the appliances have a most unusual link. Graphic scenes of mutilation by an oven, as one example, leave nothing much to the imagination in this film, but the interpretations of actors Anny Duperey and Jean-Claude Brialy as the good and evil doctors are excellent.",2.5,4502,2002
13201,Deuces Wild,Scott Kalvert,Stephen Dorff, Brad Renfro, Fairuza Balk,Action Crime Drama Romance,"1950s New York City. A bad and bloody gang war is about to erupt on the dysfunctional streets of Brooklyn. The Deuces at war with the vicious Vipers. Scott Kalvert directs this tale of lust, drugs, mayhem and madness during one hot summer on the streets of New York.",5.6,7759,2002
9583,Divine Secrets of the Ya-Ya Sisterhood,Callie Khouri,Ellen Burstyn, Sandra Bullock, James Garner,Comedy Drama,"A mother and daughter dispute is resolved by the ""Yaya sisterhood"" - long time friends of the mother.",6.1,20699,2002
10052,Dragonfly,Tom Shadyac,Kevin Costner, Joe Morton, Ron Rifkin,Thriller Fantasy,A grieving doctor is being contacted by his late wife through his patient's near death experiences.,6.1,39626,2002
13497,Drumline,Charles Stone III,Nick Cannon, Zoe Saldana, Orlando Jones,Drama Romance Comedy Music,"A talented street drummer from Harlem enrolls in a Southern university, expecting to lead its marching band's drumline to victory. He initially flounders in his new world, before realizing that it takes more than talent to reach the top.",5.9,35764,2002
275733,Easy Listening,Pamela Corkey,David Ian, Traci Crouch, Timothy Crowe,"Comedy, Drama, Music","Wanna-be hipster Burt is a trumpet player who'd rather be playing jazz instead of what he's doing now -- making what he considers watered-down, lifeless music as part of a nameless, faceless orchestra. But his tune changes when happy-go-lucky Linda, a flutist, joins the ensemble and shows him there's more to life than pining for a dream.",6.9,40,2002
13376,Eight Crazy Nights,Seth Kearsley,Adam Sandler, Allen Covert, Jack Giarraputo,Animation Comedy,"Davey Stone, a 33-year old party animal, finds himself in trouble with the law after his wild ways go too far.",5.3,24499,2002
8869,Eight Legged Freaks,Ellory Elkayem,David Arquette,Kari Samantha Wuhrer, Scarlett Johansson,Action Comedy Horror Thriller,"The residents of a rural mining town discover that an unfortunate chemical spill has caused hundreds of little spiders to mutate overnight to the size of SUVs. It's then up to mining engineer Chris McCormack and Sheriff Sam Parker to mobilize an eclectic group of townspeople, including the Sheriff's young son, Mike, her daughter, Ashley, and paranoid radio announcer Harlan, into battle against the bloodthirsty eight-legged beasts.",5.5,59562,2002
17187,The Emperor's Club,Michael Hoffman,Kevin Kline, Emile Hirsch, Embeth Davidtz,Drama,"William Hundert is a passionate and principled Classics professor who finds his tightly-controlled world shaken and inexorably altered when a new student, Sedgewick Bell, walks into his classroom. What begins as a fierce battle of wills gives way to a close student-teacher relationship, but results in a life lesson for Hundert that will still haunt him a quarter of a century later.",6.9,17710,2002
13369,Empire,Franc. Reyes,John Leguizamo, Peter Sarsgaard, Denise Richards,Crime Action Drama,A big time drug dealer Victor Rosa is looking to get out of the game and sees his chance with a big deal with a new friend who happens to be a Wall St. stockbroker. Thinking this will be his chance to go out on top Victor soon finds out that he has been double crossed and his last option is to get revenge.,5.9,7810,2002
1957,Enough,Michael Apted,Jennifer Lopez, Billy Campbell, Juliette Lewis,Drama Thriller,"Working-class waitress Slim thought she was entering a life of domestic bliss when she married Mitch, the man of her dreams. After the arrival of their first child, her picture perfect life is shattered when she discovers Mitch's hidden possessive dark side, a controlling and abusive alter ego that can turn trust, love and tranquility into terror. Terrified for her child's safety, Slim flees with her daughter. Relentless in his pursuit and enlisting the aid of lethal henchmen, Mitch continually stalks the prey that was once his family.",5.7,46813,2002
7299,Equilibrium,Kurt Wimmer,Christian Bale, Taye Diggs, Emily Watson,Action Sci-Fi Thriller,"In a dystopian future, a totalitarian regime maintains peace by subduing the populace with a drug, and displays of emotion are punishable by death. A man in charge of enforcing the law rises to overthrow the system.",7.3,343238,2002
21868,Evelyn,Bruce Beresford,Sophie Vavasseur, Pierce Brosnan, Aidan Quinn,Drama,"Desmond Doyle is devastated when his wife abandons their family on the day after Christmas. His unemployment, and the fact that there is no woman in the house to care for the children√É¬¢√Ç¬Ä√Ç¬îEvelyn, Dermot and Maurice√É¬¢√Ç¬Ä√Ç¬îmake it clear to the authorities this is an untenable situation. The Catholic Church and the Irish courts decide to put the Doyle children into Church-run orphanages.",7,7017,2002
10712,Far from Heaven,Todd Haynes,Julianne Moore, Dennis Quaid, Dennis Haysbert,Drama Romance,"In 1950s Connecticut, a housewife's life is upended by a marital crisis and mounting racial tensions in society.",7.3,48358,2002
9544,FeardotCom,William Malone,Stephen Dorff, Natascha McElhone, Stephen Rea,Horror Thriller Crime,"When four bodies are discovered among the industrial decay and urban grime of New York City, brash young detective Mike Reilly teams with ambitious Department of Health researcher Terry Huston to uncover the cause behind their violent and inexplicable deaths. The only common factor shared by the victims? Each died exactly 48 hours after logging onto a website called feardotcom.",3.4,22415,2002
23855,The First $20 Million Is Always the Hardest,Mick Jackson,Adam Garcia, Rosario Dawson, Jake Busey,Comedy,"Andy, a successful marketing guy quits his job, gets a new job at a research facility, makes a powerful enemy who makes him volunteer for a nearly impossible project: The $99 PC. The only available guys at the lab, three sociopaths, together they compile a revolutionary PC for $99, then they become the victims of a venture capitalist and Andy's old foe, can he find a way to overcome the problems?",5.5,3233,2002
1360,Frida,Julie Taymor,Salma Hayek, Alfred Molina, Geoffrey Rush,Drama Romance,"A biography of artist Frida Kahlo, who channeled the pain of a crippling injury and her tempestuous marriage into her work.",7.3,93993,2002
10426,Friday After Next,Marcus Raboy,Ice Cube, Mike Epps, John Witherspoon,Comedy,"Craig and his cousin Day Day have finally moved out of their parents' houses and into their own crib, working nights at a local mall as security guards. When their house is robbed on Christmas Eve they set out to track down the culprit.",5.8,29407,2002
10568,The Four Feathers,Shekhar Kapur,Heath Ledger, Wes Bentley, Kate Hudson,Adventure Drama War History,A disgraced officer risks his life to help his childhood friends in battle.,6.5,35175,2002
15186,Full Frontal,Steven Soderbergh,David Duchovny, Nicky Katt, Catherine Keener,Comedy Romance,"A day in the life of a group of men and women in Hollywood, in the hours leading up to a friend's birthday party.",4.7,11236,2002
3131,Gangs of New York,Martin Scorsese,Leonardo DiCaprio, Daniel Day-Lewis, Lawrence Gilliard Jr.,Drama History Crime,"In 1863, Amsterdam Vallon returns to the Five Points of America to seek vengeance against the psychotic gangland kingpin, Bill the Butcher, who murdered his father years earlier. With an eager pickpocket by his side and a whole new army, Vallon fights his way to seek vengeance on the Butcher and restore peace in the area.",7.5,464177,2002
9645,Ghost Ship,Steve Beck,Gabriel Byrne, Julianna Margulies, Desmond Harrington,Horror Mystery Thriller,"After discovering a passenger ship missing since 1962 floating adrift on the Bering Sea, salvagers claim the vessel as their own. Once they begin towing the ghost ship towards harbor, a series of bizarre occurrences happen and the group becomes trapped inside the ship, which they soon learn is inhabited by a demonic creature.",5.6,107728,2002
9962,The Good Girl,Miguel Arteta,Jennifer Aniston, Jake Gyllenhaal, John C. Reilly,Drama Comedy Romance,A discount store clerk strikes up an affair with a stock boy who considers himself the incarnation of Holden Caulfield.,6.4,46781,2002
75454,Groom Lake,William Shatner,William Shatner, Dan Gauthier, Amy Acker,Sci-Fi Horror,"When Kate discovers she has a terminal illness, she persuades boyfriend Andy to visit Groom Lake, a reputed hotbed of alien activity, hoping to discover proof of life beyond this terrestrial sphere. Soon, the pair crosses paths with desperate government scientists, eccentric locals and a surprising -- and inspiring --conspiracy of epic proportions.",2.8,789,2002
9027,The Guru,Daisy von Scherler Mayer,Jimi Mistry, Heather Graham, Marisa Tomei,Comedy Romance,"Bored with Bollywood movies but fascinated with their Hollywood counterparts from his youth, Ram dreams to become a singer and actor in America, the country where dreams are made. He is encouraged when his American-based close friend, Vijay Rao, comes for visit, and brags about driving a Mercedes and living in a penthouse.",5.4,15439,2002
65684,The Guys,Jim Simpson,Sigourney Weaver, Anthony LaPaglia, Jim Simpson,Drama,The story of a fire captain who lost eight men in the collapse of the World Trade Center and the editor who helps him prepare the eulogies he must deliver.,6.3,1402,2002
10167,Half Past Dead,Don Michael Paul,Steven Seagal, Morris Chestnut, Ja Rule,Crime Action Thriller,"A man goes undercover in a hi-tech prison to find out information to help prosecute those who killed his wife. While there, he stumbles onto a plot involving a death-row inmate and his $200 million stash of gold.",4.6,16512,2002
11442,Halloween: Resurrection,Rick Rosenthal,Busta Rhymes, Bianca Kajlich, Thomas Ian Nicholas,Horror Thriller,"Serial Killer Michael Myers is not finished with Laurie Strode, and their rivalry finally comes to an end. But is this the last we see of Myers? Freddie Harris and Nora Winston are reality programmers at DangerTainment, and are planning to send a group of 6 thrill-seeking teenagers into the childhood home of Myers. Cameras are placed all over the house and no one can get out of the house... and then Michael arrives home!",3.9,48454,2002
672,Harry Potter and the Chamber of Secrets,Chris Columbus,Daniel Radcliffe, Rupert Grint, Emma Watson,Adventure Fantasy,"Cars fly, trees fight back, and a mysterious house-elf comes to warn Harry Potter at the start of his second year at Hogwarts. Adventure and danger await when bloody writing on a wall announces: The Chamber Of Secrets Has Been Opened. To save Hogwarts will require all of Harry, Ron and Hermione√É¬¢√Ç¬Ä√Ç¬ôs magical abilities and courage.",7.4,675548,2002
10592,Hart's War,Gregory Hoblit,Bruce Willis, Colin Farrell, Terrence Howard,Drama War,"When Col. William McNamara is stripped of his freedom in a German POW camp, he's determined to keep on fighting even from behind enemy lines. Enlisting the help of a young lieutenant in a brilliant plot against his captors, McNamara risks everything on a mission to free his men and change the outcome of the war.",6.3,54724,2002
17710,Hey Arnold!: The Movie,Tuck Tucker,Spencer Klein, Francesca Marie Smith, Jamil Walker Smith,Animation Comedy Family,Arnold and his friends must recover a stolen document in order to prevent the neighborhood from being bulldozed.,5.9,7698,2002
11560,High Crimes,Carl Franklin,Ashley Judd, Morgan Freeman, James Caviezel,Drama Mystery Thriller Crime,"A female attorney learns that her husband is really a marine officer awol for fifteen years and accused of murdering fifteen civilians in El Salvador. Believing her husband when he tells her that he's being framed as part of a U.S. Military cover-up, the attorney defends him in a military court.",6.4,47135,2002
18808,Highway,James Cox,Jared Leto, Jake Gyllenhaal, Selma Blair,Action Adventure Drama,"Jack is caught with the wife of his employer, a Vegas thug. The thug sends goons after Jack, who convinces his best friend, Pilot, to flee with him. Pilot insists that they head for Seattle, but doesn't tell Jack why. The goons learn from Pilot's drug source where the youths are headed, and they follow, hell bent on breaking Jack's feet. On the road, Jack and Pilot give a ride to Cassie, a distressed young woman. She and Jack hit it off. They pick up an aging stoner headed to Seattle for Kurt Cobain's memorial, and they help a circus sideshow family. Why is Pilot so set on Seattle, will the goons catch Jack, and is there any way the friends' competing needs can be resolved?",6.1,6716,2002
9689,Hollywood Ending,Woody Allen,Woody Allen, George Hamilton,TÈa Leoni,Comedy,"Woody Allen stars as Val Waxman, a two-time Oscar winner turned washed-up, neurotic director in desperate need of a comeback. When it comes, Waxman finds himself backed into a corner: Work for his ex-wife Ellie or forfeit his last shot. Is Val blinded by love when he opts for the reconnect? Is love blind when it comes to Ellie's staunch support? Literally and figuratively, the proof is the picture.",6.5,27878,2002
55015,Home Room,Paul F. Ryan,Erika Christensen, Busy Philipps, Victor Garber,Drama,A high school shooting has repercussions on the town and students.,7.1,3409,2002
11852,The Hot Chick,Tom Brady,Rob Schneider, Rachel McAdams, Anna Faris,Comedy Fantasy,"Not only is Jessica Spencer the most popular girl in school -- she is also the meanest. But things change for the attractive teen when a freak accident involving a cursed pair of earrings and a chance encounter at a gas station causes her to switch bodies with Clive, a sleazy crook. Jessica, in the form of the repulsive Clive, struggles to adjust to this radical alteration and sets out to get her own body back before the upcoming prom.",5.5,100802,2002
590,The Hours,Stephen Daldry,Nicole Kidman, Julianne Moore, Meryl Streep,Drama,"""The Hours"" is the story of three women searching for more potent, meaningful lives. Each is alive at a different time and place, all are linked by their yearnings and their fears. Their stories intertwine, and finally come together in a surprising, transcendent moment of shared recognition.",7.5,137010,2002
45069,Hysterical Blindness,Mira Nair,Uma Thurman, Juliette Lewis, Gena Rowlands,Drama Romance TV Movie,Two friends lament their unhappy single lives while searching for Mr. Right in 1980s New Jersey.,6.5,3365,2002
8427,I Spy,Betty Thomas,Owen Wilson, Eddie Murphy, Famke Janssen,Action Adventure Comedy Thriller,"When the Switchblade, the most sophisticated prototype stealth fighter created yet, is stolen from the U.S. government, one of the United States' top spies, Alex Scott, is called to action. What he doesn't expect is to get teamed up with a cocky civilian, World Class Boxing Champion Kelly Robinson, on a dangerous top secret espionage mission. Their assignment: using equal parts skill and humor, catch Arnold Gundars, one of the world's most successful arms dealers.",5.4,52923,2002
425,Ice Age,Chris Wedge,Ray Romano, John Leguizamo, Denis Leary,Animation Comedy Family Adventure,"With the impending ice age almost upon them, a mismatched trio of prehistoric critters √É¬¢√Ç¬Ä√Ç¬ì Manny the woolly mammoth, Diego the saber-toothed tiger and Sid the giant sloth √É¬¢√Ç¬Ä√Ç¬ì find an orphaned infant and decide to return it to its human parents. Along the way, the unlikely allies become friends but, when enemies attack, their quest takes on far nobler aims.",7.5,507844,2002
9685,Igby Goes Down,Burr Steers,Kieran Culkin, Claire Danes, Jeff Goldblum,Comedy Drama,"Igby Slocumb, a rebellious and sarcastic 17-year-old boy, is at war with the stifling world of old money privilege he was born into. With a schizophrenic father, a self-absorbed, distant mother, and a shark-like young Republican big brother, Igby figures there must be a better life out there -- and sets about finding it.",6.9,34618,2002
4965,Impostor,Gary Fleder,Gary Sinise, Madeleine Stowe, Mekhi Phifer,Action Sci-Fi Thriller,A top-secret government weapons designer is arrested by a clandestine government organization on suspicion of being a clone created by the hostile alien race wanting to take over Earth.,6.1,24399,2002
20312,Interstate 60,Bob Gale,James Marsden, Gary Oldman, Amy Smart,Adventure Comedy Fantasy,An aspiring painter meets various characters and learns valuable lessons while traveling across America.,7.6,35879,2002
320,Insomnia,Christopher Nolan,Al Pacino, Robin Williams, Hilary Swank,Thriller Crime,Two Los Angeles homicide detectives are dispatched to a northern town where the sun doesn't set to investigate the methodical murder of a local teen.,7.2,312912,2002
9012,Jackass: The Movie,Jeff Tremaine,Johnny Knoxville, Bam Margera, Chris Pontius,Comedy Documentary,"Johnny Knoxville and his band of maniacs perform a variety of stunts and gross-out gags on the big screen for the first time. They wander around Japan in panda outfits, wreak havoc on a once civilized golf course, they even do stunts involving LIVE alligators, and so on.",6.6,100793,2002
11470,Jason X,James Isaac,Kane Hodder, Lexa Doig, Lisa Ryder,Horror Sci-Fi,"In the year 2455, Old Earth is now a contaminated planet abandoned for centuries -- a brown world of violent storms, toxic landmasses and poisonous seas. Yet humans have returned to the deadly place that they once fled, not to live, but to research the ancient, rusting artifacts of the long-gone civilizations. But it's not the harmful environment that could prove fatal to the intrepid, young explorers who have just landed on Old Earth. For them, it's Friday the 13th, and Jason lives!",5.3,106,2002
8470,John Q,Nick Cassavetes,Denzel Washington, Robert Duvall, James Woods,Drama Thriller Crime,"John Quincy Archibald is a father and husband whose son is diagnosed with an enlarged heart and then finds out he cannot receive a transplant because HMO insurance will not cover it. Therefore, he decides to take a hospital full of patients hostage until the hospital puts his son's name on the donor's list.",7.1,141734,2002
15173,Jonah: A VeggieTales Movie,Phil Vischer,Phil Vischer, Mike Nawrocki, Tim Hodge,Adventure Animation Comedy Family Music,"Get ready as Bob the Tomato, Larry the Cucumber and the rest of the Veggies set sail on a whale of an adventure in Big Idea's first full-length, 3-D animated feature film. This is the story of Jonah and the Whale as you've never seen it before - a story where we learn that one of the best gifts you can give - or get - is a second chance.",6.4,4450,2002
35696,Juwanna Mann,Jesse Vaughan,Miguel A. N√∫√±ez Jr., Vivica A. Fox, Kevin Pollak,Comedy,"A basketball star is booted out of the NBA when his on-court antics go too far, so he poses as a woman and joins the WUBA.",4.7,6981,2002
8665,K-19: The Widowmaker,Kathryn Bigelow,Harrison Ford,Sam Spruell,Peter Stebbings,Drama History War Thriller Mystery,"When Russia's first nuclear submarine malfunctions on its maiden voyage, the crew must race to save the ship and prevent a nuclear disaster.",6.7,66338,2002
47354,K-9: P.I.,Richard J. Lewis,James Belushi,Gary Basaraba,Kim Huffman,Action Comedy Crime,Dooley and his K-9 partner Jerry Lee are ready to retire from the police force. But before he can retire with his pension he must work as a P.I. to find a set of high tech computer chips.,5.8,3415,2002
29047,The Kid Stays in the Picture,Nanette Burstein,Robert Evans,Eddie Albert,Peter Bart,Documentary,"Documentary about legendary Paramount producer Robert Evans, based on his famous 1994 autobiography.",7.3,7888,2002
14365,Killing Me Softly,Chen Kaige,Heather Graham,Joseph Fiennes,Natascha McElhone,Thriller,A woman grows suspicious of her controlling husband after she discovers secrets about the women in his past.,5.4,18959,2002
19844,Kiss the Bride,Vanessa Parise,Amanda Detmer, Sean Patrick Flanery, Brooke Langton,Drama Comedy Romance,"In high school, Matt and Ryan were best friends. More than friends, actually. But in the ensuing ten years, they've lost contact. So when Matt receives an invitation to Ryan's wedding he's surprised - especially that Ryan is marrying a woman!",5.3,1242,2002
11891,Kung Pow! Enter the Fist,Steve Oedekerk,Steve Oedekerk, Jennifer Tung, Lung Fei,Comedy Action,"A movie within a movie, created to spoof the martial arts genre. Writer/director Steve Oedekerk uses contemporary characters and splices them into a 1970s kung-fu film, weaving the new and old together.  As the main character, The Chosen One, Oedekerk sets off to avenge the deaths of his parents at the hands of kung-fu legend Master Pain. Along the way he encounters some strange characters.",6.2,48011,2002
754058,The Laramie Project,Mois√©s Kaufman,Nestor Carbonell, Christina Ricci, Dylan Baker,Drama,"The true story of Matthew Shepard's murder is told through the eyes of the citizens of Laramie. His death proved to be a catalyst of change for LGBTQIA+ people in our country, but we still need to continue to work on equity issues for many groups of oppressed and marginalized individuals in our country.",7.1,6881,2002
675480,Last Call,Henry Bromell,Jeremy Irons, Neve Campbell, Sissy Spacek,Comedy,A real estate developer returns to his old Philly neighborhood and must decide to raze or resurrect the family bar.,6.5,959,2002
13819,Laurel Canyon,Lisa Cholodenko,Frances McDormand, Christian Bale, Kate Beckinsalee,Drama,"Laurel Canyon focuses on Sam and Alex, a pair of upper-middle class lovebirds from the East Coast who relocate to Los Angeles. Enter Jane, Sam's estranged mother, a successful record producer, who's more than willing to put the couple up in her lavish digs. As Sam and Alex settle in at Jane's, they gradually lose their straight-and-narrow approach to life and begin to experiment.",6.4,17332,2002
16643,Life or Something Like It,Stephen Herek,Angelina Jolie, Edward Burns, Tony Shalhoub,Comedy Drama Romance,"A reporter Lanie Kerrigan interviews a psychic homeless man for a fluff piece about a football game's score. Instead he tells her that her life has no meaning and is going to end in just a few days, which sparks her to action, trying to change the pattern of her life...",5.7,27654,2002
21972,Like Mike,John Schultz,Bow Wow, Morris Chestnut, Jonathan Lipnicki,Family Comedy Fantasy,"Calvin and his friends, who all live in an orphanage, find old shoes with the faded letters MJ connected to a powerline. One stormy night, they go to get the shoes when Calvin and the shoes are struck by lightning. Calvin now has unbelievable basketball powers and has the chance to play for the NBA.",5.4,22118,2002
11544,Lilo & Stitch,Chris Sanders,Daveigh Chase, Chris Sanders, Tia Carrere,Animation Family,"As Stitch, a runaway genetic experiment from a faraway planet, wreaks havoc on the Hawaiian Islands, he becomes the mischievous adopted alien ""puppy"" of an independent little girl named Lilo and learns about loyalty, friendship, and √É¬ä√Ç¬ªohana, the Hawaiian tradition of family.",7.3,206759,2002
