Movie_id,Title,Director,Actor1,Actor2,Actor3,Genre,Overview,Ratings,Votes,Year
121,The Lord of the Rings: The Two Towers,Peter Jackson,Elijah Wood, Ian McKellen, Liv Tyler,Adventure Fantasy Action,"Frodo and Sam are trekking to Mordor to destroy the One Ring of Power while Gimli, Legolas and Aragorn search for the orc-captured Merry and Pippin. All along, nefarious wizard Saruman awaits the Fellowship members at the Orthanc Tower in Isengard.",8.8,1745868,2002
7303,Maid in Manhattan,Wayne Wang,Jennifer Lopez, Ralph Fiennes, Natasha Richardson,Comedy Drama Romance,"Marisa Ventura is a struggling single mom who works at a posh Manhattan hotel and dreams of a better life for her and her young son. One fateful day, hotel guest and senatorial candidate Christopher Marshall meets Marisa and mistakes her for a wealthy socialite. After an enchanting evening together, the two fall madly in love. But when Marisa's true identity is revealed, issues of class and social status threaten to separate them. Can two people from very different worlds overcome their differences and live happily ever after?",5.4,94666,2002
15720,The Man from Elysian Fields,George Hickenlooper,Andy Garc√≠a, Mick Jagger, Olivia Williams,Drama Romance,A failed novelist's inability to pay the bills strains relations with his wife and leads him to work at an escort service where he becomes entwined with a wealthy woman whose husband is a successful writer.,6.6,4431,2002
13908,The Master of Disguise,Perry Andelin Blake,Dana Carvey, Jennifer Esposito, Harold Gould,Comedy Family,"After the patriarch of the Disguisey family is kidnapped by Devlin Bowman in an attempt to steal the most precious treasures from around the world, Italian waiter Pistachio Disguisey utilizes his supernatural ability to disguise himself in an attempt to stop him.",3.3,26819,2002
608,Men in Black II,Barry Sonnenfeld,Tommy Lee Jones, Will Smith, Rip Torn,Action Adventure Comedy Sci-Fi,"Kay and Jay reunite to provide our best, last and only line of defense against a sinister seductress who levels the toughest challenge yet to the MIB's untarnished mission statement √É¬¢√Ç¬Ä√Ç¬ì protecting Earth from the scum of the universe. It's been four years since the alien-seeking agents averted an intergalactic disaster of epic proportions. Now it's a race against the clock as Jay must convince Kay √É¬¢√Ç¬Ä√Ç¬ì who not only has absolutely no memory of his time spent with the MIB, but is also the only living person left with the expertise to save the galaxy √É¬¢√Ç¬Ä√Ç¬ì to reunite with the MIB before the earth submits to ultimate destruction.",6.2,396222,2002
180,Minority Report,Steven Spielberg,Tom Cruise, Colin Farrell, Samantha Morton,Action Thriller Sci-Fi Mystery,"John Anderton is a top 'Precrime' cop in the late-21st century, when technology can predict crimes before they're committed. But Anderton becomes the quarry when another investigator targets him for a murder charge.",7.6,575737,2002
31005,Moonlight Mile,Brad Silberling,Jake Gyllenhaal, Dustin Hoffman, Susan Sarandon,Romance Drama,"As he copes with the death of his fiancee along with her parents, a young man must figure out what he wants out of life.",6.6,14531,2002
2637,The Mothman Prophecies,Mark Pellington,Richard Gere, Laura Linney, Debra Messing,Drama Horror Mystery,Reporter John Klein is plunged into a world of impossible terror and unthinkable chaos when fate draws him to a sleepy West Virginia town whose residents are being visited by a great winged shape that sows hideous nightmares and fevered visions.,6.4,83661,2002
2022,Mr. Deeds,Steven Brill,Adam Sandler, Winona Ryder, John Turturro,Comedy Romance,"When Longfellow Deeds, a small-town pizzeria owner and poet, inherits $40 billion from his deceased uncle, he quickly begins rolling in a different kind of dough. Moving to the big city, Deeds finds himself besieged by opportunists all gunning for their piece of the pie. Babe, a television tabloid reporter, poses as an innocent small-town girl to do an expos√É¬É√Ç¬© on Deeds.",5.8,150571,2002
11892,Murder by Numbers,Barbet Schroeder,Sandra Bullock, Ben Chaplin, Ryan Gosling,Crime Drama Thriller,"Tenacious homicide detective Cassie Mayweather and her still-green partner are working a murder case, attempting to profile two malevolently brilliant young men: cold, calculating killers whose dark secrets might explain their crimes.",6.1,61401,2002
1001811,My Big Fat Greek Wedding,Joel Zwick,Nia Vardalos, John Corbett, Michael Constantine,Romance Comedy,"Following the death of their patriarch Gus, the Portokalos family travels to Greece for a family reunion, and to deliver Gus' journal to his old friends.",6.6,142461,2002
11022,Narc,Joe Carnahan,Jason Patric, Ray Liotta, Chi McBride,Crime Drama Thriller Mystery,"When the trail goes cold on a murder investigation of a policeman, an undercover narcotics officer is lured back to the force to help solve the case.",7.1,42615,2002
11452,National Lampoon's Van Wilder,Walt Becker,Ryan Reynolds, Tara Reid, Kal Penn,Comedy Romance,"Van Wilder has been attending college for far too many years and is scared to graduate, but Van√É¬¢√Ç¬Ä√Ç¬ôs father eventually realizes what is going on. When he stops paying his son's tuition fees, Van must come up with the money if he wants to stay in college, so he and his friends come up with a great fund-raising idea √É¬¢√Ç¬Ä√Ç¬ì throwing parties. However, when the college magazine finds out and reporter, Gwen is sent to do a story on Van Wilder, things get a little complicated.",6.4,113956,2002
44373,New Best Friend,Zoe Clarke-Williams,Mia Kirshner, Meredith Monroe, Dominique Swain,Drama Thriller Mystery,"Alicia is a poor girl starting college. Hadley, Julianne and Sydney are three well-off girls in a row house. Classes begin and Alicia is paired with Hadley to work on a sociology class project. At first rejected, Alicia is finally accepted into Hadley's clique where she is introduced to a world of privilege and dangerous thrills. But her attempts to become one of them ultimately land her in the hospital.",5.2,3428,2002
10985,The New Guy,Ed Decter,DJ Qualls, Eliza Dushku, Zooey Deschanel,Comedy,"Nerdy high school senior Dizzy Harrison has finally gotten lucky -- after purposely getting expelled, he takes lessons in 'badass cool' from a convict and enrolls at a new school. But can he keep up the ruse?",5.8,37258,2002
29339,Nicholas Nickleby,Douglas McGrath,Charlie Hunnam, Christopher Plummer, Jamie Bell,Adventure Drama,"Nicholas Nickleby, a young boy in search of a better life, struggles to save his family and friends from the abusive exploitation of his coldheartedly grasping uncle.",7.1,13343,2002
55249,Night at the Golden Eagle,Adam Rifkin,Donnie Montemarano, Vinny Argiro, Natasha Lyonne,Crime Drama,"Two elderly criminals spend their final night in Los Angeles, California at the Golden Eagle Hotel prior to their departure to Las Vegas, Nevada, to lead a life without crime. Unfortunately, on the hottest night of the summer, these two ex-criminals seemingly get caught in the malice of prostitutes, pimps, drunken bums, fighting monkeys, and young runaways.",5.8,2613,2002
979924,On_Line,Jed Weintrob,Josh Hamilton, Harold Perrineau, Vanessa Ferlito,Thriller,A provocative and edgy radio host must play a dangerous game of cat and mouse with a mysterious caller who's kidnapped his family and is threatening to blow up the whole station.,5.4,633,2002
9357,One Hour Photo,Mark Romanek,Robin Williams, Connie Nielsen, Michael Vartan,Drama Thriller,"Sy ""the photo guy"" Parrish has lovingly developed photos for the Yorkin family since their son was a baby. But as the Yorkins' lives become fuller, Sy's only seems lonelier, until he eventually believes he's part of their family. When ""Uncle"" Sy's picture-perfect fantasy collides with an ugly dose of reality, what happens next ""has the spine-tingling elements of the best psychological thrillers!""",6.8,129859,2002
11857,Orange County,Jake Kasdan,Colin Hanks, Jack Black, Schuyler Fisk,Comedy Drama,"Shaun Brumder is a local surfer kid from Orange County who dreams of going to Stanford to become a writer and to get away from his dysfunctional family household. Except Shaun runs into one complication after another, starting when his application is rejected after his dim-witted guidance counselor sends in the wrong form.",6.2,51569,2002
111440,The Pact,Peter Werner,Megan Mullally, Juliet Stevenson, Henry Czerny,Horror Mystery Thriller,"After their mother passes away, sisters Nicole and Annie reluctantly return to their childhood home to pay their last respects. While staying overnight in the house, the sisters sense a mysterious presence in their midst: noises startling them in the night, objects moving about, a fallen picture of an unknown woman posed next to their mother. Annie begins experiencing a series of intense and disturbing dreams - visions that lead her to uncover something terrible about her mother's past that is finally revealing itself.",5.5,556,2002
13098,Paid in Full,Charles Stone III,Wood Harris, Regina Hall, Kevin Carroll,Action Crime Drama,"Ace is an impressionable young man working for a dry cleaning business. His friend, drug dealer Mitch goes to prison. In an unrelated incident, he finds some cocaine in a pants pocket. Soon, Ace finds himself dealing cocaine for Lulu. Via lucky breaks and solid interpersonal skills, Ace moves to the top of the Harlem drug world. Of course, unfaithful employees and/or rivals conspire to bring about Ace's fall.",7,13906,2002
4547,Panic Room,David Fincher,Jodie Foster, Kristen Stewart, Forest Whitaker,Crime Drama Thriller,"Trapped in their New York brownstone's panic room, a hidden chamber built as a sanctuary in the event of break-ins, newly divorced Meg Altman and her young daughter Sarah play a deadly game of cat-and-mouse with three intruders - Burnham, Raoul and Junior - during a brutal home invasion. But the room itself is the focal point because what the intruders really want is inside it.",6.8,291555,2002
31018,Path to War,John Frankenheimer,Michael Gambon, Alec Baldwin, Donald Sutherland,Drama History TV Movie,A powerful drama of soaring ambition and shattered dreams that takes a provocative insider's look at the way the USA goes to war√É¬¢√Ç¬Ä√Ç¬îas seen from inside the LBJ White House leading up to and during the Vietnam War.,7.3,4003,2002
32625,Personal Velocity: Three Portraits,Rebecca Miller,Kyra Sedgwick, Parker Posey, Fairuza Balk,Drama,"In a series of three vignettes, three women in turn struggle to free themselves from the men who restrict their personal freedom.",6.5,3862,2002
10895,Pinocchio,Roberto Benigni,Roberto Benigni, Nicoletta Braschi, Kim Rossi Stuart,Animation Family,"When loving Geppetto creates a wooden puppet, his wish is granted when it comes to life as a little wooden boy named Pinocchio. With his faithful friend and conscience Jiminy Cricket by his side, Pinocchio, embarks on fantastic adventures that his bravery, loyalty and honesty until triumphs in his triumphs in his quest for his heart's desire: to become a real boy.",4.3,8560,2002
14293,Poolhall Junkies,Mars Callahan,Mars Callahan, Alison Eastwood, Chazz Palminteri,Comedy Drama Thriller,A retired pool hustler is forced to pick up the stick again when his brother starts a game he can't finish.,6.8,10658,2002
21484,Possession,Neil LaBute,Aaron Eckhart, Gwyneth Paltrow, Jeremy Northam,Horror,"A young woman left her family for an unspecified reason. The husband determines to find out the truth and starts following his wife. At first, he suspects that a man is involved. But gradually, he finds out more and more strange behaviors and bizarre incidents that indicate something more than a possessed love affair.",6.3,13615,2002
59387,The Powerpuff Girls Movie,Craig McCracken,Cathy Cavadini, Tara Strong, E.G. Daily,Animation Action Family,"Based on the hit animated television series, this feature film adaptation tells the story of how Blossom, Bubbles and Buttercup - three exuberant young girls - obtain their unique powers, become superheroes and join forces to foil evil mutant monkey Mojo Jojo's plan to take over the world.",6.5,10801,2002
112902,Prisoner of Paradise,Malcolm Clarke,Ian Holm,Robert Lantz,Eleonore Hertzberg,Documentary,"The film tells the true story of Kurt Gerron, a German-Jewish cabaret and film actor in the 1920s and 1930s who was sent to the Theresienstadt concentration camp where he was commanded to write and direct a Nazi propaganda film.",7.5,407,2002
9719,Pumpkin,Anthony Abrams,Christina Ricci, Hank Harris, Brenda Blethyn,Comedy Drama Romance,"Carolyn's sorority sisters set their sights on the Sorority of the Year award and coaching challenged athletes is their ticket to the trophy. But when the queen of formals finds herself mentoring Pumpkin, a disabled athlete, their two worlds collide.",6.1,9400,2002
8051,Punch-Drunk Love,Paul Thomas Anderson,Adam Sandler, Emily Watson, Philip Seymour Hoffman,Romance Drama Comedy,A socially awkward and volatile small business owner meets the love of his life after being threatened by a gang of scammers.,7.3,173408,2002
11979,Queen of the Damned,Michael Rymer,Aaliyah, Stuart Townsend, Marguerite Moreau,Drama Fantasy Horror,"Lestat de Lioncourt is awakened from his slumber. Bored with his existence, he has now become this generation's new Rock God. While in the course of time, another has arisen, Akasha, the Queen of the Vampires and the Dammed. He wants immortal fame, his fellow vampires want him eternally dead for his betrayal, and the Queen wants him for her King. Who will be the first to reach him? Who shall win?",5.2,59115,2002
8198,The Quiet American,Phillip Noyce,Michael Caine, Brendan Fraser,Thi Hai Yen Do,Romance Thriller Drama,"In early 1950s Vietnam, a young American becomes entangled in a dangerous love triangle when he falls for the beautiful mistress of a British journalist. As war is waged around them, the trio sinks deeper into a world of drugs, passion, and betrayal where nothing is as it seems.",7,29402,2002
1046633,R.S.V.P.,Mark Anthony Galluzzo,Rick Otto, Lucas Babin, Glenn Quinn,Comedy Romance,37-year-old single nurse Klara's perpetual search for love increasingly causes her to question whether it even exists.,5.1,1178,2002
30309,Real Women Have Curves,Patricia Cardoso,America Ferrera, Lupe Ontiveros,Ingrid Oliu,Comedy Drama,"Freshly graduated from high school, Ana receives a full scholarship to Columbia University. Her very traditional, old-world parents feel that now is the time for Ana to help provide for the family, not the time for college.",6.9,8030,2002
9533,Red Dragon,Brett Ratner,Edward Norton, Anthony Hopkins, Ralph Fiennes,Crime Drama Thriller Horror,"Former FBI Agent Will Graham, who was once almost killed by the savage Hannibal 'The Cannibal' Lecter, now has no choice but to face him again, as it seems Lecter is the only one who can help Graham track down a new serial killer.",7.2,286335,2002
6278,Reign of Fire,Rob Bowman,Christian Bale, Matthew McConaughey, Izabella Scorupco,Adventure Action Fantasy,"In post-apocalyptic England, an American volunteer and a British survivor team up to fight off a brood of fire-breathing dragons seeking to return to global dominance after centuries of rest underground. The Brit -- leading a clan of survivors to hunt down the King of the Dragons -- has much at stake: His mother was killed by a dragon, but his love is still alive.",6.2,143625,2002
16690,Return to Never Land,Robin Budd,Harriet Owen, Blayne Weaver, Corey Burton,Adventure Fantasy Animation Family,"In 1940, the world is besieged by World War II. Wendy, all grown up, has two children; including Jane, who does not believe Wendy's stories about Peter Pan.",5.8,21720,2002
565,The Ring,Gore Verbinski,Naomi Watts, Daveigh Chase, Martin Henderson,Horror Mystery,Rachel Keller is a journalist investigating a videotape that may have killed four teenagers. There is an urban legend about this tape: the viewer will die seven days after watching it. Rachel tracks down the video... and watches it. Now she has just seven days to unravel the mystery of the Ring so she can save herself and her son.,7.1,368982,2002
10955,Ripley's Game,Liliana Cavani,John Malkovich, Dougray Scott, Ray Winstone,Crime Thriller,"Tom Ripley - cool, urbane, wealthy, and murderous - lives in a villa in the Veneto with Luisa, his harpsichord-playing girlfriend. A former business associate from Berlin's underworld pays a call asking Ripley's help in killing a rival. Ripley - ever a student of human nature - initiates a game to turn a mild and innocent local picture framer into a hit man. The artisan, Jonathan Trevanny, who's dying of cancer, has a wife, young son, and little to leave them. If Ripley draws Jonathan into the game, can Ripley maintain control? Does it stop at one killing? What if Ripley develops a conscience?",6.6,19065,2002
4147,Road to Perdition,Sam Mendes,Tom Hanks, Paul Newman, Jude Law,Crime Drama Thriller,"Mike Sullivan works as a hit man for crime boss John Rooney. Sullivan views Rooney as a father figure, however after his son is witness to a killing, Mike Sullivan finds himself on the run in attempt to save the life of his son and at the same time looking for revenge on those who wronged him.",7.7,280626,2002
13441,Roger Dodger,Dylan Kidd,Campbell Scott, Jesse Eisenberg, Isabella Rossellini,Comedy Drama,"A smooth-talking ad executive attributes his remarkable success with women to his ability to manipulate their emotions from the moment he first meets them. When his teenage nephew drops in for a visit, he soon learns that his approach isn't as foolproof as he thought when he attempts to teach the boy how to pick up women.",6.9,17831,2002
11484,Rollerball,John McTiernan,Chris Klein, Jean Reno, LL Cool J,Action Sci-Fi,"In a corporate-controlled future, an ultra-violent sport known as Rollerball represents the world, and one of its powerful athletes is out to defy those who want him out of the game.",3.1,29144,2002
6723,The Rookie,John Lee Hancock,Dennis Quaid, Rachel Griffiths, Jay Hernandez,Action Crime Drama Thriller,"Veteran cop Nick Pulovski is used to playing musical partners; many of the partners he's had in the past have died on the job, and often as a result of Nick's risky tactics. But the rookie who's been assigned to help Nick bust a carjacking ring is almost as hotheaded as he is √É¬¢√Ç¬Ä√Ç¬¶ and when Nick gets kidnapped, his newbie partner is his only hope.",6.9,36606,2002
1809,The Rules of Attraction,Roger Avary,James Van Der Beek, Shannyn Sossamon, Ian Somerhalder,Drama Romance Comedy,"The incredibly spoiled and overprivileged students of Camden College are a backdrop for an unusual love triangle between a drug dealer, a virgin and a bisexual classmate.",6.6,52876,2002
9296,S1m0ne,Andrew Niccol,Al Pacino, Catherine Keener, Rachel Roberts,Sci-Fi Comedy Drama,"The career of a disillusioned producer, who is desperate for a hit, is endangered when his star walks off the film set. Forced to think fast, the producer decides to digitally create an actress ""Simone"" to sub for the star √É¬¢√Ç¬Ä√Ç¬î the first totally believable synthetic actress.",6.1,62059,2002
11468,The Salton Sea,D. J. Caruso,Val Kilmer, Vincent D'Onofrio, Peter Sarsgaard,Crime Drama Mystery Thriller,"After the murder of his beloved wife, a man in search of redemption is set adrift in a world where nothing is as it seems. On his journey, he befriends slacker Jimmy ""The Finn"", becomes involved in rescuing his neighbor Colette from her own demons, and gets entangled in a web of deceit full of unexpected twists and turns.",7,31752,2002
9021,The Santa Clause 2,Michael Lembeck,Tim Allen, Elizabeth Mitchell, David Krumholtz,Fantasy Comedy Family,"Better watch out! The big guy in red is coming to town once again. This time, Scott Calvin -- also known as Santa Claus -- finds out there's an obscure clause in his contract requiring him to take on a wife. He has to leave the North Pole to fulfill his obligations, or else he'll be forced to give up his Yuletide gig.",5.7,61685,2002
1146348,Scooby-Doo,Raja Gosnell,Sarah Michelle Gellar, Freddie Prinze Jr., Matthew Lillard,Animation Family Mystery Fantasy Comedy,"When the Justice League goes missing and villains overrun Metropolis, there's only one team that can solve this mystery: Scooby-Doo and the gang! But wait, there's a new dog in town √É¬¢√Ç¬Ä√Ç¬ì Krypto √É¬¢√Ç¬Ä√Ç¬ì Superman's Superdog with Super Powers. Mystery Inc. will need all the help it can get when phantoms menace the Justice League's headquarters.",5.3,122630,2002
9334,The Scorpion King,Chuck Russell,Dwayne Johnson, Steven Brand, Kelly Hu,Action Adventure Fantasy,"In ancient Egypt, peasant Mathayus is hired to exact revenge on the powerful Memnon and the sorceress Cassandra, who are ready to overtake Balthazar's village. Amid betrayals, thieves, abductions and more, Mathayus strives to bring justice to his complicated world.",5.5,143963,2002
26195,The Secret Lives of Dentists,Alan Rudolph,Campbell Scott, Hope Davis, Denis Leary,Drama,An introspective dentist's suspicions about his wife's infidelity stresses his mental well being and family life to the breaking point.,6.4,3517,2002
11013,Secretary,Steven Shainberg,James Spader, Maggie Gyllenhaal,Jeremy Davies,Comedy Drama Romance,"A young woman, recently released from a mental hospital, gets a job as a secretary to a demanding lawyer, where their employer-employee relationship turns into a sexual, sadomasochistic one.",6.9,96323,2002
12771,Serving Sara,Reginald Hudlin,Matthew Perry, Elizabeth Hurley, Bruce Campbell,Comedy Romance,"When Sara is served divorce papers while she is in New York, she is stunned. Not about to lose the fortune she amassed with her self-serving Texan husband, she makes an offer to her process server, Joe, that sets them off on a wild trip across the country.",5.3,18551,2002
54301,Showboy,Christian Taylor,Christian Taylor, Lindy Heymann, Joe Daly,Comedy Documentary,"Christian Taylor, a writer on hit TV series Six Feet Under, is being profiled by a British documentary crew when he's sacked, though he doesn't know they've overheard the firing. They follow him to Las Vegas, where he is ostensibly doing ""research"" for the next season, but is actually pursuing a dream to become a dancer in a Vegas show.",5.6,347,2002
5851,Showtime,Tom Dey,Robert De Niro, Eddie Murphy, Rene Russo,Action Comedy,A spoof of buddy cop movies where two very different cops are forced to team up on a new reality based T.V. cop show.,5.5,64664,2002
16653,The Singles Ward,Kurt Hale,Will Swenson, Connie Young, Daryn Tufts,Comedy Drama Family Romance,"When Jonathan Jordan gets divorced he's thrust back into the world of being a single Mormon - a world who's ultimate goal is eternal marriage. Struggling to fit in, Jonathan decides to stop going to church only to be pursued by the members of the local singles ward who want to reactivate him. Nothing works until Jonathan falls for Cammie Giles, the ward activities director. Suddenly, going to church becomes much more appealing, But is he going for the right reasons?",6.1,1491,2002
2675,Signs,M. Night Shyamalan,Mel Gibson, Joaquin Phoenix, Rory Culkin,Drama Thriller Sci-Fi Mystery,A family living on a farm finds mysterious crop circles in their fields which suggests something more frightening to come.,6.8,379872,2002
20009,Slackers,Dewey Nicks,Jason Schwartzman, Devon Sawa, Jason Segel,Comedy Romance,"Dave, Sam and Jeff are about to graduate from Holden University with honors in lying, cheating and scheming. The three roommates have proudly scammed their way through the last four years of college and now, during final exams, these big-men-on-campus are about to be busted by the most unlikely dude in school. Self-dubbed Cool Ethan, an ambitious nerd with a bad crush, enters their lives one day and everything begins to unravel.",5.3,15126,2002
11888,Snow Dogs,Brian Levant,Cuba Gooding Jr., James Coburn, Nichelle Nichols,Comedy Family Adventure,"When a Miami dentist inherits a team of sled dogs, he's got to learn the trade or lose his pack to a crusty mountain man.",5.2,28120,2002
2103,Solaris,Steven Soderbergh,George Clooney, Natascha McElhone, Viola Davis,Drama Sci-Fi Mystery,A troubled psychologist is sent to investigate the crew of an isolated research station orbiting a bizarre planet.,6.2,85362,2002
6020,Sorority Boys,Wallace Wolodarsky,Barry Watson, Michael Rosenbaum, Harland Williams,Comedy,"After being falsely accused of stealing the budget for their annual cocktail cruise, three very different fraternity brothers are kicked out of their dorm. In order to clear their name and to secure their future careers, the three dress up in drag and pledge the sorority next door where they learn a few valuable - and hilarious - lessons about themselves and the female species.",5.4,16125,2002
4174,Spellbound,Jeffrey Blitz,Angela Arenivar,Ubaldo Arenivar,Jorge Arenivar,Thriller Mystery Romance Drama,"When Dr. Anthony Edwardes arrives at a Vermont mental hospital to replace the outgoing hospital director, Dr. Constance Peterson, a psychoanalyst, discovers Edwardes is actually an impostor. The man confesses that the real Dr. Edwardes is dead and fears he may have killed him, but cannot recall anything. Dr. Peterson, however is convinced his impostor is innocent of the man's murder, and joins him on a quest to unravel his amnesia through psychoanalysis.",7.6,12410,2002
