Movie_id,Title,Director,Actor1,Actor2,Actor3,Genre,Overview,Ratings,Votes,Year
43656,13 Moons,Alexandre Rockwell,Jennifer Beals, Elizabeth Bracco,Steve Buscemi,Comedy Drama,"Things aren't looking so good for television clown Banana's career, and the fact that his estranged wife, Suzi, has just been arrested for assaulting his girlfriend, Lily, just serves to compound Banana's despair.",5.7,1305,2002
1429,25th Hour,Spike Lee,Edward Norton,Philip Seymour Hoffman,Barry Pepper,Crime Drama,"In New York City in the days following the events of 9/11, Monty Brogan is a convicted drug dealer about to start a seven-year prison sentence, and his final hours of freedom are devoted to hanging out with his closest buddies and trying to prepare his girlfriend for his extended absence.",7.6,183408,2002
2752,40 Days and 40 Nights,Michael Lehmann,Josh Hartnett,Shannyn Sossamon,Paulo Costanzo,Comedy Romance,"Matt Sullivan's last big relationship ended in disaster and ever since his heart's been aching and his commitment's been lacking. Then came Lent, that time of year when everybody gives something up. That's when Matt decides to go where no man's gone before and make a vow: No sex. Whatsoever. For 40 straight days. At first he has everything under control. That is until the woman of his dreams, Erica, walks into his life.",5.6,75251,2002
65,8 Mile,Curtis Hanson,Eminem,Kim Basinger,Brittany Murphy,Drama Music,"For Jimmy Smith, Jr., life is a daily fight just to keep hope alive. Feeding his dreams in Detroit's vibrant music scene, Jimmy wages an extraordinary personal struggle to find his own voice - and earn a place in a world where rhymes rule, legends are born and every moment√É¬¢√Ç¬Ä√Ç¬¶ is another chance.",7.2,311626,2002
15992,Abandon,Stephen Gaghan,Katie Holmes,Benjamin Bratt,Zooey Deschanel,Drama Mystery Thriller,"A psychological thriller about a senior at one of America's most prestigious universities. Under enormous pressure to complete her thesis and earn a top job at one of the world's most competitive consulting firms, Katie is still coping with the sudden unexplained disappearance of her first love two years prior. As the investigation continues, Katie is forced to choose between past passions and new possibilities, even as new facts are uncovered.",4.8,10068,2002
245,About a Boy,"Chris Weitz, Paul Weitz",Hugh Grant,Nicholas Hoult,Toni Collette,Drama Comedy Romance,"Will Freeman is a good-looking, smooth-talking bachelor whose primary goal in life is avoiding any kind of responsibility. But when he invents an imaginary son in order to meet attractive single moms, Will gets a hilarious lesson about life from a bright, but hopelessly geeky 12-year-old named Marcus. Now, as Will struggles to teach Marcus the art of being cool, Marcus teaches Will that you're never too old to grow up.",7.1,189803,2002
2755,About Schmidt,Alexander Payne,Jack Nicholson,Kathy Bates,Hope Davis,Drama Comedy,"A recently retired man embarks on a journey to his estranged daughter's wedding, only to discover more about himself and life than he ever expected.",7.2,132167,2002
2757,Adaptation.,Spike Jonze,Nicolas Cage,Meryl Streep,Chris Cooper,Comedy Crime Drama,"Nicolas Cage is Charlie Kaufman, a confused L.A. screenwriter overwhelmed by feelings of inadequacy, sexual frustration, self-loathing, and by the screenwriting ambitions of his freeloading twin brother Donald. While struggling to adapt ""The Orchid Thief,"" by Susan Orlean, Kaufman's life spins from pathetic to bizarre. The lives of Kaufman, Orlean's book, become strangely intertwined as each one's search for passion collides with the others'.",7.7,200234,2002
11692,The Adventures of Pluto Nash,Ron Underwood,Eddie Murphy,Randy Quaid,Rosario Dawson,Action Comedy Sci-Fi,"The year is 2087, the setting is the moon. Pluto Nash, the high-flying successful owner of the hottest nightclub in the universe, finds himself in trouble when he refuses to sell his club to lunar gangster Mogan, who just happens to be helping the mysterious Rex Crater mastermind a plan to take over the entire moon.",3.9,26717,2002
13950,All About the Benjamins,Kevin Bray,Ice Cube,Mike Epps,Eva Mendes,Action Adventure Comedy,"Bucum Jackson (Cube) is a bounty hunter with a lot of attitude and no interest in taking on a partner. Working at Martinez Bail Bonds, Jackson has unorthodox methods of tracking down low-life criminals, but they work, and one day he hopes to become his own boss and open up his own private investigation firm. Reggie Wright (Epps) is a slippery con artist who is avoiding the law, and Jackson. During a cat and mouse chase, the two stumble on a multi-million dollar diamond heist. Hiding from Jackson, Wright finds himself in the thieves' getaway van and ends up having to escape from them after they discover their booty is fake, much to the displeasure of their ruthless boss (Flanagan). When Wright meets up with his girlfriend (Mendes), he discovers that his recently purchased lottery ticket is the sole winner of $60 million. Unfortunately, his wallet, which held the ticket, was left in the thieves' van, so he persuades Jackson to help him get it back.",5.8,15390,2002
9932,Analyze That,Harold Ramis,Robert De Niro,Billy Crystal,Lisa Kudrow,Comedy Crime,"The mafia's Paul Vitti is back in prison and will need some serious counseling when he gets out. Naturally, he returns to his analyst Dr. Ben Sobel for help and finds that Sobel needs some serious help himself as he has inherited the family practice, as well as an excess stock of stress.",5.9,88739,2002
13435,Antwone Fisher,Denzel Washington,Derek Luke,Joy Bryant,Denzel Washington,Drama Romance,"A sailor prone to violent outbursts is sent to a naval psychiatrist for help. Refusing at first to open up, the young man eventually breaks down and reveals a horrific childhood. Through the guidance of his doctor, he confronts his painful past and begins a quest to find the family he never knew.",7.3,37859,2002
818,Austin Powers in Goldmember,Jay Roach,Mike Myers,Beyonc√© Knowles,Michael Caine,Comedy Crime Sci-Fi,"The world's most shagadelic spy continues his fight against Dr. Evil. This time, the diabolical doctor and his clone, Mini-Me, team up with a new foe√É¬¢√Ç¬Ä√Ç¬î'70s kingpin Goldmember. While pursuing the team of villains to stop them from world domination, Austin gets help from his dad and an old girlfriend.",6.2,219510,2002
14112,Auto Focus,Paul Schrader,Greg Kinnear,Willem Dafoe,Maria Bello,Crime Drama,"A successful TV star during the 1960s, former ""Hogan's Heroes"" actor Bob Crane projects a wholesome family-man image, but this front masks his persona as a sex addict who records and photographs his many encounters with women, often with the help of his seedy friend, John Henry Carpenter. This biographical drama reveals how Crane's double life takes its toll on him and his family, and ultimately contributes to his death.",6.6,14669,2002
13437,Avenging Angelo,Martyn Burke,Sylvester Stallone,Madeleine Stowe,Anthony Quinn,Action Comedy Crime,"A woman who has recently discovered that she is the daughter of Angelo, a major mafia boss, decides to wreak vengeance when he is killed by a hitman. She's aided by his faithful bodyguard, with whom she soon falls in love.",5.1,9870,2002
3132,Bad Company,Joel Schumacher,Anthony Hopkins,Chris Rock,Matthew Marsh,Action Adventure Comedy Thriller,"When a Harvard-educated CIA agent is killed during an operation, the secret agency recruits his twin brother.",5.6,49547,2002
10550,Ballistic: Ecks vs. Sever,Wych Kaosayananda,Antonio Banderas,Lucy Liu,Gregg Henry,Action Adventure Thriller,"Jonathan Ecks, an FBI agent, realizes that he must join with his lifelong enemy, Agent Sever, a rogue DIA agent with whom he is in mortal combat, in order to defeat a common enemy. That enemy has developed a ""micro-device"" that can be injected into victims in order to kill them at will.",3.6,20850,2002
9034,The Banger Sisters,Bob Dolman,Goldie Hawn,Susan Sarandon,Geoffrey Rush,Comedy Drama,"In the late '60s, the self-proclaimed belles of the rock 'n' roll ball, rocked the worlds of every music legend whose pants they could take off -- and they have the pictures to prove it. But it's been more than two decades since the Banger Sisters earned their nickname -- or even laid eyes on each other. Their reunion is the collision of two women's worlds; one who's living in the past, and one who's hiding from it. Together they learn to live in the moment.",5.7,17113,2002
10611,Barbershop,Tim Story,Ice Cube,Cedric,Eve,Comedy Drama,"A day in the life of a barbershop on the south side of Chicago. Calvin, who inherited the struggling business from his deceased father, views the shop as nothing but a burden and waste of his time. After selling the shop to a local loan shark, Calvin slowly begins to see his father's vision and legacy and struggles with the notion that he just sold it out.",6.3,33067,2002
12590,Below,David Twohy,Bruce Greenwood,Olivia Williams,Matthew Davis,Thriller Horror Mystery,"In the dark silence of the sea during World War II, the submarine USS Tiger Shark prowls on what should be a routine rescue mission. But for the shell-shocked crew, trapped together in the sub's narrow corridors and constricted spaces, this is about to become a journey into the sensory delusions, mental deceptions and runaway fears that lurk just below the surface of the ocean.",6.1,23799,2002
14290,Better Luck Tomorrow,Justin Lin,Parry Shen,Jason Tobin,Sung Kang,Crime Drama,A group of over-achieving Asian-American high school seniors enjoy a power trip when they dip into extra-curricular criminal activities.,7,10367,2002
11870,Big Fat Liar,Shawn Levy,Frankie Muniz,Paul Giamatti,Amanda Bynes,Family Comedy Adventure,"After one of his class papers is stolen and turned into a movie, a young student and his best friend exact a hilarious, slapstick revenge on the Hollywood hot shot who has taken credit!",5.5,38812,2002
2185,Big Trouble,Barry Sonnenfeld,Tim Allen,Rene Russo,Stanley Tucci,Action Comedy Thriller Mystery,"The story of how a mysterious suitcase brings together, and changes, the lives of a divorced dad, an unhappy housewife, two hitmen, a pair of street thugs, two love struck teens, two FBI men and a psychedelic toad. Based on Pulitzer Prize-winning humorist Dave Barry's best-selling first novel, ""Big Trouble.""",6.4,21422,2002
30586,Biggie & Tupac,Nick Broomfield,The Notorious B.I.G.,Tupac Shakur,Nick Broomfield,Music Documentary,"In 1997, rap superstars Tupac Shakur and Christopher Wallace (aka Biggie Smalls, The Notorious B.I.G.) were gunned down in separate incidents, the apparent victims of hip hop's infamous east-west rivalry. Nick Broomfield's film introduces Russell Poole, an ex-cop with damning evidence that suggests the LAPD deliberately fumbled the case to conceal connections between the police, LA gangs and Death Row Records, the label run by feared rap mogul Marion ""Suge"" Knight.",6.7,4984,2002
2084,Birthday Girl,Jez Butterworth,Nicole Kidman,Ben Chaplin,Vincent Cassel,Comedy Crime Thriller,"A shy bank clerk orders a Russian mail order bride, and finds his life turned upside down.",6.7,27,2002
36586,Blade II,Guillermo del Toro,Wesley Snipes,Kris Kristofferson,Ron Perlman,Fantasy Horror Action Thriller,"A rare mutation has occurred within the vampire community - The Reaper. A vampire so consumed with an insatiable bloodlust that they prey on vampires as well as humans, transforming victims who are unlucky enough to survive into Reapers themselves. Blade is asked by the Vampire Nation for his help in preventing a nightmare plague that would wipe out both humans and vampires.",6.7,230203,2002
9573,Blood Work,Clint Eastwood,Clint Eastwood,Jeff Daniels,Anjelica Huston,Thriller Crime,"Still recovering from a heart transplant, a retired FBI profiler returns to service when his own blood analysis offers clues to the identity of a serial killer.",6.4,46952,2002
9266,Blue Crush,John Stockwell,Kate Bosworth,Michelle Rodriguez,Matthew Davis,Adventure Romance Drama,"Nothing gets between Anne Marie and her board. Living in a beach shack with three roommates, she is up before dawn every morning to conquer the waves and count the days until the Pipe Masters competition. Having transplanted herself to Hawaii with no one's blessing but her own, Anne Marie finds all she needs in the adrenaline-charged surf scene - until pro quarterback Matt Tollman comes along...",5.7,32619,2002
892835,Book of Love,Jeffrey W. Byrd,Eric K. George,Treach, Richard T. Jones,Comedy Romance,"Henry, an English writer who has written a new book that has become a failure in the U.K, gets notified that the dull book has been highly trending over in Mexico. Little does he know that Maria, a Spanish translator, turned the book into an erotic novel. Henry and Maria then swerve around Mexico to do a book tour and go through a wind of events.",6.7,116,2002
2501,The Bourne Identity,Doug Liman,Matt Damon,Franka Potente, Chris Cooper,Action Drama Mystery Thriller,"Wounded to the brink of death and suffering from amnesia, Jason Bourne is rescued at sea by a fisherman. With nothing to go on but a Swiss bank account number, he starts to reconstruct his life, but finds that many people he encounters want him dead. However, Bourne realizes that he has the combat and mental skills of a world-class spy√É¬¢√Ç¬Ä√Ç¬îbut who does he work for?",7.8,567850,2002
1430,Bowling for Columbine,Michael Moore,Michael Moore,Charlton Heston,Marilyn Manson,Documentary Drama,"This is not a film about gun control. It is a film about the fearful heart and soul of the United States, and the 280 million Americans lucky enough to have the right to a constitutionally protected Uzi. From a look at the Columbine High School security camera tapes to the home of Oscar-winning NRA President Charlton Heston, from a young man who makes homemade napalm with The Anarchist's Cookbook to the murder of a six-year-old girl by another six-year-old. Bowling for Columbine is a journey through the US, through our past, hoping to discover why our pursuit of happiness is so riddled with violence.",8,147724,2002
37964,Brown Sugar,Rick Famuyiwa,Taye Diggs,Sanaa Lathan, Mos Def,Comedy Romance,"Friends since childhood, a magazine editor and a hip-hop record executive stumble into romantic territory.",6.5,10053,2002
9707,Bubba Ho-tep,Don Coscarelli,Bruce Campbell,Ossie Davis, Ella Joyce,Comedy Horror Thriller Mystery Fantasy,"Bubba Ho-tep tells the ""true"" story of what really did become of Elvis Presley. We find Elvis as an elderly resident in an East Texas rest home, who switched identities with an Elvis impersonator years before his ""death,"" then missed his chance to switch back. He must team up with JFK and fight an ancient Egyptian mummy for the souls of their fellow residents.",6.9,50998,2002
206175,The Burial Society,Nicholas Racz,Rob LaBelle,Jan Rube√É¬Ö√Ç¬°, Allan Rich,Thriller,"In The Burial Society, Sheldon Kasner, an unlikely criminal who works as a bank loan manager, infiltrates the mysterious world of the Chevrah Kadisha (the Jewish society that prepares bodies for burial according to ancient ritual) in order to steal a body and fake his own death after mobsters come after him looking for two million dollars that he is accused of having stolen. Having sought and found refuge within this ancient religious society, Sheldon finds himself captivated by this unusual and powerful world and the three old men who run it.",6,210,2002
13163,Buying the Cow,Walt Becker,Jerry O'Connell, Bridgette Wilson, Alyssa Milano,Comedy Romance,A commitment-averse man frantically hits the dating scene after his girlfriend starts pressuring him to pop the question.,5.8,7378,2002
11547,Cabin Fever,Eli Roth,Rider Strong, Jordan Ladd, James DeBello,Horror,"A group of five college graduates rent a cabin in the woods and begin to fall victim to a horrifying flesh-eating virus, which attracts the unwanted attention of the homicidal locals.",5.6,82192,2002
7340,Carrie,David Carson,Angela Bettis, Patricia Clarkson, Rena Sofer,Horror Thriller,"Carrie White, a shy, friendless teenage girl who is sheltered by her domineering, religious mother, unleashes her telekinetic powers after being humiliated by her classmates at her senior prom.",5.4,11246,2002
640,Catch Me If You Can,Steven Spielberg,Leonardo DiCaprio, Tom Hanks, Christopher Walken,Drama Crime,"A true story about Frank Abagnale Jr. who, before his 19th birthday, successfully conned millions of dollars worth of checks as a Pan Am pilot, doctor, and legal prosecutor. An FBI agent makes it his mission to put him behind bars. But Frank not only eludes capture, he revels in the pursuit.",8.1,1059170,2002
679743,Chance,Amber Benson,Amber Benson, James Marsters, Christine Estabrook,Drama Family Mystery,A true story of a teenage love triangle leading to one of the two boys' tragic death - told through the lens of elite youth baseball.,6.8,1244,2002
1537,Changing Lanes,Roger Michell,Ben Affleck, Samuel L. Jackson, Toni Collette,Thriller,"A rush-hour fender-bender on New York City's crowded FDR Drive, under most circumstances, wouldn't set off a chain reaction that could decimate two people's lives. But on this day, at this time, a minor collision will turn two complete strangers into vicious adversaries. Their means of destroying each other might be different, but their goals, ultimately, will be the same: Each will systematically try to dismantle the other's life in a reckless effort to reclaim something he has lost.",6.5,73736,2002
965143,Chat Room,Barry Bowles,Brian Hooks,Deya Simone,Carl Gilliard,Documentary,"Anonymous and exploitative, a network of online chat rooms ran rampant with sex crimes. The hunt to take down its operators required guts and tenacity.",5.4,9517,2002
35694,Chelsea Walls,Ethan Hawke,Kris Kristofferson, Uma Thurman,Robert Sean Leonard,Drama,"This movie tells five stories set in a single day at the famed Chelsea Hotel in New York City, involving an ensemble cast of some 30-35 characters.",4.8,2207,2002
1574,Chicago,Rob Marshall,Ren√©e Zellweger, Catherine Zeta-Jones, Richard Gere,Comedy Crime Drama,Murderesses Velma Kelly and Roxie Hart find themselves on death row together and fight for the fame that will keep them from the gallows in 1920s Chicago.,7.2,239596,2002
288950,Ciao America,Frank Ciota,Eddie Malavarca, Maurizio Nichetti, Violante Placido,Comedy Drama Romance,"Having recently earned his college degree, Lorenzo Primavera (Eddie Malavarca) leaves his home in Boston to travel to his family's ancestral homeland in Italy -- as was requested by his late grandfather. Upon arriving, Lorenzo is offered a short-term position as coach for an American-style football team by the team's manager, Giulio Fellini (Maurizio Nichetti). As the young American immerses himself in his new duties, he makes the acquaintance of Paola Angelini (Violante Placido) and the two begin a friendship that quickly blossoms into something more. In between spending time with Paola and working with the team, Lorenzo also begins investigating his own family's history and learns the reason for his grandfather's departure from Italy, as well as why his grandfather never returned to visit. As Lorenzo begins to forge an identity for himself in Italy -- not to mention strong romantic attachments to Paola -- he must eventually decide whether or not to return to the States.",8,90,2002
13536,City by the Sea,Michael Caton-Jones,Robert De Niro, James Franco, Eliza Dushku,Crime Drama Mystery,"Vincent LaMarca is a dedicated and well-respected New York City police detective who has gone to great lengths to distance himself from his past, but then makes the terrible discovery that his own son has fallen into a life of crime.",6.1,26202,2002
428501,City of Ghosts,Matt Dillon,Matt Dillon,James Caan, Natascha McElhone,War Documentary,"With unprecedented access, this documentary follows the extraordinary journey of √É¬¢√Ç¬Ä√Ç¬úRaqqa is Being Slaughtered Silently√É¬¢√Ç¬Ä√Ç¬ù√É¬¢√Ç¬Ä√Ç¬îa group of anonymous citizen journalists who banded together after their homeland was overtaken by ISIS√É¬¢√Ç¬Ä√Ç¬îas they risk their lives to stand up against one of the greatest evils in the world today.",5.9,5708,2002
30246,Civil Brand,Neema Barnette,LisaRaye McCoy,Lark Voorhies, Mos Def,Crime Drama Thriller,"Forced to work under slave-like conditions in a ""prison for profit"" program, the inmates of a mostly-African-American female prison, Whitehead Correctional, try to take over the institution. At the core of the story is Frances, who finds herself in prison after being falsely convicted of murder, and who is told that her baby has been murdered, sparking her to lead her fellow inmates in the protest",5.1,787,2002
15028,Clockstoppers,Jonathan Frakes,Jesse Bradford,Paula Garc√©s, French Stewart,Adventure Family Sci-Fi Thriller,"Until now, Zak Gibbs' greatest challenge has been to find a way to buy a car. But when he discovers an odd wristwatch amidst his father's various inventions and slips it on -- something very strange happens. The world around him seems to come to a stop, everything and everybody frozen in time. Zak quickly learns how to manipulate the device and he and his quick-witted and beautiful new friend, Francesca, start to have some real fun.",5.2,14943,2002
178494,The Cockettes,Bill Weber,Larry Brinkin,Peggy Cass,The Cockettes,Documentary,Documentary about the gender-bending San Francisco performance group who became a pop culture phenomenon in the early 1970s.,7.4,613,2002
9884,Collateral Damage,Andrew Davis,Arnold Schwarzenegger, Elias Koteas, Francesca Neri,Action Thriller Drama,Firefighter Gordon Brewer is plunged into the complex and dangerous world of international terrorism after he loses his wife and child in a bombing credited to Claudio 'The Wolf' Perrini.,5.5,77295,2002
17043,The Crocodile Hunter: Collision Course,John Stainton,Steve Irwin, Terri Irwin, Neil Fanning,Family Adventure Comedy,"Steve Irwin, AKA The Crocodile Hunter, has avoided the death-roll and saved a croc from poachers. But what he doesn't know is that the crocodile has swallowed a top secret U.S. satellite beacon, and the poachers are actually American special agents sent to retrieve it.",5.4,8148,2002
19973,Comedian,Christian Charles,Jerry Seinfeld,Chris Rock,Garry Shandling,Comedy Documentary,"A look at the work of two stand-up comics, Jerry Seinfeld and a lesser-known newcomer, detailing the effort and frustration behind putting together a successful act and career while living a life on the road.",6.9,7229,2002
4912,Confessions of a Dangerous Mind,George Clooney,Sam Rockwell, Drew Barrymore, George Clooney,Comedy Crime Drama,"Television made him famous, but his biggest hits happened off screen. Television producer by day, CIA assassin by night, Chuck Barris was recruited by the CIA at the height of his TV career and trained to become a covert operative. Or so Barris said.",7,91127,2002
11362,The Count of Monte Cristo,Kevin Reynolds,James Caviezel, Guy Pearce,Dagmara Domi?czyk,Adventure Drama History,"Edmond Dant√É¬É√Ç¬©s's life and plans to marry the beautiful Mercedes are shattered when his best friend, Fernand, deceives him. After spending 13 miserable years in prison, Dant√É¬É√Ç¬©s escapes with the help of a fellow inmate and plots his revenge, cleverly insinuating himself into the French nobility.",7.7,145874,2002
18357,The Country Bears,Peter Hastings,Don Henley, Haley Joel Osment, Diedrich Bader,Adventure Comedy Family,"For Beary Barrington, The Country Bears' young #1 fan, fitting in with his all-too-human family is proving im-paws-ible. When he runs away to find Country Bear Hall and his heroes, he discovers the venue that made them famous is near foreclosure. Beary hightails it over the river and through the woods to get the Bears in the Band back together for an all-out reunion concert to save Country Bear Hall.",4.2,6001,2002
55018,Crazy as Hell,Eriq La Salle,Eriq La Salle, Michael Beach, Ronny Cox,Horror Thriller,"A famous psychiatrist (Ty Adams) takes on the job of trying to cure patients at the Sedah State Hospital, run by it's folksy doctor (Sam Delazo). All this takes a strange turn when a mysterious patient (Satan, he calls himself) enters the Hospital seeking help. Or is it just help that he wants?",5.8,1095,2002
15392,Crossroads,Tamra Davis,Britney Spears, Anson Mount, Zoe Saldana,Drama Music Mystery Romance,"A wanna-be blues guitar virtuoso seeks a long-lost song by legendary musician, Robert Johnson.",3.6,41666,2002
10133,Cypher,Vincenzo Natali,Jeremy Northam, Lucy Liu, Nigel Bennett,Thriller Sci-Fi,"An unsuspecting, disenchanted man finds himself working as a spy in the dangerous, high-stakes world of corporate espionage. Quickly getting way over-his-head, he teams up with a mysterious femme fatale.",6.7,31863,2002
20689,The Dancer Upstairs,John Malkovich,Javier Bardem, Juan Diego Botto, Laura Morante,Crime Drama Romance Thriller,A police detective in a South American country is dedicated to hunting down a revolutionary guerilla leader.,6.9,6818,2002
16857,The Dangerous Lives of Altar Boys,Peter Care,Emile Hirsch, Kieran Culkin, Jena Malone,Comedy Drama,"A group of Catholic school friends, after being caught drawing an obscene comic book, plan a heist that will outdo their previous prank and make them local legends.",6.9,14081,2002
11056,Darkness,Jaume Balaguer√≥,Anna Paquin, Lena Olin, Iain Glen,Horror,"A teenage girl moves into a remote country home with her family, only to discover that the gloomy old house has a horrifying past that threatens to destroy them.",5.4,20216,2002
