Movie_id,Title,Director,Actor1,Actor2,Actor3,Genre,Overview,Ratings,Votes,Year
724901,Stalker,Tyler Savage,Christine Ko,Vincent van Horn,Michael Joplin,Thriller Horror,A young man√É¬¢√Ç¬Ä√Ç¬ôs budding romance is threatened when he befriends a strange ride share driver.,8.7,7,2021
695396,Love Spreads,Jamie Adams,Alia Shawkat,Eiza Gonz√É¬°lez,Chanel Cresswell,Comedy Drama Music,"It is time to record the all important second album and Glass Heart is breaking in a million pieces. Away from touring and performing the band is not in harmony, and no amount of history in Rockfield Studios is going to solve that. Three very different songwriters, one desperate producer, a label exec and a keyboard collide.",3.7,206,2021
763040,A Crime on the Bayou,Nancy Buirski,Gary Duncan,Gary Duncan,Gary Duncan,Documentary,"A Crime on the Bayou is the story of Gary Duncan, a Black teenager from Plaquemines Parish, a swampy strip of land south of New Orleans. In 1966, Duncan tries to break up an argument between white and Black teenagers outside a newly integrated school. He gently lays his hand on a white boy√É¬¢√Ç¬Ä√Ç¬ôs arm. The boy recoils like a snake. That night, police burst into Duncan√É¬¢√Ç¬Ä√Ç¬ôs trailer and arrest him for assault on a minor. A young Jewish attorney, Richard Sobol, leaves his prestigious D.C. firm to volunteer in New Orleans. With his help, Duncan bravely stands up to a racist legal system powered by a white supremacist boss to challenge his unfair arrest. Their fight goes all the way to the U.S. Supreme Court, and their lifelong friendship is forged.",6.7,129,2021
823461,Good on Paper,Kimmy Gatewood,Iliza Shlesinger,Ryan Hansen,Margaret Cho,Comedy Romance,"After years of putting her career ahead of love, stand-up comic Andrea Singer has stumbled upon the perfect guy. On paper, he checks all the boxes but is he everything he appears to be?",5.6,13597,2021
385128,F9,Justin Lin,Vin Diesel,John Cena,Michelle Rodriguez,Action Adventure Crime,Dominic Toretto and his crew battle the most skilled assassin and high-performance driver they've ever encountered: his forsaken brother.,5.2,157154,2021
646207,The Ice Road,Jonathan Hensleigh,Liam Neeson,Benjamin Walker,Amber Midthunder,Action Thriller,"After a remote diamond mine collapses in far northern Canada, an ice road driver must lead an impossible rescue mission over a frozen ocean to save the trapped miners.",5.6,45885,2021
800497,Werewolves Within,Josh Ruben,Sam Richardson,Milana Vayntrub,George Basil,Horror Comedy,"When a proposed pipeline creates hostilities between residents of a small town, a newly-arrived forest ranger must keep the peace after a snowstorm confines the townspeople to an old lodge. But when a mysterious creature begins terrorizing the group, their worst tendencies and prejudices rise to the surface, and it is up to the ranger to keep the residents alive, both from each other and the monster which plagues them.",6,23912,2021
591634,False Positive,John Lee,Ilana Glazer,Justin Theroux,Sophia Bush,Horror Mystery Thriller,"After months of trying and failing to get pregnant, Lucy and Adrian finally find their dream fertility doctor in the illustrious Dr. Hindle. But after becoming pregnant with a healthy baby girl, Lucy begins to notice something sinister through Hindle's gleaming charm, and she sets out to uncover the unsettling truth about him.",4.7,7127,2021
693827,Lansky,Eytan Rockaway,Harvey Keitel,Sam Worthington,AnnaSophia Robb,Crime Drama Thriller,"When the aging Meyer Lansky is investigated one last time by the Feds who suspect he has stashed away millions of dollars over half a century, the retired gangster spins a dizzying tale, revealing the untold truth about his life as the notorious boss of Murder Inc. and the National Crime Syndicate.",6.2,9603,2021
653594,I Carry You with Me,Heidi Ewing,Armando Espitia,Christian V√É¬°zquez,Michelle Rodr√É¬É√Ç¬≠guez,Drama,"An epic love story spanning decades is sparked by a chance encounter between two men in provincial Mexico. Based on a true story, ambition and societal pressure propel an aspiring chef to leave his soulmate and make the treacherous journey to New York, where life will never be the same.",6.7,1446,2021
835860,Mary J. Blige's My Life,Vanessa Roth,Mary J. Blige,Taraji P. Henson,Alicia Keys,Documentary Music,"Mary J. Blige set the music world on fire with her trailblazing 1994 LP ""My Life."" The singer, producer and actress reveals the demons and blessings that inspired the record and propelled her to international stardom. She celebrates the 25th anniversary of her most influential work by performing the album live for the first time.",6.6,628,2021
43915,Fathom,Drew Xanthopoulos,Michelle Fournet,Michelle Fournet,Michelle Fournet,Action Comedy Drama,"While touring abroad in Europe, beautiful American skydiver Fathom Harvill gets wrapped up in international intrigue when Scottish spy Douglas Campbell recruits her to help him on a secret mission. Before long, Fathom realizes that no one around her, including the mysterious Peter Merriweather, can easily be trusted, leading to various adventures that involve bull fighting, beaches and, of course, romance.",5.6,618,2021
842170,Rollers,Isaiah Smallman,Johnny Ray Gill,Kate Cobb,Vicky Jeudy,Comedy,"Rufus Paisley is an alcoholic who refuses to admit it. Everything he loves is gathered in one place: the √É¬¢√Ç¬Ä√Ç¬úRollers√É¬¢√Ç¬Ä√Ç¬ù. He even gave up a promising career as a musician to stay there. But this historic place, once owned by his parents, is in difficulty and he is short of the means to save it. His friends urge him to move on, but can he?",5.5,52,2021
739542,America: The Motion Picture,Matt Thompson,Channing Tatum,Jason Mantzoukas,Olivia Munn,Animation Action Comedy,A chainsaw-wielding George Washington teams with beer-loving bro Sam Adams to take down the Brits in a tongue-in-cheek riff on the American Revolution.,5.6,7201,2021
539565,Zola,Janicza Bravo,Taylour Paige,Riley Keough,Nicholas Braun,Comedy Crime,"A waitress agrees to accompany an exotic dancer, her put-upon boyfriend, and her mysterious and domineering roommate on a road trip to Florida to seek their fortune at a high-end strip club.",6.5,16628,2021
649409,No Sudden Move,Steven Soderbergh,Don Cheadle,Benicio del Toro,David Harbour,Crime Drama Mystery,A group of criminals are brought together under mysterious circumstances and have to work together to uncover what's really going on when their simple job goes completely sideways.,6.4,39968,2021
588228,The Tomorrow War,Chris McKay,Chris Pratt,Yvonne Strahovski,J. K. Simmons,Action Sci-Fi Adventure,"The world is stunned when a group of time travelers arrive from the year 2051 to deliver an urgent message: Thirty years in the future, mankind is losing a global war against a deadly alien species. The only hope for survival is for soldiers and civilians from the present to be transported to the future and join the fight. Among those recruited is high school teacher and family man Dan Forester. Determined to save the world for his young daughter, Dan teams up with a brilliant scientist and his estranged father in a desperate quest to rewrite the fate of the planet.",6.6,222267,2021
459151,The Boss Baby 2: Family Business,Tom McGrath,Alec Baldwin,James Marsden,Amy Sedaris,Animation Comedy Adventure Family,The Templeton brothers √É¬¢√Ç¬Ä√Ç¬î Tim and his Boss Baby little bro Ted √É¬¢√Ç¬Ä√Ç¬î have become adults and drifted away from each other. But a new boss baby with a cutting-edge approach and a can-do attitude is about to bring them together again √É¬¢√Ç¬Ä√Ç¬¶ and inspire a new family business.,5.9,21490,2021
602223,The Forever Purge,Everardo Gout,Ana de la Reguera,Tenoch Huerta,Josh Lucas,Horror Action Thriller,All the rules are broken as a sect of lawless marauders decides that the annual Purge does not stop at daybreak and instead should never end as they chase a group of immigrants who they want to punish because of their harsh historical past.,5.4,41876,2021
591273,Fear Street Part One: 1994,Leigh Janiak,Kiana Madeira,Olivia Scott Welch,Benjamin Flores Jr.,Mystery Horror,"After a series of brutal slayings, a teen and her friends take on an evil force that's plagued their notorious town for centuries.",6.2,91653,2021
776527,Summer of Soul,Questlove,Stevie Wonder,Nina Simone,Sly and the Family Stone,Documentary Music History,"During the same summer as Woodstock, over 300,000 people attended the Harlem Cultural Festival, celebrating African American music and culture, and promoting Black pride and unity. The footage from the festival sat in a basement, unseen for over 50 years, keeping this incredible event in America's history lost √É¬¢√Ç¬Ä√Ç¬î until now.",8,13519,2021
672741,Till Death,S.K. Dale,Megan Fox,Eoin Macken,Callan Mulvey,Horror Thriller,"After a romantic evening at their secluded lake house, a woman wakes up handcuffed to her dead husband. Trapped and isolated in the dead of winter, she must fight off hired killers to escape her late spouse's twisted plan.",5.9,24954,2021
629227,Let Us In,Craig Moss,Mackenzie Moss,Sadie Stanley,Mackenzie Ziegler,Sci-Fi Thriller Horror,A 12 year old girl is determined to uncover who or what is behind the rash of disappearances occurring in her small town.,4.4,702,2021
497698,Black Widow,Cate Shortland,Scarlett Johansson,Florence Pugh,David Harbour,Action Adventure Sci-Fi,"Natasha Romanoff, also known as Black Widow, confronts the darker parts of her ledger when a dangerous conspiracy with ties to her past arises. Pursued by a force that will stop at nothing to bring her down, Natasha must deal with her history as a spy and the broken relationships left in her wake long before she became an Avenger.",6.7,414238,2021
591274,Fear Street Part Two: 1978,Leigh Janiak,Sadie Sink,Emily Rudd,Ryan Simpkins,Mystery Horror,"In 1978, two rival groups at Camp Nightwing must band together to solve a terrifying mystery when horrors from their towns' history come alive.",6.7,73738,2021
50363,Summertime,Carlos L√≥pez Estrada,Tyris Winter,Marquesha Babers,Maia Mayor,Drama Romance,"Middle-aged Ohio secretary Jane Hudson has never found love and has nearly resigned herself to spending the rest of her life alone. But before she does, she uses her savings to finance a summer in romantic Venice, where she finally meets the man of her dreams, the elegant Renato Di Rossi.",5.4,77,2021
574060,Gunpowder Milkshake,Navot Papushado,Karen Gillan,Lena Headey,Carla Gugino,Action Crime Thriller,"To protect an 8-year-old girl, a dangerous assassin reunites with her mother and her lethal associates to take down a ruthless crime syndicate and its army of henchmen.",6.1,49767,2021
379686,Space Jam: A New Legacy,Malcolm D. Lee,LeBron James,Don Cheadle,Khris Davis,Family Animation Comedy Sci-Fi,"When LeBron and his young son Dom are trapped in a digital space by a rogue A.I., LeBron must get them home safe by leading Bugs, Lola Bunny and the whole gang of notoriously undisciplined Looney Tunes to victory over the A.I.'s digitized champions on the court. It's Tunes versus Goons in the highest-stakes challenge of his life.",4.5,78484,2021
585216,Escape Room: Tournament of Champions,Adam Robitel,Taylor Russell,Logan Miller,Indya Moore,Horror Thriller Mystery,"Six people unwittingly find themselves locked in another series of escape rooms, slowly uncovering what they have in common to survive as they discover all the games that they've played before.",5.7,57552,2021
591275,Fear Street Part Three: 1666,Leigh Janiak,Kiana Madeira,Ashley Zukerman,Gillian Jacobs,Mystery Horror,"In 1666, a colonial town is gripped by a hysterical witch-hunt that has deadly consequences for centuries to come, and it's up to teenagers in 1994 to finally put an end to their town's curse, before it's too late.",6.6,61494,2021
481879,Die in a Gunfight,Colin Schiffli,Alexandra Daddario,Diego Boneta,Justin Chatwin,Action Comedy Romance,"Mary and Ben are the star-crossed black sheep of two powerful families engaged in a centuries-long feud. When the pair reignite a romance after many years apart, their forbidden love draws a motley assortment of schemers and killers into their orbit, and as fists and bullets fly, it becomes clear that violent delights will have violent ends.",4.5,3300,2021
635731,Pig,Michael Sarnoski,Nicolas Cage,Alex Wolff,Adam Arkin,Drama Thriller,A truffle hunter who lives alone in the Oregon wilderness must visit Portland to find the mysterious person who stole his beloved foraging pig.,6.9,85948,2021
774714,Out of Death,Mike Burns,Bruce Willis,Jaime King,Lala Kent,Action Thriller,"As Shannon, a woman who wants to put her father's ashes away in the woods witnesses a corrupt cop dealing drugs with a junkie, she has to try and run away after she gets rampaged by two discreditable cops after they see her taking secret photographs of their crime maneuver. They then do a cat-and-mouse game around the woods as Shannon teams up with a retired sheriff along the way for more reinforcement. It's just a diversion of survival and egalitarianism.",3.3,5661,2021
642732,Roadrunner: A Film About Anthony Bourdain,Morgan Neville,Anthoney Bourdain,Anthoney Bourdain,Anthoney Bourdain,Documentary,"An intimate, behind-the-scenes look at how an anonymous chef became a world-renowned cultural icon. This unflinching look at Anthony Bourdain reverberates with his presence, in his own voice and in the way he indelibly impacted the world around him.",7.7,9496,2021
475210,How It Ends,Daryl Wein and Zoe Lister-Jones,Zoe Lister-Jones,Cailee Spaeny,Olivia Wilde,Sci-Fi Thriller Mystery Action Adventure,A desperate father tries to return home to his pregnant wife after a mysterious apocalyptic event turns everything to chaos.,5.3,4137,2021
730840,Trollhunters: Rise of the Titans,Johane Matte,Emile Hirsch,Lexi Medrano,Charlie Saxton,Animation Fantasy Family Action Adventure,"The Guardians of Arcadia reunite to battle the nefarious Arcane Order, who've reawakened the primordial Titans.",6.6,5807,2021
631843,Old,M. Night Shyamalan,Gael GarcÌa Bernal,Vicky Krieps,Rufus Sewell,Thriller Mystery Horror,A group of families on a tropical holiday discover that the secluded beach where they are staying is somehow causing them to age rapidly √É¬¢√Ç¬Ä√Ç¬ì reducing their entire lives into a single day.,5.8,153633,2021
552269,Joe Bell,Reinaldo Marcus Green,Mark Wahlberg,Reid Miller,Connie Britton,Drama Adventure,"The true story of a small town, working class father who embarks on a solo walk across the U.S. to crusade against bullying after his son is tormented in high school for being gay.",6.2,9164,2021
617502,Jolt,Tanya Wexler,Kate Beckinsale,Bobby Cannavale,Laverne Cox,Action Thriller,A bouncer with an anger management problem goes on a furious and resentful rampage after the murder of a friend.,5.6,34380,2021
693113,Midnight in the Switchgrass,Randall Emmett,Megan Fox,Bruce Willis,Emile Hirsch,Crime Mystery Thriller Action,"FBI Agent Karl Helter and his partner Rebecca Lombardo are very close to busting a sex-trafficking ring. When they realize their investigation has crossed the path of a brutal serial killer, they team up with a Texas Ranger to put an end to the infamous 'Truck Stop Killer'.",4.5,9779,2021
528360,Broken Diamonds,Peter Sattler,Ben Platt,Lola Kirke,Yvette Nicole Brown,Drama,"In the wake of his father's death, a twenty-something writer sees his dream of moving to Paris put in jeopardy when he's forced to temporarily take in his wildly unpredictable, mentally ill sister.",5.7,333,2021
834027,Val,Leo Scott and Ting Poo,Val Kilmer,Jack Kilmer,Mercedes Kilmer,Documentary,"For over 40 years Val Kilmer, one of Hollywood√É¬¢√Ç¬Ä√Ç¬ôs most mercurial and/or misunderstood actors has been documenting his own life and craft through film and video. He has amassed thousands of hours of footage, from 16mm home movies made with his brothers, to time spent in iconic roles for blockbuster movies like Top Gun, The Doors, Tombstone, and Batman Forever. This raw, wildly original and unflinching documentary reveals a life lived to extremes and a heart-filled, sometimes hilarious look at what it means to be an artist and a complex man.",7.6,13998,2021
776519,Ailey,Jamila Wignot,Alvin Ailey,Alvin Ailey,Alvin Ailey,Documentary,"Alvin Ailey was a visionary artist who found salvation through dance. Told in his own words and through the creation of a dance inspired by his life, this immersive portrait follows a man who, when confronted by a world that refused to embrace him, determined to build one that would.",6.7,291,2021
451048,Jungle Cruise,Jaume Collet-Serra,Dwayne Johnson,Emily Blunt,Edgar Rami√Ç¬≠rez,Action Adventure Fantasy,"Dr. Lily Houghton enlists the aid of wisecracking skipper Frank Wolff to take her down the Amazon in his dilapidated boat. Together, they search for an ancient tree that holds the power to heal √É¬¢√Ç¬Ä√Ç¬ì a discovery that will change the future of medicine.",6.6,207087,2021
616651,Stillwater,Tom McCarthy,Matt Damon,Camille Cottin,Abigail Breslin,Drama Crime Thriller,"Bill Baker, an American oil-rig roughneck from Oklahoma, travels to Marseille to visit his estranged daughter, Allison, who is in prison for a murder she claims she did not commit. Confronted with language barriers, cultural differences, and a complicated legal system, Bill builds a new life for himself in France as he makes it his personal mission to exonerate his daughter.",6.6,53152,2021
559907,The Green Knight,David Lowery,Dev Patel,Alicia Vikander,Joel Edgerton,Adventure Drama Fantasy,"An epic fantasy adventure based on the timeless Arthurian legend, The Green Knight tells the story of Sir Gawain, King Arthur's reckless and headstrong nephew, who embarks on a daring quest to confront the eponymous Green Knight, a gigantic emerald-skinned stranger and tester of men.",6.6,112130,2021
607430,Nine Days,Edson Oda,Winston Duke,Zazie Beetz,Benedict Wong,Drama Fantasy,A reclusive man conducts a series of interviews with human souls for a chance to be born.,6.8,10928,2021
830991,Ride the Eagle,Trent O'Donnell,Jake Johnson,D'Arcy Carden,J.K. Simmons,Comedy Drama,"When Leif√É¬¢√Ç¬Ä√Ç¬ôs estranged mother, Honey dies she leaves him a √É¬¢√Ç¬Ä√Ç¬òconditional inheritance√É¬¢√Ç¬Ä√Ç¬ô. He has to complete her elaborate to-do list before he gets her cabin in Yosemite. Leif steps into Honey√É¬¢√Ç¬Ä√Ç¬ôs wild world as the mother he never really knew tries to make amends from beyond the grave.",6.3,3699,2021
653568,The Evening Hour,Braden King,Philip Ettinger,Stacy Martin,Cosmo Jarvis,Drama,"Cole Freeman maintains an uneasy equilibrium in his rural Appalachian town, looking after the old and infirm while selling their excess painkillers to local addicts. But when an old friend returns with plans that upend the fragile balance and identity he's so painstakingly crafted, Cole is forced to take action.",5.4,329,2021
692989,Lorelei,Sabrina Doyle,Pablo Schreiber,Jena Malone,Amelia Borgerding,Drama,"A man is released from prison after 15 years. He reunites with his high school girlfriend, now a single mother of three. What follows is a lyrical take on love, regret and second chances.",6.4,2303,2021
698495,Enemies of the State,Sonia Kennebeck,Joel Widman,Stuart Anderson,Angela Barbosa,Documentary,"From the outside, the DeHart√É¬¢√Ç¬Ä√Ç¬ôs were an All-American family. Parents Paul and Leann were U.S. Military members, and son Matt was obsessed with computers from an early age. As a military family, they moved around during Matt√É¬¢√Ç¬Ä√Ç¬ôs adolescence, and Matt really grew up online. When Matt√É¬¢√Ç¬Ä√Ç¬ôs work with the hacker collective Anonymous rouses the suspicions of the U.S. government, the family is drawn into a bizarre web of secrets and espionage.",7.3,255558,2021
436969,The Suicide Squad,James Gunn,Idris Elba,Margot Robbie,John Cena,Action Comedy Adventure,"Supervillains Harley Quinn, Bloodsport, Peacemaker and a collection of nutty cons at Belle Reve prison join the super-secret, super-shady Task Force X as they are dropped off at the remote, enemy-infused island of Corto Maltese.",7.2,392324,2021
624789,Naked Singularity,Chase Palmer,John Boyega,Olivia Cooke,Bill Skarsg√É¬•rd,Crime Drama,"When a successful New York public defender loses his first case, he is pulled into a drug heist by a former client in an effort to beat the broken system at its own game.",4.9,2825,2021
682532,John and the Hole,Pascual Sisto,Charlie Shotwell,Michael C. Hall,Jennifer Ehle,Drama Thriller,"While exploring the neighboring woods, 13-year-old John discovers an unfinished bunker √É¬¢√Ç¬Ä√Ç¬î a deep hole in the ground. Seemingly without provocation, he drugs his affluent parents and older sister and drags their unconscious bodies into the bunker, where he holds them captive. As they anxiously wait for John to free them from the hole, the boy returns home, where he can finally do what he wants.",5.2,4426,2021
449406,Vivo,Kirk DeMicco,Lin-Manuel Miranda,Ynairaly Simo,Zoe Saldana,Animation Family Comedy,A music-loving kinkajou named Vivo embarks on the journey of a lifetime to fulfill his destiny and deliver a love song for an old friend.,6.7,21114,2021
12628,Playing God,Scott Brignac,Hannah Kasulka,Luke Benward,Jude Demorest,Drama Action Thriller Crime,"Stripped of his medical license after performing an operation while high on amphetamines, famed LA surgeon Dr Eugene Sands abandons his former life only to find himself crossing paths with Raymond Blossom, an infamous counterfeiter. Employed as a ""gun-shot doctor"" when Raymond's associates cannot risk visiting a hospital, Eugene is lured deep into the criminal world and becomes entangled with his boss's girlfriend.",5.2,1188,2021
794602,Swan Song,Todd Stephens,Udo Kier,Jennifer Coolidge,Linda Evans,Comedy Drama,"An aging hairdresser escapes his nursing home to embark on an odyssey across his small town to style a dead woman's hair for her funeral, rediscovering his sparkle along the way.",6.8,16501,2021
639848,She Ball,Nick Cannon,Nick Cannon,Chris Brown,Jaliyuh Manuel,Drama,"On a mission to save his Inglewood community center, Avery Watts enlists a talented basketball player, Shelby, to help him win the grand prize in a street ball tournament. Together, Avery and Shelby challenge local politicians, gangs and their own stereotypes to save their community.",3.5,462,2021
727745,The Kissing Booth 3,Vince Marcello,Joey King,Joel Courtney,Jacob Elordi,Romance Comedy,"It√É¬¢√Ç¬Ä√Ç¬ôs the summer before Elle heads to college, and she has a secret decision to make. Elle has been accepted into Harvard, where boyfriend Noah is matriculating, and also Berkeley, where her BFF Lee is headed and has to decide if she should stay or not.",4.8,20609,2021
550988,Free Guy,Shawn Levy,Ryan Reynolds,Jodie Comer,Lil Rel Howery,Comedy Adventure Sci-Fi,"A bank teller discovers he is actually a background player in an open-world video game, and decides to become the hero of his own story. Now, in a world where there are no limits, he is determined to be the guy who saves his world his way before it's too late.",7.1,408384,2021
592863,Respect,Liesl Tommy,Jennifer Hudson,Forest Whitaker,Marlon Wayans,Drama Music History,The rise of Aretha Franklin√É¬¢√Ç¬Ä√Ç¬ôs career from a child singing in her father√É¬¢√Ç¬Ä√Ç¬ôs church√É¬¢√Ç¬Ä√Ç¬ôs choir to her international superstardom.,6.6,17175,2021
597433,Beckett,Ferdinando Cito Filomarino,John David Washington,Boyd Holbrook,Vicky Krieps,Crime Mystery Thriller,An American tourist in Greece finds himself on the run after a tragic accident plunges him into a political conspiracy that makes him a target for assassination.,5.7,27924,2021
482373,Don't Breathe 2,Rodo Sayagues,Stephen Lang,Brendan Sexton III,Madelyn Grace,Thriller Horror,"The Blind Man has been hiding out for several years in an isolated cabin and has taken in and raised a young girl orphaned from a devastating house fire. Their quiet life together is shattered when a group of criminals kidnap the girl, forcing the Blind Man to leave his safe haven to save her.",6,69108,2021
776503,CODA,Sian Heder,Emilia Jones,Eugenio Derbez,Troy Kotsur,Drama Music Romance,"As a CODA (Child of Deaf Adults), Ruby is the only hearing person in her deaf family. When the family's fishing business is threatened, Ruby finds herself torn between pursuing her love of music and her fear of abandoning her parents.",8,155589,2021
579047,Reminiscence,Lisa Joy,Hugh Jackman,Rebecca Ferguson,Thandiwe Newton,Mystery Sci-Fi,"Nicolas Bannister, a rugged and solitary veteran living in a near-future Miami flooded by rising seas, is an expert in a dangerous occupation: he offers clients the chance to relive any memory they desire. His life changes when he meets a mysterious young woman named Mae. What begins as a simple matter of lost and found becomes a passionate love affair. But when a different client's memories implicate Mae in a series of violent crimes, Bannister must delve through the dark world of the past to uncover the truth about the woman he fell for.",5.9,63471,2021
619297,Sweet Girl,Brian Andrew Mendoza,Jason Momoa,Isabela Merced,Manuel Garcia-Rulfo,Action Thriller Drama,"A man vows to bring justice to those responsible for his wife's death while protecting the only family he has left, his daughter.",5.5,34487,2021
