Movie_id,Title,Director,Actor1,Actor2,Actor3,Genre,Overview,Ratings,Votes,Year
489925,Eighth Grade,Bo Burnham,Elsie Fisher,Josh Hamilton,Emily Robinson,Comedy Drama,Thirteen-year-old Kayla endures the tidal wave of contemporary suburban adolescence as she makes her way through the last week of middle school √É¬¢√Ç¬Ä√Ç¬î the end of her thus far disastrous eighth grade year √É¬¢√Ç¬Ä√Ç¬î before she begins high school.,7.4,81129,2018
443009,"Don't Worry, He Won't Get Far on Foot",Gus Van Sant,Joaquin Phoenix,Rooney Mara,Jonah Hill,Comedy Drama,"On the rocky path to sobriety after a life-changing accident, John Callahan discovers the healing power of art, willing his injured hands into drawing hilarious, often controversial cartoons, which bring him a new lease on life.",6.8,29648,2018
476335,Shock and Awe,Rob Reiner,Woody Harrelson,Tommy Lee Jones,James Marsden,History Drama Thriller,"A group of journalists covering George Bush's planned invasion of Iraq in 2003 are skeptical of the presidents claim that Saddam Hussein has ""weapons of mass destruction.""",6.4,8411,2018
458423,Mamma Mia! Here We Go Again,Ol Parker,Lily James,Amanda Seyfried,Pierce Brosnan,Comedy Romance,"Five years after meeting her three fathers, Sophie Sheridan prepares to open her mother√É¬¢√Ç¬Ä√Ç¬ôs hotel. In 1979, young Donna Sheridan meets the men who each could be Sophie√É¬¢√Ç¬Ä√Ç¬ôs biological father.",6.6,104777,2018
345887,The Equalizer 2,Antoine Fuqua,Denzel Washington,Ashton Sanders,Pedro Pascal,Action Thriller Crime,"Robert McCall, who serves an unflinching justice for the exploited and oppressed, embarks on a relentless, globe-trotting quest for vengeance when a long-time girl friend is murdered.",6.7,186501,2018
489930,Blindspotting,Carlos L√É¬≥pez Estrada,Janina Gavankar,Ethan Embry,Daveed Diggs,Comedy Drama,"Collin must make it through his final three days of probation for a chance at a new beginning. He and his troublemaking childhood best friend, Miles, work as movers, and when Collin witnesses a police shooting, the two men√É¬¢√Ç¬Ä√Ç¬ôs friendship is tested as they grapple with identity and their changed realities in the rapidly-gentrifying neighborhood they grew up in.",7.4,32302,2018
505058,Unfriended: Dark Web,Stephen Susco,Colin Woodell,Rebecca Rittenhouse,Betty Gabriel,Horror Thriller Mystery,"When a 20-something finds a cache of hidden files on his new laptop, he and his friends are unwittingly thrust into the depths of the dark web. They soon discover someone has been watching their every move and will go to unimaginable lengths to protect the dark web.",6,37240,2018
794004,Bleach,Shinsuke Sato,Sota Fukushi,Hana Sugisaki,Ryo Yoshizawa,Horror Crime,A man goes through extreme measures to attempt to stop the ghosts of the girls he murdered in a snuff film from haunting while trying to keep the authorities off his back as well.,6.3,12608,2018
446132,Gauguin: Voyage to Tahiti,Edouard Deluc,Vincent Cassel,Tuhei Adams,Malik Zidi,Drama Romance,"In 1891, the French painter Paul Gauguin leaves Paris and travels to Tahiti to renew his art as a free man, far from the European artistic conventionalism. On his journey of discovery, he faces solitude and disease, but he also knows the beauty of wild nature and the love of Tehura, a young native girl who becomes his wife and model.",6,2334,2018
353081,Mission: Impossible - Fallout,Christopher McQuarrie,Tom Cruise,Henry Cavill,Ving Rhames,Action Adventure,"When an IMF mission ends badly, the world is faced with dire consequences. As Ethan Hunt takes it upon himself to fulfill his original briefing, the CIA begin to question his loyalty and his motives. The IMF team find themselves in a race against time, hunted by assassins while trying to prevent a global catastrophe.",7.7,369345,2018
474395,Teen Titans Go! To the Movies,Peter Rida Michail,Scott Menville,Khary Payton,Tara Strong,Animation Action Comedy Sci-Fi,"All the major DC superheroes are starring in their own films, all but the Teen Titans, so Robin is determined to remedy this situation by getting over his role as a sidekick and becoming a movie star. Thus, with a few madcap ideas and an inspirational song in their hearts, the Teen Titans head to Hollywood to fulfill their dreams.",6.7,21236,2018
506763,Detective Dee: The Four Heavenly Kings,Tsui Hark,Tsui Hark (director),Chang Chia-lu,Chen Kuo-Fu (screenplay),Mystery Fantasy Adventure Action,"Dee, the detective serving Chinese empress Wu Zetian, is called upon to investigate a series of strange events in Loyang, including the appearance of mysterious warriors wearing Chiyou ghost masks, foxes that speak human language and the pillar sculptures in the palace coming alive.",6.3,2961,2018
347866,Hot Summer Nights,Elijah Bynum,TimothÈe Chalamet,Maika Monroe,Alex Roe,Drama Comedy Crime,"A teen winds up in over his head while dealing drugs with a rebellious partner in Cape Cod, Mass.",6.4,22581,2018
492998,Puzzle,Marc Turtletaub,Kelly Macdonald,Irrfan Khan,David Denman,Drama,"After years of caring exclusively for the needs of her husband and children, Agnes, a devoted housewife living in a small town near New York, has found something she really enjoys doing: solving puzzles.",6.7,8372,2018
429415,Extinction,Ben Young,Michael Pe√É¬É√Ç¬±a,Lizzy Caplan,Mike Colter,Action Drama Sci-Fi Thriller,"A chief mechanic at a factory, haunted by apocalyptic nightmares, becomes a hero when Earth is invaded by a mysterious army bent on destruction.",5.8,56435,2018
420814,Christopher Robin,Marc Forster,Ewan McGregor,Hayley Atwell,Jim Cummings,Adventure Comedy Family Fantasy,"Christopher Robin, the boy who had countless adventures in the Hundred Acre Wood, has grown up and lost his way. Now it√É¬¢√Ç¬Ä√Ç¬ôs up to his spirited and loveable stuffed animals, Winnie The Pooh, Tigger, Piglet, and the rest of the gang, to rekindle their friendship and remind him of endless days of childlike wonder and make-believe, when doing nothing was the very best something.",7.2,82942,2018
445651,The Darkest Minds,Jennifer Yuh Nelson,Amandla Stenberg,Mandy Moore,Harris Dickinson,Action Adventure Drama,"After a disease kills 98% of America's children, the surviving 2% develop superpowers and are placed in internment camps. A 16-year-old girl escapes her camp and joins a group of other teens on the run from the government.",5.7,35301,2018
454992,The Spy Who Dumped Me,Susanna Fogel,Mila Kunis,Kate McKinnon,Justin Theroux,Action Comedy,A couple of thirtysomething best friends unwittingly become entangled in an international conspiracy when one√É¬¢√Ç¬Ä√Ç¬ôs ex-boyfriend shows up at their apartment with a team of deadly assassins on his trail.,6,81722,2018
426613,The Miseducation of Cameron Post,Desiree Akhavan,Chlo√´ Grace Moretz,Sasha Lane,John Gallagher,Drama,"Pennsylvania, 1993. After getting caught with another girl, teenager Cameron Post is sent to a conversion therapy center run by the strict Dr. Lydia Marsh and her brother, Reverend Rick, whose treatment consists in repenting for feeling √É¬¢√Ç¬Ä√Ç¬úsame sex attraction.√É¬¢√Ç¬Ä√Ç¬ù Cameron befriends fellow sinners Jane and Adam, thus creating a new family to deal with the surrounding intolerance.",6.6,24978,2018
490005,Never Goin' Back,Augustine Frizzell,Maia Mitchell,Camila Morrone,Kyle Mooney,Comedy,"Angela and Jessie are best friends intent on taking a wild beach trip, but when their roommate loses all their money in a drug scam, the girls√É¬¢√Ç¬Ä√Ç¬îblissfully stoned√É¬¢√Ç¬Ä√Ç¬îgo to increasingly daring and absurd lengths to get it back.",6,3914,2018
477510,Dog Days,Ken Marino,Nina Dobrev,Finn Wolfhard,Vanessa Hudgens,Romance Comedy,A group of people in Los Angeles are brought together thanks to their canine friends.,6.2,5410,2018
345940,The Meg,Jon Turteltaub,Jason Statham,Li Bingbing,Rainn Wilson,Action Sci-Fi Horror,"A deep sea submersible pilot revisits his past fears in the Mariana Trench, and accidentally unleashes the seventy foot ancestor of the Great White Shark believed to be extinct.",5.6,202033,2018
487558,BlacKkKlansman,Spike Lee,John David Washington,Adam Driver,Laura Harrier,Comedy Crime Drama,"Colorado Springs, late 1970s. Ron Stallworth, an African American police officer, and Flip Zimmerman, his Jewish colleague, run an undercover operation to infiltrate the Ku Klux Klan.",7.5,284203,2018
439015,Slender Man,Sylvain White,Joey King,Julia Goldani Telles,Jaz Sinclair,Horror Mystery Thriller,"In a small town in Massachusetts, four high school girls perform a ritual in an attempt to debunk the lore of Slender Man. When one of the girls goes mysteriously missing, they begin to suspect that she is, in fact, his latest victim.",3.2,37244,2018
448776,A Prayer Before Dawn,Jean-StÈphane Sauvaire,Joe Cole,Panya Yimmumphai,Vithaya Pansringarm,Drama Action Crime,"The amazing true story of Billy Moore, an English boxer incarcerated in Thailand√É¬¢√Ç¬Ä√Ç¬ôs most notorious prison. Thrown into a world of drugs and violence, he finds his best chance to escape is to fight his way out in prison Muay Thai tournaments.",6.8,25715,2018
455207,Crazy Rich Asians,Jon M. Chu,Constance Wu,Henry Golding,Gemma Chan,Comedy Drama Romance,"An American-born Chinese economics professor accompanies her boyfriend to Singapore for his best friend's wedding, only to get thrust into the lives of Asia's rich and famous.",6.9,185475,2018
399360,Alpha,Albert Hughes,Kodi Smit-McPhee,Leonor Varela,Marcin Kowalczyk,Adventure Drama,"In the prehistoric past, Keda, a young and inexperienced hunter, struggles to return home after being separated from his tribe when bison hunting goes awry. On his way back he will find an unexpected ally.",6.6,65519,2018
347375,Mile 22,Peter Berg,Mark Wahlberg,John Malkovich,Lauren Cohan,Action Thriller,"An elite group of American operatives, aided by a top-secret tactical command team, must transport an asset who holds life-threatening information to an extraction point 22 miles away through the hostile streets of an Asian city.",6.1,85278,2018
340613,The Wife,Bjˆrn Runge,Glenn Close,Jonathan Pryce,Christian Slater,Drama,"A wife questions her life choices as she travels to Stockholm with her husband, where he is slated to receive the Nobel Prize for Literature.",7.2,42329,2018
385360,Billionaire Boys Club,James Cox,Ansel Elgort,Taron Egerton,Kevin Spacey,Drama Thriller,A group of wealthy boys in Los Angeles during the early 1980s establishes a get rich quick scam that turns deadly.,5.6,14406,2018
458344,"Juliet, Naked",Jesse Peretz,Ethan Hawke,Rose Byrne,Chris O'Dowd,Comedy Drama Romance,"Annie is stuck in a long-term relationship with Duncan √É¬¢√Ç¬Ä√Ç¬ì an obsessive fan of obscure rocker Tucker Crowe. When the acoustic demo of Tucker's hit record from 25 years ago surfaces, its discovery leads to a life-changing encounter with the elusive rocker himself.",6.6,24175,2018
421792,Down a Dark Hall,Rodrigo Cort√©s,AnnaSophia Robb,Uma Thurman,Isabelle Fuhrman,Horror Mystery Thriller Fantasy Drama,"Kit, a troubled girl, is sent to the exclusive Blackwood boarding school, where she discovers that only four other female students have been admitted to learn the four pillars of knowledge under the ominous wing of the mysterious headmistress Madame Duret.",5,14751,2018
466282,To All the Boys I've Loved Before,Susan Johnson,Lana Condor,Noah Centineo,Anna Cathcart,Comedy Romance,Lara Jean's love life goes from imaginary to out of control when her secret letters to every boy she's ever fallen for are mysteriously mailed out.,7,119793,2018
412988,The Happytime Murders,Brian Henson,Melissa McCarthy,Maya Rudolph,Joel McHale,Action Comedy Crime,"In a world where human beings and puppets live together, when the members of the cast of a children's television show aired during the 1990s begin to get murdered one by one, puppet Phil Philips, a former LAPD detective who fell in disgrace and turned into a private eye, takes on the case at the request of his old boss in order to assist detective Edwards, who was his partner in the past.",5.5,29991,2018
489999,Searching,Aneesh Chaganty,John Cho,Debra Messing,Joseph Lee,Thriller Mystery Drama,"After David Kim's 16-year-old daughter goes missing, a local investigation is opened and a detective is assigned to the case. But 37 hours later and without a single lead, David decides to search the one place no one has looked yet, where all secrets are kept today: his daughter's laptop.",7.6,177084,2018
433498,Papillon,Michael Noer,Charlie Hunnam,Rami Malek,Tommy Flanagan,Drama,"HenriÇPapillon, CharriÉre, a safecracker from the Parisian underworld, is wrongfully convicted and sentenced to life imprisonment in the penal colony of French Guiana, where he forges a strong friendship with Louis Dega, a counterfeiter who needs his protection.",7.2,83224,2018
438590,A.X.L.,Oliver Daly,Alex Neustaedter,Becky G,Alex MacNicoll,Sci-Fi Action Adventure Family,The life of a teenage boy is forever altered by a chance encounter with cutting edge military technology.,5.3,13034,2018
493551,Operation Finale,Chris Weitz,Oscar Isaac,Ben Kingsley,Lior Raz,Drama History Thriller,"In 1960, a team of Israeli secret agents is deployed to find Adolf Eichmann, the infamous Nazi architect of the Holocaust, supposedly hidden in Argentina, and get him to Israel to be judged.",6.6,47338,2018
425505,Kin,Jonathan Baker,Myles Truitt,Jack Reynor,Zo√´ Kravitz,Sci-Fi Action Adventure Thriller,"A young boy finds a powerful otherworldly weapon, which he uses to save his older adoptive brother from a crew of thugs. Before long, the two of them are also pursued by federal agents and mysterious mercenaries aiming to reclaim their asset.",5.8,18310,2018
455108,The Little Stranger,Lenny Abrahamson,Domhnall Gleeson,Ruth Wilson,Will Poulter,Mystery Horror,"In a dusty post-war summer in rural Warwickshire, a doctor is called to a patient at lonely Hundreds Hall. Home to the Ayres family for over two centuries, the Georgian house is now in decline. But are the Ayreses haunted by something more sinister than a dying way of life?",5.5,10478,2018
489929,Destination Wedding,Victor Levin,Winona Ryder,Keanu Reeves,DJ Dallenbach,Romance Comedy Drama,"Frank and Lindsay√É¬¢√Ç¬Ä√Ç¬îtwo emotionally-broken strangers√É¬¢√Ç¬Ä√Ç¬îmeet on the way to a destination wedding. Over the course of the weekend and against all odds, they find themselves drawn together even though they are initially repulsed by one another.",6,32511,2018
531593,Reprisal,Brian A. Miller,Bruce Willis,Frank Grillo,Johnathon Schaech,Action Thriller Crime,"Jacob, a bank manager haunted by a violent heist that took the life of a coworker, teams up with his ex-cop neighbor, James, to bring down the assailant. While the two men work together to figure out the thief√É¬¢√Ç¬Ä√Ç¬ôs next move, Gabriel, the highly-trained criminal, is one step ahead. When Gabriel kidnaps Jacob√É¬¢√Ç¬Ä√Ç¬ôs wife and daughter, Jacob barrels down a path of bloodshed that initiates an explosive counterattack and brings all three men to the breaking point.",4.3,8040,2018
439079,The Nun,Corin Hardy,Demi√É¬°n Bichir,Taissa Farmiga,Jonas Bloquet,Horror Mystery Thriller,A priest with a haunted past and a novice on the threshold of her final vows are sent by the Vatican to investigate the death of a young nun in Romania and confront a malevolent force in the form of a demonic nun.,5.3,166042,2018
458594,Peppermint,Pierre Morel,Jennifer Garner,John Ortiz,Juan Pablo Raba,Action Thriller,"A grieving mother transforms herself into a vigilante following the murders of her husband and daughter, eluding the authorities to deliver her own personal brand of justice.",6.5,69475,2018
346910,The Predator,Shane Black,Boyd Holbrook,Trevante Rhodes,Jacob Tremblay,Sci-Fi Action Adventure,"When a young boy accidentally triggers the universe's most lethal hunters' return to Earth, only a ragtag crew of ex-soldiers and a disgruntled scientist can prevent the end of the human race.",5.3,141016,2018
438808,White Boy Rick,Yann Demange,Matthew McConaughey,Richie Merritt,Bel Powley,Crime Drama,"The story of a teenager, Richard Wershe Jr., who became an undercover informant for the police during the 1980s and was ultimately arrested for drug-trafficking and sentenced to life in prison.",6.5,41522,2018
484247,A Simple Favor,Paul Feig,Anna Kendrick,Blake Lively,Henry Golding,Crime Thriller Mystery Comedy,"Stephanie, a dedicated mother and popular vlogger, befriends Emily, a mysterious upper-class woman whose son Nicky attends the same school as Miles, Stephanie's son. When Emily asks her to pick Nicky up from school and then disappears, Stephanie undertakes an investigation that will dive deep into Emily's cloudy past.",6.8,159080,2018
467936,The Children Act,Richard Eyre,Emma Thompson,Stanley Tucci,Fionn Whitehead,Drama,"In the midst of a marital crisis, a High Court judge must decide if she should order a life-saving blood transfusion for a teen with cancer despite his family's refusal to accept medical treatment for religious reasons.",6.7,14508,2018
460071,Lizzie,Craig William Macneill,Chlo√É¬´ Sevigny,Kristen Stewart,Jay Huguley,Crime Drama Thriller,"Massachusetts, 1892. An unmarried woman of 32 and a social outcast, Lizzie lives a claustrophobic life under her father's cold and domineering control. When Bridget Sullivan, a young maid, comes to work for the family, Lizzie finds a sympathetic, kindred spirit, and a secret intimacy soon blossoms into a wicked plan.",5.9,8987,2018
506680,Unbroken: Path to Redemption,Harold Cronk,Samuel Hunt,Merritt Patterson,Vanessa Bell Calloway,Drama,"Zamperini returns to California where he wound up marrying Cynthia Applewhite while wrestling with untreated PTSD, suffering constant nightmares, angry, bitter and deeply depressed, his wife convinces Zamperini to attend the 1949 Billy Graham Crusade.",5.8,3432,2018
532973,Hell House LLC II: The Abaddon Hotel,Stephen Cognetti,Vasile Flutur,Jillian Geurts,Joy Shatz,Horror,"Eight years after the opening night tragedy of HELL HOUSE LLC, many unanswered questions remain. Thanks to an anonymous tip, an investigative journalist is convinced that key evidence is hidden inside the abandoned Abaddon Hotel. She assembles a team to break into the hotel in hopes of discovering the truth. But the source of the tip and the secrets of the Abaddon Hotel are more horrifying than any of them could have imagined.",5.3,6073,2018
463821,The House with a Clock in Its Walls,Eli Roth,Jack Black,Cate Blanchett,Owen Vaccaro,Fantasy Family Comedy,"When ten-year-old Lewis is suddenly orphaned, he is sent to live with his Uncle Jonathan in a creaky (and creepy) old mansion with a mysterious ticking noise that emanates from the walls. Upon discovering that his uncle is a warlock, Lewis begins learning magic, but when he rebelliously resurrects an evil warlock he must find the secret of the house and save the world from destruction.",6.1,54527,2018
446696,Life Itself,Dan Fogelman,Oscar Isaac,Olivia Wilde,Mandy Patinkin,Drama Romance,"As a young New York couple goes from college romance to marriage and the birth of their first child, the unexpected twists of their journey create reverberations that echo over continents and through lifetimes.",6.9,23998,2018
440161,The Sisters Brothers,Jacques Audiard,John C. Reilly,Joaquin Phoenix,Jake Gyllenhaal,Drama Western,"Oregon, 1851. Hermann Kermit Warm, a chemist and aspiring gold prospector, keeps a profitable secret that the Commodore wants to know, so he sends the Sisters brothers, two notorious assassins, to capture him on his way to California.",6.9,69236,2018
446101,Assassination Nation,Sam Levinson,Odessa Young,Suki Waterhouse,Hari Nef,Thriller Horror Comedy,"After an anonymous hacker begins leaking the private data of thousands living in a small American town, the townspeople spiral into madness, with four high school seniors at the center of the maelstrom.",6,21292,2018
523773,Little Italy,Donald Petrie,Emma Roberts,Hayden Christensen,Alyssa Milano,Comedy Romance,Former childhood pals Leo and Nikki are attracted to each other as adults√É¬¢√Ç¬Ä√Ç¬îbut will their feuding parents' rival pizzerias put a chill on their sizzling romance?,5.7,16934,2018
454652,Colette,Wash Westmoreland,Keira Knightley,Dominic West,Eleanor Tomlinson,Drama History,"After marrying a successful Parisian writer known commonly as Willy, Sidonie-Gabrielle Colette is transplanted from her childhood home in rural France to the intellectual and artistic splendor of Paris. Soon after, Willy convinces Colette to ghostwrite for him. She pens a semi-autobiographical novel about a witty and brazen country girl named Claudine, sparking a bestseller and a cultural sensation. After its success, Colette and Willy become the talk of Paris and their adventures inspire additional Claudine novels.",6.7,25972,2018
532908,Fahrenheit 11/9,Michael Moore,Michael Moore,Donal Trump,Alexandria Oscasio-Cortez,Documentary,"Michael Moore's provocative documentary explores the two most important questions of the Trump Era: How did we get here, and how do we get out.",7.2,20159,2018
750253,My Son,Christian Carion,Guillaume Canet,Melanie Laurent,Olivier de Benoist,Thriller Crime Drama,"When a man's only son goes missing, he travels to the town where his ex-wife lives in search of answers. To play a man whose life is clouded by mystery, McAvoy will not be given a script of dialogue.",6,14109,2018
511972,"Love, Gilda",Lisa Dapolito,Gilda Radner,Gene Wilder,Chevy Chase,Documentary,"Diaries, audiotapes, videotapes and testimonies from friends and colleagues offer insight into the life and career of Gilda Radner -- the beloved comic and actress who became an icon on Saturday Night Live.",7.4,1764,2018
505262,My Hero Academia: Two Heroes,Kenji Nagasaki,Justin Briner,Christopher R. Sabat,Clifford Chapin,Animation Action Adventure Fantasy,"All Might and Deku accept an invitation to go abroad to a floating and mobile manmade city, called 'I-Island', where they research quirks as well as hero supplemental items at the special 'I-Expo' convention that is currently being held on the island. During that time, suddenly, despite an iron wall of security surrounding the island, the system is breached by a villain, and the only ones able to stop him are the students of Class 1-A.",7.3,12020,2018
446894,Smallfoot,Karey Kirkpatrick,Channing Tatum,James Corden,Zendaya,Family Animation Adventure Fantasy,A bright young yeti finds something he thought didn't exist√É¬¢√Ç¬Ä√Ç¬îa human. News of this √É¬¢√Ç¬Ä√Ç¬úsmallfoot√É¬¢√Ç¬Ä√Ç¬ù throws the simple yeti community into an uproar over what else might be out there in the big world beyond their snowy village.,6.6,42218,2018
454293,Night School,Malcolm D. Lee,Kevin Hart,Tiffany Haddish,Rob Riggle,Comedy,"Teddy Walker is a successful salesman whose life takes an unexpected turn when he accidentally blows up his place of employment. Forced to attend night school to get his GED, Teddy soon finds himself dealing with a group of misfit students, his former high school nemesis and a feisty teacher who doesn't think he's too bright.",5.6,43566,2018
38577,The Old Man & the Gun,David Lowery,Robert Redford,Casey Affleck,Danny Glover,Animation Adventure Drama,"An old fisherman goes out on his fishing trip and makes a huge catch, the biggest of his life.",6.7,48994,2018
429476,Hell Fest,Gregory Plotkin,Bex Taylor-Klaus,Amy Forsyth,Reign Edwards,Horror Thriller,"On Halloween night at a horror theme park, a costumed killer begins slaying innocent patrons who believe that it's all part of the festivities.",5.5,18963,2018
670211,Power of the Air,Dave Christiano,Nicholas X. Parsons,Patty Duke,Michael Gross,Drama,An African Missionary shares with a Christian man in the United States how he feels the church in America is in great danger. The Christian is very convicted by what he hears and then sets forth a plan to reach his city with the gospel.,5.4,116,2018
335983,Venom,Ruben Fleischer,Tom Hardy,Michelle Williams,Riz Ahmed,Sci-Fi Action,"Investigative journalist Eddie Brock attempts a comeback following a scandal, but accidentally becomes the host of Venom, a violent, super powerful alien symbiote. Soon, he must rely on his newfound powers to protect the world from a shadowy organization looking for a symbiote of their own.",6.6,524870,2018
332562,A Star Is Born,Bradley Cooper,Bradley Cooper,Lady Gaga,Sam Elliott,Music Drama Romance,"Seasoned musician Jackson Maine discovers √É¬¢√Ç¬Ä√Ç¬î and falls in love with √É¬¢√Ç¬Ä√Ç¬î struggling artist Ally. She has just about given up on her dream to make it big as a singer √É¬¢√Ç¬Ä√Ç¬î until Jack coaxes her into the spotlight. But even as Ally's career takes off, the personal side of their relationship is breaking down, as Jack fights an ongoing battle with his own internal demons.",7.6,407944,2018
539199,The Great Buster: A Celebration,Peter Bogdanovich,Buster Keaton,Mel Brooks,Werner herzog,Documentary Comedy,A celebration of the life and career of one of America's most influential and celebrated filmmakers and comedians√É¬¢√Ç¬Ä√Ç¬îBuster Keaton√É¬¢√Ç¬Ä√Ç¬îwhose singular style and fertile output during the silent era created his legacy as a true cinematic visionary.,7.5,2258,2018
