Movie_id,Title,Director,Actor1,Actor2,Actor3,Genre,Overview,Ratings,Votes,Year
290250,The Nice Guys,Shane Black,Russell Crowe,Ryan Gosling,Angourie Rice,Comedy Crime Action,A private eye investigates the apparent suicide of a fading porn star in 1970s Los Angeles and uncovers a conspiracy.,7.4,359734,2016
246655,X-Men: Apocalypse,Bryan Singer,James McAvoy,Michael Fassbender,Jennifer Lawrence,Action Adventure Sci-Fi Fantasy,"After the re-emergence of the world's first mutant, world-destroyer Apocalypse, the X-Men must unite to defeat his extinction level plan.",6.9,454508,2016
241259,Alice Through the Looking Glass,James Bobin,Johnny Depp,Anne Hathaway,Mia Wasikowska,Adventure Family Fantasy,Alice Kingsleigh returns to Underland and faces a new adventure in saving the Mad Hatter.,6.2,118918,2016
308531,Teenage Mutant Ninja Turtles: Out of the Shadows,Dave Green,Megan Fox,Will Arnett,Laura Linney,Action Adventure Comedy Family Sci-Fi,"After supervillain Shredder escapes custody, he joins forces with mad scientist Baxter Stockman and two dimwitted henchmen, Bebop and Rocksteady, to unleash a diabolical plan to take over the world. As the Turtles prepare to take on Shredder and his new crew, they find themselves facing an even greater evil with similar intentions: the notorious Krang.",5.9,98473,2016
296096,Me Before You,Thea Sharrock,Emilia Clarke,Sam Claflin,Janet McTeer,Drama Romance,"A small town girl is caught between dead-end jobs. A high-profile, successful man becomes wheelchair bound following an accident. The man decides his life is not worth living until the girl is hired for six months to be his new caretaker. Worlds apart and trapped together by circumstance, the two get off to a rocky start. But the girl becomes determined to prove to the man that life is worth living and as they embark on a series of adventures together, each finds their world changing in ways neither of them could begin to imagine.",7.4,277825,2016
341012,Popstar: Never Stop Never Stopping,Jorma Taccone,Andy Samberg,Jorma Taccone,Akiva Schaffer,Comedy Music,"When his new album fails to sell records, pop/rap superstar Conner4real goes into a major tailspin and watches his celebrity high life begin to collapse. He'll try anything to bounce back, anything except reuniting with his old rap group The Style Boyz.",6.7,66682,2016
259693,The Conjuring 2,James Wan,Vera Farmiga,Patrick Wilson,Frances O'Connor,Horror Thriller,Lorraine and Ed Warren travel to north London to help a single mother raising four children alone in a house plagued by malicious spirits.,7.3,293998,2016
68735,Warcraft,Duncan Jones,Travis Fimmel,Paula Patton,Ben Foster,Action Adventure Fantasy,"The peaceful realm of Azeroth stands on the brink of war as its civilization faces a fearsome race of invaders: orc warriors fleeing their dying home to colonize another. As a portal opens to connect the two worlds, one army faces destruction and the other faces extinction. From opposing sides, two heroes are set on a collision course that will decide the fate of their family, their people, and their home.",6.7,275046,2016
291805,Now You See Me 2,Jon M. Chu,Jesse Eisenberg,Mark Ruffalo,Woody Harrelson,Crime Thriller Action Mystery,"One year after outwitting the FBI and winning the public√É¬¢√Ç¬Ä√Ç¬ôs adulation with their mind-bending spectacles, the Four Horsemen resurface only to find themselves face to face with a new enemy who enlists them to pull off their most dangerous heist yet.",6.4,313588,2016
127380,Finding Dory,Andrew Stanton,Ellen DeGeneres,Albert Brooks,Hayden Rolence,Adventure Animation Comedy Family,Dory is reunited with her friends Nemo and Marlin in the search for answers about her past. What can she remember? Who are her parents? And where did she learn to speak Whale?,7.2,296134,2016
302699,Central Intelligence,Rawson Marshall Thurber,Dwayne Johnson,Kevin Hart,Amy Ryan,Action Comedy Crime Mystery,"After he reunites with an old pal through Facebook, a mild-mannered accountant is lured into the world of international espionage.",6.3,207770,2016
47933,Independence Day: Resurgence,Roland Emmerich,Liam Hemsworth,Jeff Goldblum,Bill Pullman,Action Adventure Sci-Fi,"We always knew they were coming back. Using recovered alien technology, the nations of Earth have collaborated on an immense defense program to protect the planet. But nothing can prepare us for the aliens√É¬¢√Ç¬Ä√Ç¬ô advanced and unprecedented force. Only the ingenuity of a few brave men and women can bring our world back from the brink of extinction.",5.2,186538,2016
332567,The Shallows,Jaume Collet-Serra,Blake Lively,Oscar Jaenada,Brett Cullen,Horror Drama Thriller,"When Nancy is surfing on a secluded beach, she finds herself on the feeding ground of a great white shark. Though she is stranded only 200 yards from shore, survival proves to be the ultimate test of wills, requiring all of Nancy's ingenuity, resourcefulness, and fortitude.",6.3,141477,2016
316152,Free State of Jones,Gary Ross,Matthew McConaughey,Gugu Mbatha-Raw,Mahershala Ali,Action Drama History War,"In 1863, Mississippi farmer Newt Knight serves as a medic for the Confederate Army. Opposed to slavery, Knight would rather help the wounded than fight the Union. After his nephew dies in battle, Newt returns home to Jones County to safeguard his family but is soon branded an outlaw deserter. Forced to flee, he finds refuge with a group of runaway slaves hiding out in the swamps. Forging an alliance with the slaves and other farmers, Knight leads a rebellion that would forever change history.",6.9,61012,2016
301365,The Neon Demon,Nicolas Winding Refn,Elle Fanning,Karl Glusman,Jena Malone,Thriller Horror,"When aspiring model Jesse moves to Los Angeles, her youth and vitality are devoured by a group of beauty-obsessed women who will take any means necessary to get what she has.",6.1,101957,2016
347031,Swiss Army Man,Daniel Scheinert,Paul Dano,Daniel Radcliffe,Daniel Kwan,Comedy Drama Romance Fantasy Adventure,"Alone on a tiny deserted island, Hank has given up all hope of ever making it home again. But one day everything changes when a dead body washes ashore, and he soon realizes it may be his last opportunity to escape certain death. Armed with his new √É¬¢√Ç¬Ä√Ç¬úfriend√É¬¢√Ç¬Ä√Ç¬ù and an unusual bag of tricks, the duo go on an epic adventure to bring Hank back to the woman of his dreams.",6.9,131313,2016
258489,The Legend of Tarzan,David Yates,Alexander Skarsg√É¬•rd,Samuel L. Jackson,Margot Robbie,Fantasy Action Adventure,"Tarzan, having acclimated to life in London, is called back to his former home in the jungle to investigate the activities at a mining encampment.",6.2,184667,2016
267935,The BFG,Steven Spielberg,Mark Rylance,Ruby Barnhill,Penelope Wilton,Adventure Family Fantasy,"The BFG is no ordinary bone-crunching giant. He is far too nice and jumbly. It's lucky for Sophie that he is. Had she been carried off in the middle of the night by the Bloodbottler, or any of the other giants√É¬¢√Ç¬Ä√Ç¬îrather than the BFG√É¬¢√Ç¬Ä√Ç¬îshe would have soon become breakfast. When Sophie hears that the giants are flush-bunking off to England to swollomp a few nice little chiddlers, she decides she must stop them once and for all. And the BFG is going to help her!",6.3,91738,2016
316727,The Purge: Election Year,James DeMonaco,Frank Grillo,Elizabeth Mitchell,Mykelti Williamson,Action Horror Thriller,"Two years after choosing not to kill the man who killed his son, former police sergeant Leo Barnes has become head of security for Senator Charlene Roan, the front runner in the next Presidential election due to her vow to eliminate the Purge. On the night of what should be the final Purge, a betrayal from within the government forces Barnes and Roan out onto the street where they must fight to survive the night.",6,108040,2016
359412,Marauders,Steven C. Miller,Christopher Meloni,Bruce Willis,Dave Bautista,Action Crime Thriller,An untraceable group of elite bank robbers is chased by a suicidal FBI agent who uncovers a deeper purpose behind the robbery-homicides.,5.5,23537,2016
328111,The Secret Life of Pets,Chris Renaud,Louis C.K.,Eric Stonestreet,Kevin Hart,Adventure Comedy Animation Family,"The quiet life of a terrier named Max is upended when his owner takes in Duke, a stray whom Max instantly dislikes.",6.5,213538,2016
334533,Captain Fantastic,Matt Ross,Viggo Mortensen,Frank Langella,Kathryn Hahn,Adventure Drama,A father living in the forests of the Pacific Northwest with his six young kids tries to assimilate back into society.,7.8,230720,2016
316023,Mike and Dave Need Wedding Dates,Jake Szymanski,Zac Efron,Anna Kendrick,Adam DeVine,Comedy,"Mike and Dave are young, adventurous, fun-loving brothers who tend to get out of control at family gatherings. When their sister Jeanie reveals her Hawaiian wedding plans, the rest of the Stangles insist that the brothers bring respectable dates. After placing an ad on Craigslist, the siblings decide to pick Tatiana and Alice, two charming and seemingly normal women. Once they arrive on the island, however, Mike and Dave realize that their companions are ready to get wild and party.",6,93992,2016
513603,Characterz,Jon Binkowski,Mitchel Musso,Walt Willey,Marc Musso,Comedy Family,Life as a costumed mascot becomes a bizarre experience for a new recruit who joins an offbeat team of amusement park 'Characterz' for a summer job he'll never forget.,6.1,66,2016
325789,The Infiltrator,Brad Furman,Bryan Cranston,Diane Kruger,Benjamin Bratt,Crime Drama Thriller,A U.S Customs official uncovers a massive money laundering scheme involving Pablo Escobar.,7,77500,2016
339397,CafÈ Society,Woody Allen,Jeannie Berlin,Steve Carell,Jesse Eisenberg,Comedy Drama Romance,"The story of a young man who arrives in Hollywood during the 1930s hoping to work in the film industry, falls in love, and finds himself swept up in the vibrant caf√É¬É√Ç¬© society that defined the spirit of the age.",6.6,80382,2016
43074,Ghostbusters,Paul Feig,Melissa McCarthy,Kristen Wiig,Kate McKinnon,Action Fantasy Comedy,"Following a ghost invasion of Manhattan, paranormal enthusiasts Erin Gilbert and Abby Yates, nuclear engineer Jillian Holtzmann, and subway worker Patty Tolan band together to stop the otherworldly threat.",6.8,241457,2016
188927,Star Trek Beyond,Justin Lin,Chris Pine,Zachary Quinto,Karl Urban,Action Adventure Sci-Fi,"The USS Enterprise crew explores the furthest reaches of uncharted space, where they encounter a mysterious new enemy who puts them and everything the Federation stands for to the test.",7,255623,2016
382322,Batman: The Killing Joke,Sam Liu,Kevin Conroy,Mark Hamill,Tara Strong,Action Animation Crime Drama,"As Batman hunts for the escaped Joker, the Clown Prince of Crime attacks the Gordon family to prove a diabolical point mirroring his own fall into madness.",6.4,60497,2016
278154,Ice Age: Collision Course,Mike Thurmeier,Ray Romano,John Leguizamo,Denis Leary,Adventure Animation Family Comedy,"Set after the events of Continental Drift, Scrat's epic pursuit of his elusive acorn catapults him outside of Earth, where he accidentally sets off a series of cosmic events that transform and threaten the planet. To save themselves from peril, Manny, Sid, Diego, and the rest of the herd leave their home and embark on a quest full of thrills and spills, highs and lows, laughter and adventure while traveling to exotic new lands and locations.",5.7,72813,2016
345911,Lights Out,David F. Sandberg,Teresa Palmer,Maria Bello,Gabriel Bateman,Horror Thriller Mystery,"Rebecca must unlock the terror behind her little brother's experiences that once tested her sanity, bringing her face to face with a supernatural spirit attached to their mother.",6.3,139674,2016
328387,Nerve,Henry Joost,Emma Roberts,Drave Franco,Juliette Lewis,Mystery Adventure Crime,"Industrious high school senior Vee Delmonico has had it with living life on the sidelines. When pressured by friends to join the popular online game Nerve, Vee decides to sign up for just one dare in what seems like harmless fun. But as she finds herself caught up in the thrill of the adrenaline-fueled competition partnered with a mysterious stranger, the game begins to take a sinister turn with increasingly dangerous acts, leading her into a high stakes finale that will determine her entire future.",6.5,138395,2016
324668,Jason Bourne,Paul Greengrass,Matt Damon,Tommy Lee Jones,Alicia Vikander,Action Thriller Mystery Drama,The most dangerous former operative of the CIA is drawn out of hiding to uncover hidden truths about his past.,6.6,238472,2016
376659,Bad Moms,Scott Moore,Mila Kunis,Kristen Bell,Kathryn Hahn,Comedy,"When three overworked and under-appreciated moms are pushed beyond their limits, they ditch their conventional responsibilities for a jolt of long overdue freedom, fun, and comedic self-indulgence.",6.2,132708,2016
297761,Suicide Squad,David Ayer,Will Smith,Jared Leto,Margot Robbie,Action Adventure Fantasy,"From DC Comics comes the Suicide Squad, an antihero team of incarcerated supervillains who act as deniable assets for the United States government, undertaking high-risk black ops missions in exchange for commuted prison sentences.",5.9,711858,2016
322240,Nine Lives,Barry Sonnenfeld,Kevin Spacey,Jennifer Garner,Robbie Amell,Fantasy Comedy Family,A stuffy businessman finds himself trapped inside the body of his family's cat.,5.3,23931,2016
11114,Pete's Dragon,David Lowery,Bryce Dallas Howard,Oakes Fegley,Wes Bentley,Fantasy Animation Comedy Family,"Pete, a young orphan, runs away to a Maine fishing town with his best friend a lovable, sometimes invisible dragon named Elliott! When they are taken in by a kind lighthouse keeper, Nora, and her father, Elliott's prank playing lands them in big trouble. Then, when crooked salesmen try to capture Elliott for their own gain, Pete must attempt a daring rescue.",6.7,60967,2016
223702,Sausage Party,Conrad Vernon,Seth Rogen,Kristen Wiig,Michael Cera,Adventure Animation Comedy Fantasy,Frank leads a group of supermarket products on a quest to discover the truth about their existence and what really happens when they become chosen to leave the grocery store.,6.1,206543,2016
315664,Florence Foster Jenkins,Stephen Frears,Meryl Streep,Hugh Grant,Simon Helberg,Comedy Drama,"The story of Florence Foster Jenkins, a New York heiress, who dreamed of becoming an opera singer, despite having a terrible singing voice.",6.8,58703,2016
338766,Hell or High Water,David Mackenzie,Jeff Bridges,Chris Pine,Ben Foster,Western Crime Drama,A divorced dad and his ex-con brother resort to a desperate scheme in order to save their family's farm in West Texas.,7.6,246107,2016
665,Ben-Hur,Timur Bekmambetov,Jack Huston,Toby Kebbell,Rodrigo Santoro,Action Drama History Adventure,"In 25 AD, Judah Ben-Hur, a Jew in ancient Judea, opposes the occupying Roman empire.  Falsely accused by a Roman childhood friend-turned-overlord of trying to kill the Roman governor, he is put into slavery and his mother and sister are taken away as prisoners.  Three years later and freed by a grateful Roman galley commander whom he has rescued from drowning, he becomes an expert charioteer for Rome, all the while plotting to return to Judea, find and rescue his family, and avenge himself on his former friend.  All the while, the form and work of Jesus move in the background of his life...",5.7,45891,2016
313297,Kubo and the Two Strings,Travis Knight,Charlize Theron,Art Parkinson,Ralph Fiennes,Animation Adventure Family,"Kubo mesmerizes the people in his village with his magical gift for spinning wild tales with origami. When he accidentally summons an evil spirit seeking vengeance, Kubo is forced to go on a quest to solve the mystery of his fallen samurai father and his mystical weaponry, as well as discover his own magical powers.",7.7,136774,2016
308266,War Dogs,Todd Phillips,Jonah Hill,Miles Teller,Ana de Armas,Comedy Crime Drama,"Based on the true story of two young men, David Packouz and Efraim Diveroli, who won a $300 million contract from the Pentagon to arm America's allies in Afghanistan.",7.1,242629,2016
278924,Mechanic: Resurrection,Dennis Gansel,Jason Statham,Jessica Alba,Tommy Lee Jones,Action Crime Thriller,"Arthur Bishop thought he had put his murderous past behind him when his most formidable foe kidnaps the love of his life. Now he is forced to travel the globe to complete three impossible assassinations, and do what he does best, make them look like accidents.",5.7,91132,2016
300669,Don't Breathe,Fede Alvarez,Jane Levy,Dylan Minnette,Daniel Zovatto,Thriller Horror,A group of teens break into a blind man's home thinking they'll get away with the perfect crime. They're wrong.,7.1,293936,2016
184341,Hands of Stone,Jonathan Jakubowicz,Edgar Ramirez,Robert De Niro,Usher Raymond,Drama,The legendary Roberto Duran and his equally legendary trainer Ray Arcel change each other's lives.,6.6,17306,2016
294795,The 9th Life of Louis Drax,Alexandre Aja,Jamie Dornan,Sarah Gadon,Aiden Longworth,Fantasy Mystery Thriller Drama,A psychologist who begins working with a young boy who has suffered a near-fatal fall finds himself drawn into a mystery that tests the boundaries of fantasy and reality.,6.3,15046,2016
283552,The Light Between Oceans,Derek Cianfrance,Michael Fassbender,Alicia Vikander,Rachel Weisz,Drama Romance,A lighthouse keeper and his wife living off the coast of Western Australia raise a baby they rescue from an adrift rowboat.,7.2,59451,2016
377264,Morgan,Luke Scott,Kate Mara,Anya Taylor-Joy,Toby Jones,Horror Sci-Fi Thriller,A corporate risk-management consultant must determine whether or not to terminate an artificial being's life that was made in a laboratory environment.,5.8,45668,2016
363676,Sully,Clint Eastwood,Tom Hanks,Aaron Eckhart,Laura Linney,Drama History,"On 15 January 2009, the world witnessed the 'Miracle on the Hudson' when Captain 'Sully' Sullenberger glided his disabled plane onto the Hudson River, saving the lives of all 155 souls aboard. However, even as Sully was being heralded by the public and the media for his unprecedented feat of aviation skill, an investigation was unfolding that threatened to destroy his reputation and career.",7.4,291918,2016
335791,When the Bough Breaks,Jon Cassar,Morris Chestnut,Regina Hall,Jaz Sinclair,Mystery Thriller Drama Horror,A surrogate mother harbors a deadly secret desire for a family of her own with the husband who is expecting to raise her child.,5.2,7681,2016
293452,The Disappointments Room,D. J. Caruso,Kate Beckinsale,Mel Raido,Gerald McRaney,Horror Thriller,A mother and her young son release unimaginable horrors from the attic of their rural dream home.,3.9,10329,2016
95610,Bridget Jones's Baby,Sharon Maguire,Renee Zellweger,Colin Firth,Patrick Dempsey,Comedy Romance,"After breaking up with Mark Darcy, Bridget Jones's 'happily ever after' hasn't quite gone according to plan. Fortysomething and single again, she decides to focus on her job as top news producer and surround herself with old friends and new. For once, Bridget has everything completely under control. What could possibly go wrong? Then her love life takes a turn and Bridget meets a dashing American named Jack, the suitor who is everything Mr. Darcy is not. In an unlikely twist she finds herself pregnant, but with one hitch she can only be fifty percent sure of the identity of her baby's father.",6.5,80613,2016
302401,Snowden,Oliver Stone,Joseph Gordon-Levitt,Shailene Woodley,Melissa Leo,Drama History Crime Thriller,CIA employee Edward Snowden leaks thousands of classified documents to the press.,7.3,159994,2016
351211,Blair Witch,Adam Wingard,James Allen McCune,Callie Hernandez,Brandon Scott,Thriller Horror,Students on a camping trip discover something sinister is lurking beyond the trees.,5,48819,2016
318226,Hillsong: Let Hope Rise,Michael John Warren,Joel Houston,Brian Houston,Taya Smith,Documentary Music,"Chronicles the unlikely rise to prominence of the Australia-based Christian band, Hillsong United.",6.1,900,2016
333484,The Magnificent Seven,Antoine Fuqua,Denzel Washington,Chris Pratt,Ethan Hawke,Adventure Action Western,"Looking to mine for gold, greedy industrialist Bartholomew Bogue seizes control of the Old West town of Rose Creek. With their lives in jeopardy, Emma Cullen and other desperate residents turn to bounty hunter Sam Chisolm for help. Chisolm recruits an eclectic group of gunslingers to take on Bogue and his ruthless henchmen. With a deadly showdown on the horizon, the seven mercenaries soon find themselves fighting for more than just money once the bullets start to fly.",6.9,224681,2016
332210,Storks,Nicholas Stoller,Andy Samberg,Katie Crown,Kelsey Grammer,Adventure Animation Comedy Family,"Storks deliver babies√É¬¢√Ç¬Ä√Ç¬¶or at least they used to. Now they deliver packages for a global internet retail giant. Junior, the company√É¬¢√Ç¬Ä√Ç¬ôs top delivery stork, is about to be promoted when he accidentally activates the Baby Making Machine, producing an adorable and wholly unauthorized baby girl...",6.8,66294,2016
283366,Miss Peregrine's Home for Peculiar Children,Tim Burton,Eva Green,Asa Butterfield,Chris O'Dowd,Fantasy Adventure,A teenager finds himself transported to an island where he must help protect a group of orphans with special powers from creatures intent on destroying them.,6.7,184224,2016
296524,Deepwater Horizon,Peter Berg,Mark Wahlberg,Kurt Russell,John Malkovich,Drama Action,"A story set on the offshore drilling rig Deepwater Horizon, which exploded during April 2010 and created the worst oil spill in U.S. history.",7.1,177984,2016
317557,Queen of Katwe,Mira Nair,Madina Nalwanga,David Oyelowo,Lupita Nyong'o,Drama,A young girl overcomes her disadvantaged upbringing in the slums of Uganda to become a Chess master.,7.4,18393,2016
213681,Masterminds,Jared Hess,Zach Galifianakis,Owen Wilson,Kristen Wiig,Action Comedy Crime,A night guard at an armored car company in the Southern U.S. organizes one of the biggest bank heists in American history.,5.8,58189,2016
346685,The Girl on the Train,Tate Taylor,Emily Blunt,Rebecca Ferguson,Haley Bennett,Thriller Mystery Drama Crime,"Rachel Watson, devastated by her recent divorce, spends her daily commute fantasizing about the seemingly perfect couple who live in a house that her train passes every day, until one morning she sees something shocking happen there and becomes entangled in the mystery that unfolds.",6.5,196452,2016
339408,The Birth of a Nation,Nate Parker,Nate Parker,Armie Hammer,Colman Domingo,Drama,"Nat Turner, a former slave in America, leads a liberation movement in 1831 to free African-Americans in Virginia that results in a violent retaliation from whites.",6.5,21667,2016
369883,Middle School: The Worst Years of My Life,Steve Carr,Griffin Gluck,Lauren Graham,Rob Riggle,Family Comedy,A quiet teenage artist Rafe Katchadorian has a wild imagination and is sick of middle school and the rules that have been put before him. Rafe and his best friend Leo have come up with a plan: break every rule in the school hand book and as you expect trouble follows.,6.1,9784,2016
302946,The Accountant,Gavin O'Connor,Ben Affleck,Anna Kendrick,J. K. Simmons,Crime Thriller Drama,"As a math savant uncooks the books for a new client, the Treasury Department closes in on his activities and the body count starts to rise.",7.3,312612,2016
339927,Kevin Hart: What Now?,Leslie Small,Kevin Hart,Halle Berry,Don Cheadle,Comedy,"Comedian Kevin Hart performs in front of a crowd of 50,000 people at Philadelphia's outdoor venue, Lincoln Financial Field.",5.9,9850,2016
286567,Max Steel,Stewart Hendler,Ben Winchell,Maria Bello,Ana Villafabe,Action Adventure Sci-Fi,"The adventures of teenager Max McGrath and alien companion Steel, who must harness and combine their tremendous new powers to evolve into the turbo-charged superhero Max Steel.",4.6,20378,2016
343611,Jack Reacher: Never Go Back,Edward Zwick,Tom Cruise,Cobbie Smulders,Aldis Hodge,Action Thriller,"When Major Susan Turner is arrested for treason, ex-investigator Jack Reacher undertakes the challenging task to prove her innocence and ends up exposing a shocking conspiracy.",6.1,170622,2016
331313,Keeping Up with the Joneses,Greg Mottola,Zach Galifianakis,Jon Hamm,Isla Fisher,Action Comedy,An ordinary suburban couple finds it√É¬¢√Ç¬Ä√Ç¬ôs not easy keeping up with the Joneses √É¬¢√Ç¬Ä√Ç¬ì their impossibly gorgeous and ultra-sophisticated new neighbors √É¬¢√Ç¬Ä√Ç¬ì especially when they discover that Mr. and Mrs. √É¬¢√Ç¬Ä√Ç¬úJones√É¬¢√Ç¬Ä√Ç¬ù are covert operatives.,5.9,66371,2016
335796,Ouija: Origin of Evil,Mike Flanagan,Elizabeth Reaser,Annalise Basso,Lulu Wilson,Horror,"In 1965 Los Angeles, a widowed mother and her two daughters add a new stunt to bolster their s√É¬É√Ç¬©ance scam business and unwittingly invite authentic evil into their home. When the youngest daughter is overtaken by the merciless spirit, this small family confronts unthinkable fears to save her and send her possessor back to the other side.",6.2,71668,2016
380124,Boo! A Madea Halloween,Tyler Perry,Tyler Perry,Cassi Davis,Patrice Lovely,Comedy Horror,"Madea winds up in the middle of mayhem when she spends a hilarious, haunted Halloween fending off killers, paranormal poltergeists, ghosts, ghouls, and zombies while keeping a watchful eye on a group of misbehaving teens.",4.6,9149,2016
409502,I'm Not Ashamed,Brian Baugh,Masey McLain,Ben Davies,Sadie Robertson,Drama,"Based on the inspiring and powerful true story and journal entries of Rachel Joy Scott, the first student killed in the Columbine High School shooting in 1999.",5.8,4088,2016
