Movie_id,Title,Director,Actor1,Actor2,Actor3,Genre,Overview,Ratings,Votes,Year
807172,The Believer,Shan Serafin,Aidan Bristow,Sophie Kargman,Susan Wilder,Horror,"When his daughter, Angela, and her friend Katherine, show signs of demonic possession, it unleashes a chain of events that forces single father Victor Fielding to confront the nadir of evil. Terrified and desperate, he seeks out Chris MacNeil, the only person alive who's witnessed anything like it before.",3.9,448,2021
786584,Dawn of the Beast,Bruce Wemple,Francesca Anderson,Adrian Burke,Chris Cimperman,Horror Thriller,"Aiming to find the Bigfoot, a group of graduate students venture deep into an area of the Northeastern wilderness known for its strange creature sightings. Soon, they learn that there is a much more sinister evil lurking in the woods, the Wendigo, and once the spirit knows you√É¬¢√Ç¬Ä√Ç¬ôre there, they will come for you. Who will survive in a battle between the two most notorious monsters of the forest?",4.1,966,2021
597890,Voyagers,Neil Burger,Tye Sheridan,Lily-Rose Depp,Fionn Whitehead,Sci-Fi Thriller,"With the future of the human race at stake, a group of young men and women -- bred for intelligence and obedience -- embark on an expedition to colonize a distant planet. When they uncover disturbing secrets about the mission, they defy their training and begin to explore their most primitive natures. As life on the ship descends into chaos, they soon become consumed by fear, lust and an insatiable hunger for power.",5.4,25191,2021
615678,Thunder Force,Ben Falcone,Melissa McCarthy,Octavia Spencer,Bobby Cannavale,Action Adventure Comedy Sci-Fi,"In a world where supervillains are commonplace, two estranged childhood best friends reunite after one devises a treatment that gives them powers to protect their city.",4.5,44823,2021
763568,Arlo the Alligator Boy,Ryan Crego,Michael J. Woodard,Mary Lambert,Haley Tju,Animation Comedy Family,"Upon learning that he is from New York City, a wide-eyed boy, who is half human and half alligator, decides to leave his sheltered life in the swamp and search for his long lost father. A musical adventure.",6.4,1225,2021
550524,Monday,Argyris Papadimitropoulos,Sebastian Stan,Denise Gough,Yorgos Pirpassopoulos,Drama Romance,"A spark on a Friday can lead to a sizzling weekend fling, but what happens when you get to the inevitable Monday?",5.7,5493,2021
748853,In the Earth,Ben Wheatley,Joel Fry,Reece Shearsmith,Hayley Squires,Horror Sci-Fi Thriller,"As a deadly virus ravages the world, Dr. Martin Lowery embarks on a mission to reach test site ATU327A, a research hub deep in the Arboreal Forest. The arduous journey, guided by park scout Alma, is set back by a nighttime attack that leaves the two bruised and shoeless. When they run into Zach, a man living off the grid, they gratefully accept his help. Zach√É¬¢√Ç¬Ä√Ç¬ôs intentions aren√É¬¢√Ç¬Ä√Ç¬ôt exactly what they seem, however, and a path out of the forest and into safety quickly fades as the line between myth and science blurs.",5.1,11140,2021
999205,Stowaway,Joe Penna,Anna Kendrick,Daniel Dae Kim,Shamier Anderson,Thriller,"A tenacious party girl fights to survive after three thieves commandeer her luxury yacht. Unable to escape and trapped on the yacht at high seas, the prey becomes the hunter as she turns the tables on the intruders and takes matters into her own hands.",5.7,50513,2021
1034062,Mortal Kombat,Simon McQuoid,Lewis Tan,Jessica McNamee,Josh Lawson,Animation Action Fantasy,"In 1980s Hollywood, action star Johnny Cage is looking to become an A-list actor. But when his costar, Jennifer, goes missing from set, Johnny finds himself thrust into a world filled with shadows, danger, and deceit. As he embarks on a bloody journey, Johnny quickly discovers the City of Angels has more than a few devils in its midst.",6,186728,2021
804435,Vanquish,George Gallo,Ruby Rose,Morgan Freeman,Patrick Muldoon,Action Crime Thriller,"Victoria is a young mother trying to put her dark past as a Russian drug courier behind her, but retired cop Damon forces Victoria to do his bidding by holding her daughter hostage. Now, Victoria must use guns, guts and a motorcycle to take out a series of violent gangsters√É¬¢√Ç¬Ä√Ç¬îor she may never see her child again.",3,5176,2021
901362,Together Together,Nikole Beckwith,Ed Helms,Patti Harrison,Rosalind Chao,Animation Family Music Fantasy Comedy,"When Branch√É¬¢√Ç¬Ä√Ç¬ôs brother, Floyd, is kidnapped for his musical talents by a pair of nefarious pop-star villains, Branch and Poppy embark on a harrowing and emotional journey to reunite the other brothers and rescue Floyd from a fate even worse than pop-culture obscurity.",6.4,9041,2021
680319,We Broke Up,Jeff Rosenberg,William Jackson Harper,Aya Cash,Sarah Bolger,Romance Comedy,Lori and Doug break up right before Lori's sister's wedding and decide to pretend they're still together for the weekend as to not disrupt the fun.,5.1,1364,2021
893712,The Deep Ones,Chad Ferrin,Gina La Piana,Robert Miano,Johann Urb,Animation Action Fantasy Sci-Fi,"Over a month has passed since 10,000 users were trapped inside the ""Sword Art Online"" world. Asuna, who cleared the first floor of the floating iron castle of Aincrad, joined up with Kirito and continued her journey to reach the top floor. With the support of female Information Broker Argo, clearing the floors seemed to be progressing smoothly, but conflict erupts between two major guilds who should be working together √É¬¢√Ç¬Ä√Ç¬ì the top player groups ALS (the Aincrad Liberation Squad) and DKB (the Dragon Knights Brigade). And meanwhile, behind the scenes exists a mysterious figure pulling the strings√É¬¢√Ç¬Ä√Ç¬¶",4,873,2021
631060,Things Heard & Seen,Robert Pulcini,Amanda Seyfried,James Norton,Natalia Dyer,Horror,"Catherine Clare reluctantly trades life in 1980 Manhattan for a remote home in the tiny hamlet of Chosen, New York, after her husband George lands a job teaching art history at a small Hudson Valley college. Even as she does her best to transform the old dairy farm into a place where young daughter Franny will be happy, Catherine increasingly finds herself isolated and alone. She soon comes to sense a sinister darkness lurking both in the walls of the ramshackle property√É¬¢√Ç¬Ä√Ç¬îand in her marriage to George.",5.3,35244,2021
501929,The Mitchells vs. the Machines,Mike Rianda,Abbi Jacobson,Danny McBride,Maya Rudolph,Animation Adventure Comedy,"A quirky, dysfunctional family's road trip is upended when they find themselves in the middle of the robot apocalypse and suddenly become humanity's unlikeliest last hope.",7.6,122107,2021
567189,Without Remorse,Stefano Sollima,Michael B. Jordan,Jamie Bell,Jodie Turner-Smith,Adventure Action Thriller War,An elite Navy SEAL uncovers an international conspiracy while seeking justice for the murder of his pregnant wife.,5.8,62986,2021
808023,The Virtuoso,Nick Stagliano,Anson Mount,Abbie Cornish,Eddie Marsan,Thriller Crime,A lonesome stranger with nerves of steel must track down and kill a rogue hitman to satisfy an outstanding debt. But the only information he's been given is a time and location where to find his quarry. No name. No description. Nothing.,5,8920,2021
641960,Four Good Days,Rodrigo Garc√É¬≠a,Glenn Close,Mila Kunis,Stephen Root,Drama,A mother helps her daughter work through four crucial days of recovery from substance abuse.,6.6,11545,2021
760195,Separation,William Brent Bell,Rupert Friend,Mamie Gummer,Violet McGraw,Horror Drama,A young girl finds solace in her artist father and the ghost of her dead mother.,4.7,5201,2021
810271,The Resort,Taylor Chien,Brock O'Hurn,Avery Pascual,Michael Vlamis,Horror,"Four friends head to Hawaii to investigate reports of a haunting at an abandoned resort in hopes of finding the infamous Half-Faced Girl. When they arrive, they soon learn you should be careful what you wish for.",3.1,3781,2021
637649,Wrath of Man,Guy Ritchie,Jason Statham,Holt McCallany,Jeffrey Donovan,Crime Thriller Action,"A cold and mysterious new security guard for a Los Angeles cash truck company surprises his co-workers when he unleashes precision skills during a heist. The crew is left wondering who he is and where he came from. Soon, the marksman's ultimate motive becomes clear as he takes dramatic and irrevocable steps to settle a score.",7.1,199695,2021
504,Monster,Anthony Mandler,Kelvin Harrison Jr.,Jennifer Ehle,Tim Blake Nelson,Crime Drama,"An emotionally scarred highway drifter shoots a sadistic trick who rapes her, and ultimately becomes the United States' first female serial killer.",4.4,3003,2021
731738,The Paper Tigers,Tran Quoc Bao,Alain Uy,Ron Yuan,Mykel Shannon Jenkins,Action Comedy,Three middle aged men polish their martial arts skills to avenge their fallen master.,6.3,5122,2021
557950,Mainstream,Gia Coppola,Andrew Garfield,Maya Hawke,Nat Wolff,Comedy Drama,A young woman thinks she√É¬¢√Ç¬Ä√Ç¬ôs found a path to internet stardom when she starts making YouTube videos with a charismatic stranger  √É¬¢√Ç¬Ä√Ç¬ì until the dark side of viral celebrity threatens to ruin them both.,5,5179,2021
346687,The Water Man,David Oyelowo,David Oyelowo,Rosario Dawson,Lonnie Chavis,Adventure,"Hoping to save his sick mother, a boy named Gunner and his friend Jo venture into the remote Wild Horse forest to search for a mythical figure who possesses the secret to immortality. When they go missing, Gunner's father Amos must immerse himself in his son's world to find them.",5.6,4500,2021
711475,Here Today,Billy Crystal,Billy Crystal,Tiffany Haddish,Penn Badgley,Comedy Drama,"Veteran comedy writer Charlie Berns, who is slowly but surely losing his grip on reality, befriends a talented young New York street singer Emma Payge. Together, they form an unlikely yet hilarious and touching friendship that kicks the generation gap aside and redefines the meaning of love and trust.",6.7,5694,2021
329269,Above Suspicion,Phillip Noyce,Jack Huston,Emilia Clarke,Thora Birch,Thriller Drama TV Movie,A fugitive from justice may also be a killer.,5.7,8175,2021
750600,Reboot Camp,Ivo Raza,David Koechner,Ed Begley Jr.,Chaz Bono,Comedy,"After finding out that his wife has blown their life savings on self-help gurus, Seymour teams up with his brother Danny, a filmmaker, to document how easy it is to start a fake self-help group and con people into believing just about anything. But once started, the Reboot Camp takes on a life of its own, and grows into a full-blown cult.",4.5,1871,2021
647302,Benny Loves You,Karl Holt,Karl Holt,Claire Cartwright,David Wayman,Horror Comedy,"Jack, a man desperate to improve his life, throws away his beloved childhood plush, Benny. It√É¬¢√Ç¬Ä√Ç¬ôs a move that has disastrous consequences when Benny springs to life with deadly intentions!",5.6,2928,2021
18561,Oxygen,Alexandre Aja,MÈlanie Laurent,Mathieu Amalric,Malik Zidi,Crime Drama Mystery Thriller,"When housewife Frances Hannon is abducted and buried alive, detective Madeline Foster is brought in. With only 24 hours before Frances' oxygen runs out, Madeline pursues the trail laid by a killer calling himself Harry Houdini. After capturing him, Madeline brings Harry back to the police station, but is unable to get him to confess where Frances is buried. As time runs down, Harry gets inside the head of unstable, alcoholic Madeline.",6.5,43028,2021
503736,Army of the Dead,Zack Snyder,Dave Bautista,Ella Purnell,Omari Hardwick,Action Crime Drama Horror Sci-Fi Thriller Fantasy,"Following a zombie outbreak in Las Vegas, a group of mercenaries take the ultimate gamble: venturing into the quarantine zone to pull off the greatest heist ever attempted.",5.8,183074,2021
578701,Those Who Wish Me Dead,Taylor Sheridan,Angelina Jolie,Nicholas Hoult,Finn Little,Thriller Action,"A young boy finds himself pursued by two assassins in the Montana wilderness, with a survival expert determined to protect him, and a forest fire threatening to consume them all.",6,69078,2021
17136,The Woman in the Window,Joe Wright,Amy Adams,Gary Oldman,Anthony Mackie,Thriller Crime Drama,A seductive woman gets an innocent professor mixed up in murder.,5.7,80932,2021
614199,Spiral,Darren Lynn Bousman,Chris Rock,Max Minghella,Marisol Nichols,Horror Mystery Thriller,"A same-sex couple move to a small town so they can enjoy a better quality of life and raise their 16 year-old daughter with the best social values. But nothing is as it seems in their picturesque neighbourhood. And when Malik sees the folks next door throwing a very strange party, something very shocking has got to give.",5.2,65567,2021
339395,Georgetown,Christoph Waltz,Christoph Waltz,Vanessa Redgrave,Annette Bening,Crime Drama,"Ulrich Mott  is an eccentric and versatile social climber with grandiose plans to affect United States foreign policy. Encouraged  in his attempts by his strategically chosen (and much older) wife, the well-connected journalist Elsa Brecht, Mott has a knack for making himself indispensable and impossible to ignore. The only one seemingly immune to his charms is Elsa's daughter Amanda, who might simply disapprove of her mother marrying a much younger man - or perhaps she senses something more sinister beneath the smooth-talking surface?",6.2,5947,2021
769749,Finding You,Brian Baugh,Rose Reid,Jedidiah Goodacre,Katherine McNamara,Romance Drama,"Finley, a talented aspiring violinist, meets Beckett, a famous young movie star, on the way to her college semester abroad program in a small coastal village in Ireland. An unexpected romance emerges as the heartthrob Beckett leads the uptight Finley on an adventurous reawakening, and she emboldens him to take charge of his future, until the pressures of his stardom get in the way.",6.4,8044,2021
653712,The Killing of Two Lovers,Robert Machoian,Clayne Crawford,Sepideh Moafi,Chris Coy,Drama Thriller,David desperately tries to keep his family of six together during a separation from his wife. They both agree to see other people but David struggles to grapple with his wife√É¬¢√Ç¬Ä√Ç¬ôs new relationship.,6.8,5088,2021
738057,616 Wilford Lane,Dante Yore,John Littlefield,Eric Roberts,Alyson Gorske,Horror Action,A grieving man relocates his two teen daughters to a charming town and into their dream home. Quickly the dream becomes an inescapable nightmare.,4.2,611,2021
603206,Dream Horse,Euros Lyn,Toni Collette,Damian Lewis,Owen Teale,Comedy Drama,"The inspiring true story of Dream Alliance, an unlikely race horse bred by small town bartender, Jan Vokes. With very little money and no experience, Jan convinces her neighbors to chip in their meager earnings to help raise Dream and compete with the racing elites. Their investment pays off as Dream rises through the ranks and becomes a beacon of hope in their struggling community.",6.9,6680,2021
809929,Aquarium of the Dead,Glenn Miller,Vivica A. Fox,Eva Ceja,D. C. Douglas,Horror Action,A scientific mishap causes the species of an aquarium to become zombies.,2.9,1078,2021
653659,Blast Beat,Esteban Arango,MoisÈs Arias,Mateo Arias,Daniel Dae Kim,Drama,"After their family emigrates from Colombia during the summer of √É¬¢√Ç¬Ä√Ç¬ò99, a metalhead science prodigy and his deviant younger brother do their best to adapt to new lives in America.",5.2,307,2021
520763,A Quiet Place Part II,John Krasinski,Emily Blunt,Cillian Murphy,Millicent Simmonds,Sci-Fi Thriller Horror,"Following the events at home, the Abbott family now face the terrors of the outside world. Forced to venture into the unknown, they realize that the creatures that hunt by sound are not the only threats that lurk beyond the sand path.",7.2,263597,2021
337404,Cruella,Craig Gillespie,Emma Stone,Emma Thompson,Joel Fry,Comedy Crime,"In 1970s London amidst the punk rock revolution, a young grifter named Estella is determined to make a name for herself with her designs. She befriends a pair of young thieves who appreciate her appetite for mischief, and together they are able to build a life for themselves on the London streets. One day, Estella√É¬¢√Ç¬Ä√Ç¬ôs flair for fashion catches the eye of the Baroness von Hellman, a fashion legend who is devastatingly chic and terrifyingly haute. But their relationship sets in motion a course of events and revelations that will cause Estella to embrace her wicked side and become the raucous, fashionable and revenge-bent Cruella.",7.3,256829,2021
441542,Plan B,Natalie Morales,Kuhoo Verma,Victoria Moroles,Michael Provost,Action Comedy,"When three young martial artists embark on a relentless treasure hunt in order to free their friend from the grasp of a ruthless gangster, they get entangled in a complex conspiracy staged to dethrone Berlin's underworld kingpin.",6.7,4510,2021
597593,Changing the Game,Michael Barnett,Mack Beggs,Sarah Rose Huckman,Terry Miller,Documentary,"Transgender high school athletes from across the country compete at the top of their fields, while also challenging the boundaries and perceptions of fairness and discrimination.",6.4,280,2021
637693,Spirit Untamed,Elaine Bogan,Isabela Merced,Marsai Martin,Mckenna Grace,Animation Adventure Family Western,Lucky Prescott's life is changed forever when she moves from her home in the city to a small frontier town and befriends a wild mustang named Spirit.,5.5,4503,2021
423108,The Conjuring: The Devil Made Me Do It,Michael Chaves,Patrick Wilson,Vera Farmiga,Ruairi O'Connor,Horror Mystery Thriller,"Paranormal investigators Ed and Lorraine Warren encounter what would become one of the most sensational cases from their files. The fight for the soul of a young boy takes them beyond anything they'd ever seen before, to mark the first time in U.S. history that a murder suspect would claim demonic possession as a defense.",6.3,134319,2021
514995,Gully,Nabil Elderkin,Jacob Latimore,Charlie Plummer,Jonathan Majors,Drama Crime,"A slightly dystopian vision of LA, we follow three disaffected teenagers, Jessie, Calvin and Nicky, all victims of extreme childhoods, running supreme hedonistic riot as they try to work out a way in life.",5.7,528,2021
522406,Flashback,Christopher MacBride,Dylan O'Brien,Maika Monroe,Hannah Gross,Thriller,"Frederick Fitzell is living his best life√É¬¢√Ç¬Ä√Ç¬îuntil he starts having horrific visions of Cindy, a girl who vanished in high school. After reaching out to old friends with whom he used to take a mystery drug called Mercury, Fredrick realizes the only way to stop the visions lies deep within his own memories, so he embarks on a terrifying mental odyssey to learn the truth.",6.1,845,2021
813858,Under the Stadium Lights,Todd Randall,Milo Gibson,Laurence Fishburne,Glenn Morshower,Drama,"After a crushing defeat ended their prior season, everyone counted the Abilene Eagles out of title contention. Facing doubts and personal challenges both on and off the field, it takes the guidance of their team chaplain and a surrogate father figure for the players to realize what they can achieve when they stand united.",3.9,464,2021
347616,Grace and Grit,Sebastian Siegel,Mena Suvari,Stuart Townsend,Frances Fisher,Drama Comedy Romance,The true love story of iconic philosopher Ken Wilber and his wife Treya in 1980s California as they fall madly in love and are faced with illness and challenges that threaten to tear them apart.,5.1,362,2021
615658,Awake,Mark Raso,Gina Rodriguez,Jennifer Jason Leigh,Barry Pepper,Drama Sci-Fi Thriller,"After a sudden global event wipes out all electronics and takes away humankind√É¬¢√Ç¬Ä√Ç¬ôs ability to sleep, chaos quickly begins to consume the world. Only Jill, an ex-soldier with a troubled past, may hold the key to a cure in the form of her own daughter. The question is, can Jill safely deliver her daughter and save the world before she herself loses her mind.",4.9,25133,2021
581726,Infinite,Antoine Fuqua,Mark Wahlberg,Chiwetel Ejiofor,Sophie Cookson,Sci-Fi Action Thriller,"Evan McCauley has skills he never learned and memories of places he has never visited. Self-medicated and on the brink of a mental breakdown, a secret group that call themselves √É¬¢√Ç¬Ä√Ç¬úInfinites√É¬¢√Ç¬Ä√Ç¬ù come to his rescue, revealing that his memories are real.",5.5,59104,2021
522478,Peter Rabbit 2: The Runaway,Will Gluck,James Corden,Rose Byrne,Domhnall Gleeson,Family Comedy Adventure Animation Fantasy,"Peter Rabbit runs away from his human family when he learns they are going to portray him in a bad light in their book. Soon, he crosses paths with an older rabbit who ropes him into a heist.",6.2,13960,2021
467909,In the Heights,Jon M. Chu,Anthony Ramos,Corey Hawkins,Leslie Grace,Drama Romance,"The story of Usnavi, a bodega owner who has mixed feelings about closing his store and retiring to the Dominican Republic or staying in Washington Heights.",7.3,51098,2021
550205,Wish Dragon,Chris Appelhans,Jimmy Wong,John Cho,Constance Wu,Animation Family Comedy Fantasy,Determined teen Din is longing to reconnect with his childhood best friend when he meets a wish-granting dragon who shows him the magic of possibilities.,7.2,32151,2021
581644,The Misfits,Renny Harlin,Pierce Brosnan,Rami Jaber,Hermione Corfield,Action Thriller,"After being recruited by a group of unconventional thieves, renowned criminal Richard Pace finds himself caught up in an elaborate gold heist that promises to have far-reaching implications on his life and the lives of countless others.",4.4,12718,2021
625169,12 Mighty Orphans,Ty Roberts,Luke Wilson,Vinessa Shaw,Wayne Knight,History Drama Action,"Haunted by his mysterious past, a devoted high school football coach leads a scrawny team of orphans to the state championship during the Great Depression and inspires a broken nation along the way.",6.9,8005,2021
583116,The House Next Door: Meet the Blacks 2,Deon Taylor,Mike Epps,Katt Williams,Bresha Webb,Comedy Horror,"Bestselling author Carl Black moves his family back to his childhood home, he must team up with oddball neighbors to do battle with a pimp, who may or may not be an actual vampire.",4,2111,2021
553592,Queen Bees,Michael Lembeck,Ellen Burstyn,James Caan,Ann-Margret,Romance Comedy,Helen is an independent widow who moves into the Pine Grove Senior Community and discovers it√É¬¢√Ç¬Ä√Ç¬ôs just like high school √É¬¢√Ç¬Ä√Ç¬ì full of cliques and flirtatious suitors. What she initially avoids leads her to exactly what she has been missing: new friendships and a chance at love again with newcomer Dan.,6.2,2655,2021
839017,DOMINO: Battle of the Bones,Baron Davis,David Arquette,Snoop Dogg,Tom Lister Jr.,Comedy,"Hoping to reclaim his former glory, a fallen dominoes champion recruits his step grandson to help him win an off-the-wall tournament.",3.8,316,2021
522931,Hitman's Wife's Bodyguard,Patrick Hughes,Ryan Reynolds,Samuel L. Jackson,Salma Hayek,Action Comedy Crime Thriller,"The world√É¬¢√Ç¬Ä√Ç¬ôs most lethal odd couple √É¬¢√Ç¬Ä√Ç¬ì bodyguard Michael Bryce and hitman Darius Kincaid √É¬¢√Ç¬Ä√Ç¬ì are back on another life-threatening mission. Still unlicensed and under scrutiny, Bryce is forced into action by Darius's even more volatile wife, the infamous international con artist Sonia Kincaid. As Bryce is driven over the edge by his two most dangerous protectees, the trio get in over their heads in a global plot and soon find that they are all that stand between Europe and a vengeful and powerful madman.",6.1,104575,2021
508943,Luca,Enrico Casarosa,Jacob Tremblay,Jack Dylan Grazer,Emma Berman,Animation Comedy Fantasy Adventure Family,Luca and his best friend Alberto experience an unforgettable summer on the Italian Riviera. But all the fun is threatened by a deeply-held secret: they are sea monsters from another world just below the water√É¬¢√Ç¬Ä√Ç¬ôs surface.,7.4,184876,2021
607259,Fatherhood,Paul Weitz,Kevin Hart,Alfre Woodard,Lil Rel Howery,Drama Comedy,"A widowed new dad copes with doubts, fears, heartache and dirty diapers as he sets out to raise his daughter on his own. Inspired by a true story.",6.6,41543,2021
624481,The Birthday Cake,Jimmy Giannopoulos,Shiloh Fernandez,Val Kilmer,Ewan McGregor,Crime Thriller,"On the 10th anniversary of his father's death, Giovanni reluctantly accepts the task of bringing a cake to the home of his uncle, a mob boss, for a celebration. Just two hours into the night, Gio's life is forever changed.",4.4,1847,2021
776526,Rita Moreno: Just a Girl Who Decided to Go for It,Mariem PÈrez Riera,Rita Moreno,Eva Longoria,George Chakiris,Documentary,"Rita Moreno defied both her humble upbringing and relentless racism to become one of a select group who have won an Emmy, Grammy, Oscar and Tony Award. Over a seventy year career, she has paved the way for Hispanic-American performers by refusing to be pigeonholed into one-dimensional stereotypes.",7.7,991,2021
776485,The Sparks Brothers,Edgar Wright,Ron Mael,Ron Mael,Russell Mael,Documentary Music,"Take a musical odyssey through five weird and wonderful decades with brothers Ron & Russell Mael, celebrating the inspiring legacy of Sparks: your favorite band√É¬¢√Ç¬Ä√Ç¬ôs favorite band.",7.8,5839,2021
37165,Truman & Tennessee: An Intimate Conversation,Lisa Immordino Vreeland,Jim Parsons,Trum Capote,Tennessee Williamson,Comedy Drama,"Truman Burbank is the star of The Truman Show, a 24-hour-a-day reality TV show that broadcasts every aspect of his life without his knowledge. His entire life has been an unending soap opera for consumption by the rest of the world. And everyone he knows, including his wife and his best friend, is really an actor, paid to be part of his life.",7.2,204,2021
