Movie_id,Title,Director,Actor1,Actor2,Actor3,Genre,Overview,Ratings,Votes,Year
412302,Gemini,Aaron Katz,Lola Kirke,ZoÎ Kravitz,Greta Lee,Mystery Crime Drama Thriller,"A heinous crime tests the complex relationship between a tenacious personal assistant and her Hollywood starlet boss. As the assistant travels across Los Angeles to unravel the mystery, she must stay one step ahead of a determined policeman and confront her own understanding of friendship, truth and celebrity.",7.7,8,2018
451204,The Last Movie Star,Adam Rifkin,Burt Reynolds,Ariel Winter,Clark Duke,Drama,"An aging screen icon gets lured into accepting an award at a rinky-dink film festival in Nashville, Tenn., sending him on a hilarious fish-out-of-water adventure and an unexpectedly poignant journey into his past.",7,4813,2018
447332,A Quiet Place,John Krasinski,John Krasinski,Emily Blunt,Millicent Simmonds,Horror Drama Sci-Fi,A family is forced to live in silence while hiding from creatures that hunt by sound.,7.5,568363,2018
437557,Blockers,Kay Cannon,Leslie Mann,Ike Barinholtz,John Cena,Comedy,"When three parents discover that each of their daughters have a pact to lose their virginity at prom, they launch a covert one-night operation to stop the teens from sealing the deal.",6.2,83892,2018
398181,You Were Never Really Here,Lynne Ramsay,Joaquin Phoenix,Ekaterina Samsonov,Alex Manette,Crime Drama Thriller,"A traumatised veteran, unafraid of violence, tracks down missing girls for a living. When a job spins out of control, his nightmares overtake him as a conspiracy is uncovered leading to what may be his death trip or his awakening.",6.7,125796,2018
432301,Chappaquiddick,John Curran,Jason Clarke,Kate Mara,Ed Helms,History Drama Thriller,"Ted Kennedy's life and political career become derailed in the aftermath of a fatal car accident in 1969 that claims the life of a young campaign strategist, Mary Jo Kopechne.",6.4,14365,2018
497802,Pandas,David Douglas,Kristen Bell,Wen Lei Bi,Rong Hou,Documentary Family Adventure,"In the mountains of Sichuan, China, a researcher forms a bond with Qian Qian, a panda who is about to experience nature for the first time.",7.3,733,2018
407890,Lean on Pete,Andrew Haigh,Charlie Plummer,ChloÎ Sevigny,Travis Fimmel,Drama Adventure,"Charley Thompson, a teenager living with his single father, gets a summer job working for horse trainer Del Montgomery. Bonding with an aging racehorse named Lean on Pete, Charley is horrified to learn he is bound for slaughter, and so he steals the horse, and the duo embark on an odyssey across the new American frontier.",7.2,13595,2018
425373,The Miracle Season,Sean McNamara,Helen Hunt,William Hurt,Erin Moriarty,Drama,"After the tragic death of star volleyball player Caroline ""Line"" Found, a team of dispirited high school girls must band together under the guidance of their tough-love coach in hopes of winning the state championship!",6.5,6132,2018
399248,Beirut,Brad Anderson,Jon Hamm,Rosamund Pike,Dean Norris,Action Thriller Drama,"In 1980s Beirut, Mason Skiles is a former U.S. diplomat who is called back into service to save a colleague from the group that is possibly responsible for his own family's death. Meanwhile, a CIA field agent who is working under cover at the American embassy is tasked with keeping Mason alive and ensuring that the mission is a success.",6.5,24196,2018
427641,Rampage,Brad Peyton,Dwayne Johnson,Naomie Harris,Malin Akerman,Action Adventure Sci-Fi,"Primatologist Davis Okoye shares an unshakable bond with George, the extraordinarily intelligent, silverback gorilla who has been in his care since birth.  But a rogue genetic experiment gone awry mutates this gentle ape into a raging creature of enormous size.  To make matters worse, it√É¬¢√Ç¬Ä√Ç¬ôs soon discovered there are other similarly altered animals.  As these newly created alpha predators tear across North America, destroying everything in their path, Okoye teams with a discredited genetic engineer to secure an antidote, fighting his way through an ever-changing battlefield, not only to halt a global catastrophe but to save the fearsome creature that was once his friend.",6.1,181341,2018
460019,Truth or Dare,Jeff Wadlow,Lucy Hale,Tyler Posey,Violett Beane,Thriller Horror,"A harmless game of ""Truth or Dare"" among friends turns deadly when someone√É¬¢√Ç¬Ä√Ç¬îor something√É¬¢√Ç¬Ä√Ç¬îbegins to punish those who tell a lie√É¬¢√Ç¬Ä√Ç¬îor refuse the dare.",5.2,61798,2018
453278,The Rider,ChloÈ Zhao,Brady Jandreau,Tim Jandreau,Lilly Jandreau,Drama Western,"Once a rising star of the rodeo circuit, and a gifted horse trainer, young cowboy Brady is warned that his riding days are over after a horse crushed his skull at a rodeo. In an attempt to regain control of his own fate, Brady undertakes a search for a new identity and what it means to be a man in the heartland of the United States.",7.4,20358,2018
433694,Sgt. Stubby: An American Hero,Richard Lanni,Logan Lerman,Helena Bonham Carter,Gerard Depardieu,Animation Adventure Family History War,The true story of the most decorated dog in American military history -- Sgt. Stubby -- and the enduring bonds he forged with his brothers-in-arms in the trenches of World War I.,6.9,2500,2018
460668,I Feel Pretty,Marc Silverstein,Amy Schumer,Michelle Williams,Emily Ratajkowski,Comedy Romance,A head injury causes a woman to develop an extraordinary amount of confidence and believe she's drop dead gorgeous.,5.6,56551,2018
50022,Super Troopers 2,Jay Chandrasekhar,Jay Chandrasekhar,Paul Soter,Steve Lemme,Comedy Crime Mystery,"When an international border dispute arises between the U.S. and Canada, the Super Troopers- Mac, Thorny, Foster, Rabbit and Farva, are called in to set up a new Highway Patrol station in the disputed area.",6,27992,2018
473149,Traffik,Deon Taylor,Paula Patton,Omar Epps,Missi Pyle,Horror Thriller,"A couple off for a romantic weekend in the mountains are accosted by a biker gang. Alone in the mountains, Brea and John must defend themselves against the gang, who will stop at nothing to protect their secrets.",5.9,21245,2018
433503,The House of Tomorrow,Peter Livolsi,Asa Butterfield,Nick Offerman,Ellen Burstyn,Drama Comedy,"The film tells futurist, architect, and inventor R. Buckminster Fuller's incredible story through two teens hoping to get laid, become punk gods, and survive high school.",6.2,2350,2018
482150,Liz and the Blue Bird,Naoko Yamada,Atsumi Tanezaki,Nao Toyama,Miyu Honda,Animation Drama Music,"Mizore Yoroizuka plays the oboe, and Nozomi Kasaki plays the flute in Kitauji High School concert band. As seniors, this will be their last competition together, and the selected piece ""Liz and the Blue Bird"" features a duet for the oboe and flute. ""This piece reminds me of us."" Nozomi says cheerfully, enjoying the solo, while Mizore's usual happiness to play with Nozomi is tinged with the dread of their inevitable parting. By all accounts the girls are best friends, but the oboe and flute duet sounds disjointed, as if underscoring a growing distance between them. Talk of college creates a small rift in their relationship, as the story evolves to reveal a shocking and emotional conclusion.",7.1,2098,2018
299536,Avengers: Infinity War,Anthony Russo,Robert Downey Jr.,Chris Hemsworth,Mark Ruffalo,Adventure Action Sci-Fi,"As the Avengers and their allies have continued to protect the world from threats too large for any one hero to handle, a new danger has emerged from the cosmic shadows: Thanos. A despot of intergalactic infamy, his goal is to collect all six Infinity Stones, artifacts of unimaginable power, and use them to inflict his twisted will on all of reality. Everything the Avengers have fought for has led up to this moment - the fate of Earth and existence itself has never been more uncertain.",8.4,1170647,2018
419743,Disobedience,Sebasti·n Lelio,Rachel Weisz,Rachel McAdams,Alessandro Nivola,Drama Romance,"A woman learns about the death of her Orthodox Jewish father, a rabbi. She returns home and has romantic feelings rekindled for her best childhood friend, who is now married to her cousin.",6.6,34790,2018
476678,Backstabbing for Beginners,Per Fly,Ben Kingsley,Theo James,Jacqueline Bisset,Thriller Drama History,An idealistic young employee at the U.N. investigates the grizzly murder of his predecessor √É¬¢√Ç¬Ä√Ç¬ì and uncovers a vast global conspiracy that may involve his own boss.,6.3,5759,2018
408873,Kings,Deniz Gamze Erg√ºven,Halle Berry,Daniel Craig,Lamar Johnson,Romance Drama Crime,A foster family in South Central a few weeks before the city erupts in violence following the verdict of the Rodney King trial in 1992.,5.1,3798,2018
10780,Overboard,Rob Greenberg,Anna Faris,Eugenio Derbez,Eva Longoria,Comedy Romance,"Heiress Joanna Stayton hires carpenter Dean Proffitt to build a closet on her yacht√É¬¢√Ç¬Ä√Ç¬îand refuses to pay him for the project when it's done. But after Joanna accidentally falls overboard and loses her memory, Dean sees an opportunity to get even.",6,40592,2018
400579,Tully,Jason Reitman,Charlize Theron,Mackenzie Davis,Mark Duplass,Comedy Drama,"Marlo, a mother of three, including a newborn, is gifted a night nanny by her brother. Hesitant at first, she quickly forms a bond with the thoughtful, surprising, and sometimes challenging nanny named Tully.",6.9,62282,2018
467632,Bad Samaritan,Dean Devlin,David Tennant,Robert Sheehan,Carlito Olivero,Thriller Crime Horror,"A thief makes a disturbing discovery in the house where he breaks in. Later, when he returns to the same house with his partner in crime, things are no longer how he expected.",6.4,25552,2018
298096,The Cleanse,Bobby Miller,Johnny Galecki,Anna Friel,Oliver Platt,Drama Comedy Fantasy Horror,"The story of a heartbroken man who attends a spiritual retreat, only to discover that the course releases more than everyday toxins and traumatic experiences.",5.1,4017,2018
447365,The Guardians,Xavier Beauvois,Nathalie Baye,Laura Smet,Iris Bry,Sci-Fi Adventure Action,"Peter Quill, still reeling from the loss of Gamora, must rally his team around him to defend the universe along with protecting one of their own. A mission that, if not completed successfully, could quite possibly lead to the end of the Guardians as we know them.",8.4,117,2018
399796,Life of the Party,Ben Falcone,Melissa McCarthy,Maya Rudolph,Molly Gordon,Comedy,"When her husband suddenly dumps her, longtime dedicated housewife Deanna turns regret into re-set by going back to college... landing in the same class and school as her daughter, who's not entirely sold on the idea. Plunging headlong into the campus experience, the increasingly outspoken Deanna √É¬¢√Ç¬Ä√Ç¬ì now Dee Rock √É¬¢√Ç¬Ä√Ç¬ì embraces freedom, fun and frat boys on her own terms, finding her true self in a senior year no one ever expected.",5.6,38947,2018
497814,Breaking In,James McTeigue,Gabrielle Union,Billy Burke,Richard Cabral,Thriller Crime Action,"Shaun Russell takes her son and daughter on a weekend getaway to her late father's secluded, high-tech vacation home in the countryside. The family soon gets an unwelcome surprise when four men break into the house to find hidden money. After managing to escape, Shaun must now figure out a way to turn the tables on the desperate thieves and save her captive children.",5.5,16618,2018
341735,The Seagull,Michael Mayer,Saoirse Ronan,Annette Bening,Corey Stoll,Drama Romance Comedy,"At a picturesque lakeside estate, a love triangle unfolds between the legendary diva Irina, her lover Boris, and the ing√É¬É√Ç¬©nue Nina.",5.7,3887,2018
385332,Terminal,Vaughn Stein,Margot Robbie,Simon Pegg,Dexter Fletcher,Crime Drama Thriller,"In the dark heart of a sprawling, anonymous city, two assassins carry out a sinister mission, a teacher battles a fatal illness, and an enigmatic janitor and a curious waitress lead dangerous double lives.  Murderous consequences unravel in the dead of night, as their lives intertwine at the hands of a mysterious criminal mastermind who is hell-bent on revenge.",5.3,24455,2018
467938,Revenge,Coralie Fargeat,Matilda Lutz,Kevin Janssens,Vincent Colombe,Action Thriller Horror,Jen's romantic getaway with her wealthy married boyfriend is disrupted when his friends arrive for an impromptu hunting trip. Tension mounts at the house until the situation culminates in an unexpected way.,6.4,47278,2018
383498,Deadpool 2,David Leitch,Ryan Reynolds,Josh Brolin,Zazie Beetz,Action Comedy Adventure,Wisecracking mercenary Deadpool battles the evil and powerful Cable and other bad guys to save a boy's life.,7.6,626048,2018
1010826,Book Club,Bill Holderman,Jane Fonda,Candice Bergen,Mary Steenburgen,Horror Thriller,"Eight horror-loving friends fight for their lives when a killer clown who seems to know the grim secret they share begins to pick them off, one by one.",6.1,31709,2018
458737,First Reformed,Paul Schrader,Ethan Hawke,Amanda Seyfried,Cedric the Entertainer,Drama,A pastor of a small church in upstate New York starts to spiral out of control after a soul-shaking encounter with an unstable environmental activist and his pregnant wife.,7.1,61415,2018
505205,Pope Francis: A Man of His Word,Wim Wenders,Pope Francis,Recep tayyip Erdogan,John Kerry,Documentary,"Pope Francis responds to questions from around the world, discussing topics including ecology, immigration, consumerism and social justice.",6.6,2347,2018
425148,Show Dogs,Raja Gosnell,Will Arnett,Natasha Lyonne,Ludacris,Adventure Crime Family Comedy,"Max, a macho, solitary Rottweiler police dog is ordered to go undercover as a primped show dog in a prestigious Dog Show, along with his human partner, to avert a disaster from happening.",3.9,4990,2018
348350,Solo: A Star Wars Story,Ron Howard,Alden Ehrenreich,Woody Harrelson,Emilia Clarke,Sci-Fi Adventure Action,"Through a series of daring escapades deep within a dark and dangerous criminal underworld, Han Solo meets his mighty future copilot Chewbacca and encounters the notorious gambler Lando Calrissian.",6.9,371715,2018
341689,How to Talk to Girls at Parties,John Cameron Mitchell,Elle Fanning,Alex Sharp,Nicole Kidman,Comedy Music Romance Sci-Fi,"In 1970s London, a teenage outsider named Enn falls in love with a rebellious alien girl named Zan, who has come to Earth for a party. Together, they navigate the complexities of intergalactic culture and the trials of first love.",5.7,12131,2018
417643,In Darkness,Anthony Byrne,Natalie Dormer,Emily Ratajkowski,Ed Skrein,Thriller Mystery,A blind musician hears a murder committed in the apartment upstairs from hers that sends her down a dark path into London's gritty criminal underworld.,5.8,14103,2018
440038,The Misandrists,Bruce LaBruce,Susanne Sach√É¬É√Ç¬üe,Viva Ruiz,Kembra Pfahler,Drama,"In Germany, when an army of radical females is preparing for a final revolution and a utopian world without men, a young male soldier arrives seeking refuge at the convent.",5,527,2018
411135,Future World,James Franco,James Franco,Suki Waterhouse,Jeffrey Wahlberg,Sci-Fi,A young boy searches a future world wasteland for a rumored cure for his dying mother.,3.3,6736,2018
454283,Action Point,Tim Kirkby,Johnny Knoxville,Chris Pontius,Dan Bakkedahl,Comedy,A daredevil designs and operates his own theme park with his friends.,5.1,12066,2018
429300,Adrift,Baltasar Korm√É¬°kur,Shailene Woodley,Sam Claffin,Jeffrey Thomas,Thriller Romance Adventure,"Tami Oldham and Richard Sharp couldn't anticipate that they would be sailing directly into one of the most catastrophic hurricanes in recorded history. In the aftermath of the storm, Tami awakens to find Richard badly injured and their boat in ruins. With no hope of rescue, Tami must now find the strength and determination to save herself and the only man she has ever loved.",6.6,60586,2018
500664,Upgrade,Leigh Whannell,Logan Marshall-Green,Betty Gabriel,Harrison Gilbertson,Action Thriller Sci-Fi,"A brutal mugging leaves Grey Trace paralyzed in the hospital and his beloved wife dead. A billionaire inventor soon offers Trace a cure √É¬¢√Ç¬Ä√Ç¬î an artificial intelligence implant called STEM that will enhance his body. Now able to walk, Grey finds that he also has superhuman strength and agility √É¬¢√Ç¬Ä√Ç¬î skills he uses to seek revenge against the thugs who destroyed his life.",7.5,201156,2018
489931,American Animals,Bart Layton,Evan Peters,Barry Keoghan,Blake Jenner,Drama Crime Documentary,"Lexington, Kentucky, 2004. Four young men attempt to execute one of the most audacious art heists in the history of the United States.",7,48162,2018
506407,Social Animals,Theresa Bennett,No√É¬´l Wells,Josh Radnor,Aya Cash,Comedy Romance,"Determined not to turn into her parents, or be drawn into any relationship longer than a one night stand, Zoe constantly struggles with her failing business and love life. Then she falls in love for the first time with Paul. But there's one problem: Paul is married.",5.3,1940,2018
402900,Ocean's 8,Gary Ross,Sandra Bullock,Cate Blanchett,Anne Hathaway,Crime Comedy Action,"Debbie Ocean, a criminal mastermind, gathers a crew of female thieves to pull off the heist of the century at New York's annual Met Gala.",7.1,21,2018
490003,Won't You Be My Neighbor?,Morgan Neville,Fre Rogers,Joanne Rogers,Francois Scarborough Clemmons,Documentary,"For more than thirty years, and through his television program, Fred Rogers (1928-2003), host, producer, writer and pianist, accompanied by his puppets and his many friends, spoke directly to young children about some of life's most important issues.",8.3,26769,2018
493922,Hereditary,Ari Aster,Toni Collette,Alex Wolff,Milly Shapiro,Horror Mystery Thriller,"When Ellen, the matriarch of the Graham family, passes away, her daughter's family begins to unravel cryptic and increasingly terrifying secrets about their ancestry.",7.3,362923,2018
406761,Hotel Artemis,Drew Pearce,Jodie Foster,Sterling K. Brown,Sofia Boutella,Thriller Sci-Fi Action,"Los Angeles, June 21st, 2028. While the streets are being torn apart by riots, the Nurse, who runs a clandestine hospital for criminals in the penthouse of the Artemis, a closed old hotel, has a rough night dealing with troublemaker clients: thieves, assassins, someone from the past and the one who owns the place and the whole city.",6.1,57106,2018
500475,Superfly,Director X,Trevor Jackson,Jason Mitchell,Michael K. Williams,Action Crime,"Career criminal Youngblood Priest wants out of the Atlanta drug scene, but as he ramps up sales, one little slip up threatens to bring the whole operation down before he can make his exit.",5.2,7523,2018
260513,Incredibles 2,Brad Bird,Craig T. Nelson,Holly Hunter,Sarah Vowell,Action Adventure Animation Family,"Elastigirl springs into action to save the day, while Mr. Incredible faces his greatest challenge yet √É¬¢√Ç¬Ä√Ç¬ì taking care of the problems of his three children.",7.6,321877,2018
455980,Tag,Jeff Tomsic,Ed Helms,Jeremy Renner,Jon Hamm,Comedy Action,"For one month every year, five highly competitive friends hit the ground running in a no-holds-barred game of tag they√É¬¢√Ç¬Ä√Ç¬ôve been playing since the first grade. This year, the game coincides with the wedding of their only undefeated player, which should finally make him an easy target. But he knows they√É¬¢√Ç¬Ä√Ç¬ôre coming...and he√É¬¢√Ç¬Ä√Ç¬ôs ready.",6.5,143314,2018
391714,On Chesil Beach,Dominic Cooke,Saoirse Ronan,Billy Howle,Emily Watson,Drama Romance,"In 1962 England, a young couple finds their idyllic romance colliding with issues of sexual freedom and societal pressure, leading to an awkward and fateful wedding night.",6.3,12155,2018
14786,Gotti,Kevin Connolly,John Travolta,Kelly Preston,Stacy Keach,Crime Drama TV Movie,"John Gotti, the head of a small New York mafia crew breaks a few of the old family rules. He rises to become the head of the Gambino family and the most well-known mafia boss in America. Life is good, but suspicion creeps in, and greed, rule-breaking and his high public profile all threaten to topple him.",4.8,16751,2018
351286,Jurassic World: Fallen Kingdom,J.A. Bayona,Chris Pratt,Bryce Dallas Howard,Rafe Spall,Action Adventure Sci-Fi Thriller,"Three years after Jurassic World was destroyed, Isla Nublar now sits abandoned. When the island's dormant volcano begins roaring to life, Owen and Claire mount a campaign to rescue the remaining dinosaurs from this extinction-level event.",6.1,336968,2018
447682,Boundaries,Shana Feste,Vera Farmiga,Christopher Plummer,Lewis MacDougall,Comedy Drama,"Single mom Laura, along with her awkward 14 year-old son Henry is forced to drive Jack, her estranged, care-free pot dealing father across country after he's kicked out of yet another nursing home.",5.6,2539,2018
414018,Damsel,David Zellner,Robert Pattinson,Mia Wasikowska,David Zellner,Western Drama Comedy,"Oregon, a small town near the sea, around 1870. Henry, a grieving man who aspires to preach as a way to overcome his unfortunate past, reunites with eccentric pioneer Samuel Alabaster, who has hired him to officiate at his marriage to the precious Penelope. What Henry ignores is that both must embark on a dangerous journey through the inhospitable wilderness to meet her.",5.6,5743,2018
426814,The Domestics,Mike P. Nelson,Tyler Hoechlin,Kate Bosworth,Lance Reddick,Thriller Horror,A young husband and wife must fight to return home in a post-apocalyptic mid-western landscape ravaged by gangs.,5.7,10509,2018
400535,Sicario: Day of the Soldado,Stefano Sollima,Benicio del Toro,Josh Brolin,Isabela Moner,Action Crime Thriller,Agent Matt Graver teams up with operative Alejandro Gillick to prevent Mexican drug cartels from smuggling terrorists across the United States border.,7.1,162143,2018
443463,Leave No Trace,Debra Granik,Ben Foster,Thomasin McKenzie,Jeff Kober,Drama,"A father and daughter live a perfect but mysterious existence in Forest Park, a beautiful nature reserve near Portland, Oregon, rarely making contact with the world. But when a small mistake tips them off to authorities, they are sent on an increasingly erratic journey in search of a place to call their own.",7.1,63805,2018
690375,Love All You Have Left,Matt Sivertson,Caroline Amiguet,Sara Wolfkind,Michael Christopher Shantz,Drama,"After her daughter is killed in a school shooting, Juliette discovers a girl in her attic who claims to be Anne Frank.",7.1,97,2018
474335,Uncle Drew,Charles Stone III,Kyrie Irving,Lil Rel Howery,Shaquille O'Neal,Comedy,Uncle Drew recruits a squad of older basketball players to return to the court to compete in a tournament.,5.8,15444,2018
396373,Woman Walks Ahead,Susanna White,Jessica Chastain,Michael Greyeyes,Chaske Spencer,Drama History Western,"Based on a true story, this riveting western follows a headstrong New York widow as she journeys west to meet Sioux chief Sitting Bull, facing off with an army officer intent on war with Native Americans.",6.7,8236,2018
448561,Who's Watching Oliver,Richie Moore,Russell Geoffrey Banks,Sara Malakul Lane,Margaret Roche,Horror TV Movie,The story of a mentally unstable loner lost in a life forced upon him. By night Oliver aimlessly wanders the streets and bars on what can only be described as a truly shocking and humiliating killing spree. His only savior and possible way out of a life he is desperate to escape comes in the form of the beautiful Sophia with her sweet eccentricity and naivety to the danger she has put herself in.,5.1,1227,2018
442249,The First Purge,Gerard McMurray,Y'lan Noel,Lex Scott Davis,Joivan Wade,Horror Action Thriller,"To push the crime rate below one percent for the rest of the year, the New Founding Fathers of America test a sociological theory that vents aggression for one night in one isolated community. But when the violence of oppressors meets the rage of the others, the contagion will explode from the trial-city borders and spread across the nation.",5.2,69012,2018
640146,Ant-Man and the Wasp,Peyton Reed,Paul Rudd,Evangeline Lilly,Michael Pe√É¬±a,Action Adventure Sci-Fi,"Super-Hero partners Scott Lang and Hope van Dyne, along with with Hope's parents Janet van Dyne and Hank Pym, and Scott's daughter Cassie Lang, find themselves exploring the Quantum Realm, interacting with strange new creatures and embarking on an adventure that will push them beyond the limits of what they thought possible.",7,439741,2018
424781,Sorry to Bother You,Boots Riley,Lakeith Stanfield,Tessa Thompson,Armie Hammer,Fantasy Sci-Fi Comedy,"In an alternate present-day version of Oakland, black telemarketer Cassius Green discovers a magical key to professional success √É¬¢√Ç¬Ä√Ç¬ì which propels him into a macabre universe.",6.9,86152,2018
507256,Whitney,Kevin MacDonald,Whitney Houston,Bobby Brown,Cissy Houston,Music Documentary,"Examines the life and career of singer Whitney Houston. Features never-before-seen archival footage, exclusive recordings, rare performances and interviews with the people who knew her best.",7.3,7776,2018
400155,Hotel Transylvania 3: Summer Vacation,Genndy Tartakovsky,Adam Sandler,Andy Samberg,Selena Gomez,Animation Comedy Family Fantasy,"Dracula, Mavis, Johnny and the rest of the Drac Pack take a vacation on a luxury Monster Cruise Ship, where Dracula falls in love with the ship√É¬¢√Ç¬Ä√Ç¬ôs captain, Ericka, who√É¬¢√Ç¬Ä√Ç¬ôs secretly a descendant of Abraham Van Helsing, the notorious monster slayer.",6.3,82621,2018
447200,Skyscraper,Rawson Marshall Thurber,Dwayne Johnson,Neve Campbell,Chin Han,Action Thriller,"Framed and on the run, a former FBI agent must save his family from a blazing fire in the world's tallest building.",5.8,130928,2018
